STAT,Design and Analysis of Experiments,STA305H1-S,Delivery instructions,Note:,Some of the scheduled in-person lectures may be offered online depending on current public health and institutional guidelines.,"Experiments vs observational studies, experimental units. Designs with one source of variation. Complete randomized designs and randomized block designs. Factorial designs. Inferences for contrasts and means. Model assumptions. Crossed and nested treatment factors, random effects models. Analysis of variance and covariance. Sample size calculations.",STA302H1/STAC67H3/STA302H5,Prerequisite:,"STAC50H3, STAC53H3, STA305H5",Exclusion:,Science,Distribution Requirement:,Room,LEC0101,Monday,—,11:00,12:00,ES 1050,"Singh, M.",of  available,93,250,Yes: 0 student,In Person (See Delivery Instructions.),,ES 1050,MS 3154,,OI G162,,Wednesday,The Physical and Mathematical Universes (5),Breadth Requirement:,https://map.utoronto.ca/?id=1809#!m/494499,"Details about the course meeting schedule, as well as other course activities and assessments, will be communicated in the course syllabus and/or on Quercus.",Priority (P),Enrolment Controls:,"Priority enrolment is given to the groups of students listed below until July 28. There is no course enrolment on July 29. Beginning July 30, all other Arts & Science students can enrol in this section. UTM/UTSC students can enrol in this section starting August 6. The following groups of students are given priority access until July 28:",ASSPE1687 SP DATA SCI,ASSPE2270 SP STATISTICAL SCI: METH & PRA,—,11:00,13:00,https://map.utoronto.ca/?id=1809#!m/494563
SMC,Scripture in Christian Tradition,CHC307H1-S,,,,The formation and content of the Christian Bible; an introduction to the history of its interpretation and of the role it has played and continues to play in Christian life and culture.,4.0 credits,Prerequisite:,"SMC307Y1, SMC307H1",Exclusion:,"CHC203Y1, CHC215H1",Recommended Preparation:,Room,LEC0101,Wednesday,—,15:00,17:00,TF 103,"Donovan, D.",of  available,4,20,Yes: 0 student,In Person,,,,,,,,Humanities,Distribution Requirement:,https://map.utoronto.ca/?id=1809#!m/494581,,,,,,,,,,
SMC,Open Topics in Book & Media Studies,BMS311H1-S,Timetable instructions,Note:,"This course examines the relationship between technological forms and human perception and behavior through evaluating the capacities of different communication technologies to mediate artistic expression. While the aesthetics of communication will be explored historically, beginning with oral cultures, particular emphasis will be placed on the mechanization of aesthetic communication from print to digital environments.",This course is reserved for unique topics not already covered in other courses. The exact topic will change depending on the instructor.,Completion of 9.0 credits,Prerequisite:,Humanities,Distribution Requirement:,,,Room,LEC0101,Monday,—,14:00,16:00,CR 404,"Pugen, A.",of  available,0,50,Yes: 5 students,In Person,Subtitle,,,,,,,,,https://map.utoronto.ca/?id=1809#!m/494580,,Priority (P),Enrolment Controls:,"Priority enrolment is given to the groups of students listed below until July 28. There is no course enrolment on July 29. Beginning July 30, all other Arts & Science students can enrol in this section. UTM/UTSC students can enrol in this section starting August 6. The following groups of students are given priority access until July 28:",ASMAJ1300 MA BOOK & MEDIA STUDIES,ASMIN1300 MI BOOK & MEDIA STUDIES,,,,
SMC,Catholic Education in Ontario,CHC313H1-S,,,,"An historical appraisal of the evolution of Catholic schools, universities, and catechetical education in Ontario. Special emphasis is placed on the evolution of Ontario's separate school system.",4.0 credits,Prerequisite:,SMC313H1,Exclusion:,Humanities,Distribution Requirement:,Room,LEC0101,Thursday,—,14:00,16:00,TF 101,"McGowan, M.",of  available,0,25,Yes: 0 student,In Person,,,,,,,,Society and its Institutions (3),Breadth Requirement:,https://map.utoronto.ca/?id=1809#!m/494581,,,,,,,,,,
SMC,Media Revolutions,BMS314H1-S,,,,"This class offers a deeper examination of the intersections of technology and human thought, perception and culture. The advent of new media technologies, from literacy through to social media, will be examined as revolutions in technology, semantic fields of cultural meaning-making and human action. Students gain a strong focus on technological advancements as insights into cross-cultural change at significant turning points in book and media history.","(BMS100H1, BMS200Y1, BMS201H1) or SMC219Y1",Prerequisite:,SMC314H1,Exclusion:,Humanities,Distribution Requirement:,Room,LEC0101,Wednesday,—,10:00,12:00,CR 403,"Gildea, I.",of  available,0,50,Yes: 10 students,In Person,,,,,,,,Society and its Institutions (3),Breadth Requirement:,https://map.utoronto.ca/?id=1809#!m/494580,,Priority (P),Enrolment Controls:,"Priority enrolment is given to the groups of students listed below until July 28. There is no course enrolment on July 29. Beginning July 30, all other Arts & Science students can enrol in this section. UTM/UTSC students can enrol in this section starting August 6. The following groups of students are given priority access until July 28:",ASMAJ1300 MA BOOK & MEDIA STUDIES,ASMIN1300 MI BOOK & MEDIA STUDIES,,,,
STAT,Statistical Methods for Machine Learning I,STA314H1-F,Delivery instructions,Note:,"Lectures will be delivered online and tutorials will be offered in-person or online depending on the tutorial section in which you enrol.  Details about the course meeting schedule, as well as other course activities and assessments, will be communicated in the course syllabus and/or on Quercus.","Statistical methods for supervised and unsupervised learning from data: training error, test error and cross-validation; classification, regression, and logistic regression; principal components analysis; stochastic gradient descent; decision trees and random forests; k-means clustering and nearest neighbour methods. Computational tutorials will support the efficient application of these methods.","STA238H1/STA248H1/STA255H1/STA261H1/STAB57H3/STA260H5/STA258H5/ECO227Y1; CSC108H1/CSC110Y1/CSC120H1/CSC148H1/CSCA08H3/CSCA48H3/CSCA20H3/CSC108H5/CSC148H5; MAT223H1/MAT240H1/MATA22H3/MATA23H3/MAT223H5/MAT240H5; MAT235Y1/MAT237Y1/MAT257Y1/(MATB41H3, MATB42H3)/(MAT232H5, MAT236H5)/(MAT233H5, MAT236H5)",Prerequisite:,STA302H1/STA302H5/STAC67H3,Corequisite:,"CSC411H1, CSC311H1, STA314H5, STA315H5, CSCC11H3, CSC411H5",Exclusion:,Room,LEC0101,Monday,—,13:00,16:00,—,"Maddison, C.",of  available,0,200,Yes: 0 student,Online - Synchronous (See Delivery Instructions.),Activity,Monday,—,—,—,—,Friday,The Physical and Mathematical Universes (5),Breadth Requirement:,https://map.utoronto.ca/?id=1809#!m/494470,All assessments will be completed online.,Priority (P),Enrolment Controls:,"Priority enrolment is given to the groups of students listed below until July 28. There is no course enrolment on July 29. Beginning July 30, all other Arts & Science students can enrol in this section. UTM/UTSC students can enrol in this section starting August 6. The following groups of students are given priority access until July 28:",ASSPE0608 SP ACTUARIAL SCIENCE,ASSPE1687 SP DATA SCI,—,10:00,13:00,
SMC,Social Media & Digital Platforms,BMS316H1-F,,,,"Social media, digital platforms, and networked technologies are deeply embedded in our contemporary lives, both shaping and shaped by users. But what are their social, cultural, political, and economic impacts? What consequences do they have for how we think, feel, socialize, work, play, and understand ourselves? Students in this course will explore, examine, and debate these questions with reference to their everyday experiences and current examples.","(BMS100H1, BMS200Y1, BMS201H1) or SMC219Y1",Prerequisite:,SMC316H1,Exclusion:,Humanities,Distribution Requirement:,Room,LEC0101,Thursday,—,10:00,12:00,CR 403,"Saeedi, P.",of  available,0,50,Yes: 0 student,In Person,,,,,,,,Creative and Cultural Representations (1),Breadth Requirement:,https://map.utoronto.ca/?id=1809#!m/494580,,Priority (P),Enrolment Controls:,"Priority enrolment is given to the groups of students listed below until July 28. There is no course enrolment on July 29. Beginning July 30, all other Arts & Science students can enrol in this section. UTM/UTSC students can enrol in this section starting August 6. The following groups of students are given priority access until July 28:",ASMAJ1300 MA BOOK & MEDIA STUDIES,ASMIN1300 MI BOOK & MEDIA STUDIES,,,,
SMC,Social Media & Digital Platforms,BMS316H1-S,,,,"Social media, digital platforms, and networked technologies are deeply embedded in our contemporary lives, both shaping and shaped by users. But what are their social, cultural, political, and economic impacts? What consequences do they have for how we think, feel, socialize, work, play, and understand ourselves? Students in this course will explore, examine, and debate these questions with reference to their everyday experiences and current examples.","(BMS100H1, BMS200Y1, BMS201H1) or SMC219Y1",Prerequisite:,SMC316H1,Exclusion:,Humanities,Distribution Requirement:,Room,LEC0101,Thursday,—,15:00,17:00,CR 403,,of  available,0,50,Yes: 20 students,In Person,,,,,,—,,Creative and Cultural Representations (1),Breadth Requirement:,https://map.utoronto.ca/?id=1809#!m/494580,,Priority (P),Enrolment Controls:,"Priority enrolment is given to the groups of students listed below until July 28. There is no course enrolment on July 29. Beginning July 30, all other Arts & Science students can enrol in this section. UTM/UTSC students can enrol in this section starting August 6. The following groups of students are given priority access until July 28:",ASMAJ1300 MA BOOK & MEDIA STUDIES,ASMIN1300 MI BOOK & MEDIA STUDIES,,,,
SMC,Media Ethics,BMS319H1-S,,,,"Provides students with a theoretical foundation that enables them to identify and analyze ethical issues in mainstream and non-mainstream media. Traditional principles of journalistic truth-seeking, objectivity, and minimizing harm are revisited in the light of global, interactive media, produced by both citizens and professionals.","(BMS100H1, BMS200Y1, BMS201H1) or SMC219Y1",Prerequisite:,SMC319H1,Exclusion:,Humanities,Distribution Requirement:,Room,LEC0101,Wednesday,—,12:00,14:00,CR 405,,of  available,0,68,Yes: 7 students,In Person,,,,,,—,,"Thought, Belief and Behaviour (2)",Breadth Requirement:,https://map.utoronto.ca/?id=1809#!m/494580,,Priority (P),Enrolment Controls:,"Priority enrolment is given to the groups of students listed below until July 28. There is no course enrolment on July 29. Beginning July 30, all other Arts & Science students can enrol in this section. UTM/UTSC students can enrol in this section starting August 6. The following groups of students are given priority access until July 28:",ASMAJ1300 MA BOOK & MEDIA STUDIES,ASMIN1300 MI BOOK & MEDIA STUDIES,,,,
SPA,Latin American Thought,LAS320H1-F,,,,"This seminar-style course explores critical thinking about culture, history, politics, and society by some of the most influential Latin American intellectuals of the 20th and 21st centuries. Emphasis on theoretical contributions, in English translation, of Latin American thinkers such as Rodó, Vasconcelos, Mariategui, Zea, Dussel, García Canclini, Cornejo Polar, Quijano and Lugones. Topics covered include questing identities, cultural diversity, indigenism, liberation theology, colonialism, neocolonialism, postcolonialism, coloniality, and decoloniality. Readings and seminar discussions in English.",LAS200H1 + LAS201H1,Prerequisite:,"Thought, Belief and Behaviour (2)",Breadth Requirement:,,,Room,LEC0101,Thursday,—,14:00,16:00,OI 2296,"Rivas, V.",of  available,17,25,Yes: 0 student,In Person,,,,,,,,,,https://map.utoronto.ca/?id=1809#!m/494563,,,,,,,,,,
SPA,Advanced Portuguese,PRT320Y1-Y,Delivery instructions,Note:,It is recommended that students have a computer with a microphone and camera in order to participate in online activities.,Intensive practice in written and oral Portuguese for the advanced student. Selective review of grammar with emphasis on complex language structures.,"PRT120Y1, PRT220Y1 or placement test",Prerequisite:,"PRT219Y1, PRT420H1",Exclusion:,Humanities,Distribution Requirement:,,LEC0101,Monday,—,13:00,15:00,—,"Rinaldi da Silva, N.",of  available,19,24,Yes: 0 student,Online - Synchronous (See Delivery Instructions.),Activity,Wednesday,—,—,,,,Creative and Cultural Representations (1),Breadth Requirement:,,,,,,,,,,,
SPA,Advanced Spanish,SPA320Y1-Y,Timetable instructions,Note:,Students MUST enroll in a tutorial section according to their lecture. Students who enroll in a tutorial that does not correspond with their lecture WILL be moved.,Advanced Spanish for non-natives. Selective review of grammar with emphasis on the complex sentence; intensive practice in written and oral expression to improve proficiency.,SPA120Y1 or SPA220Y1 or placement test.,Prerequisite:,SPA219Y1/SPA319Y1,Exclusion:,Humanities,Distribution Requirement:,,LEC0201,Monday,—,12:00,13:00,—,"Ramirez-Salazar, M.",of  available,21,40,Yes: 0 student,Online - Synchronous (See Delivery Instructions.),Activity,Tuesday,—,—,NF 205,—,Wednesday,Creative and Cultural Representations (1),Breadth Requirement:,https://map.utoronto.ca/?id=1809#!m/494600,It is recommended that students have a computer with a microphone and camera in order to participate in online activities.,,,,,,—,12:00,13:00,https://map.utoronto.ca/?id=1809#!m/494600
SPA,Introduction to Portuguese Linguistics,PRT322H1-F,,,,"An overview of theoretical and methodological aspects of Portuguese linguistics: phonology, morphology, syntax, and semantics. Analysis of structural similarities and differences between the two worldwide main Portuguese varieties - Brazilian and European Portuguese.",PRT219Y1 or PRT220Y1 or PRT120Y1 or Permission of the Department,Prerequisite:,PRT320Y1,Corequisite:,PRT320Y1,Recommended Preparation:,Room,LEC5101,Thursday,—,18:00,20:00,NF 009,"Rinaldi da Silva, N.",of  available,13,20,Yes: 0 student,In Person,,,,,,,,Humanities,Distribution Requirement:,https://map.utoronto.ca/?id=1809#!m/494600,,,,,,,,,,
SPA,Introduction to Hispanic Linguistics,SPA322H1-S,,,,"The basic concepts and analytic tools of linguistics applied to the study of Spanish, with a focus on the Spanish phonological, morphological, and syntactic systems. Theoretical discussion and practical exercises in analytic techniques.",SPA120Y1 or SPA220Y1 or SPA219Y1; or instructor's permission,Prerequisite:,SPA221H1,Recommended Preparation:,Humanities,Distribution Requirement:,Room,LEC0101,Tuesday,—,10:00,12:00,NF 006,"Cuervo, M.",of  available,9,30,Yes: 0 student,In Person,,,,,NF 006,,Wednesday,"Thought, Belief and Behaviour (2)",Breadth Requirement:,https://map.utoronto.ca/?id=1809#!m/494600,,,,,,,—,11:00,12:00,https://map.utoronto.ca/?id=1809#!m/494600
SMC,Mediaeval Latin Prose,MST323H1-F,,,,"Comprising an immersion in Mediaeval Latin prose texts, this course gives students a deepened acquaintance with the linguistic features of Mediaeval Latin, as well as with its literature, and generic and stylistic conventions. A solid foundation in basic Latin morphology, syntax and vocabulary is assumed.",LAT202H1/MST222H1,Prerequisite:,SMC323H1,Exclusion:,Humanities,Distribution Requirement:,Room,LEC0101,Thursday,—,11:00,13:00,AH 402,"More, A.",of  available,10,14,Yes: 0 student,In Person,,,,,,,,Creative and Cultural Representations (1),Breadth Requirement:,https://map.utoronto.ca/?id=1809#!m/494578,,,,,,,,,,
SPA,Business Portuguese,PRT323H1-S,,,,"An advanced level business Portuguese course covering topics on international relations, politics, legal and culture. This course aims to enhance written and oral expressions in Portuguese through content focusing on the language that is used in official, diplomatic, and financial situations. Through the analysis of case studies, newspapers and videos, students will be introduced to the business cultures and intercultural communication of the Portuguese-speaking world.","PRT120Y1, PRT220Y1 or proof of comparable Portuguese level",Prerequisite:,PRT219Y1/PRT320Y1 or proof of comparable Portuguese level,Corequisite:,Humanities,Distribution Requirement:,Room,LEC0101,Monday,—,10:00,12:00,NF 205,"de Almeida Graca, L.",of  available,14,20,Yes: 0 student,In Person,,,,,,,,Creative and Cultural Representations (1),Breadth Requirement:,https://map.utoronto.ca/?id=1809#!m/494600,,,,,,,,,,
SPA,Business Spanish,SPA323H1-F,,,,"An advanced level business Spanish course covering topics on international relations, politics, legal and culture. This course aims to enhance written and oral expression in Spanish through content focusing on the language that is used in official, diplomatic, and financial situations. Through the analysis of case studies, newspapers and videos, students will be introduced to the business cultures and intercultural communication of the Spanish-speaking world.",SPA120Y1 or SPA220Y1 or proof of comparable Spanish level,Prerequisite:,"SPA320Y1, SPA219Y1 or proof of comparable Spanish level",Corequisite:,SPA323Y1,Exclusion:,Room,LEC0101,Wednesday,—,13:00,16:00,VC 206,"Fernandez Pelaez, I.",of  available,19,40,Yes: 0 student,In Person,,,,,,,,Humanities,Distribution Requirement:,https://map.utoronto.ca/?id=1809#!m/494602,,,,,,,,,,
SMC,Ritual and Worship,CHC327H1-F,,,,"An introduction to Christian ritual and worship, in cross-cultural and ecumenical perspective. Biblical roots, historical development and diverse adaptions of Christian worship in Europe, North America and the global South.",4.0 credits,Prerequisite:,"SMC216Y1, SMC327H1",Exclusion:,CHC203Y1,Recommended Preparation:,Room,LEC0101,Tuesday,—,13:00,15:00,AH 103,"O'Connor, M.",of  available,11,25,Yes: 0 student,In Person,,,,,,,,Humanities,Distribution Requirement:,https://map.utoronto.ca/?id=1809#!m/494578,,,,,,,,,,
SMC,Christ in Christian Tradition,CHC330H1-S,,,,"Faith in Christ is central to Christianity. This course offers an advanced introduction to classical debates about the person and work of Christ, the modern Quest of the Historical Jesus, and selected feminist, liberationist and indigenized perspectives on Christ from Asia, Africa and Latin America.",4.0 credits,Prerequisite:,"SMC330Y1, SMC330H1",Exclusion:,CHC203Y1,Recommended Preparation:,Room,LEC0101,Monday,—,11:00,12:00,AH 302,"Locklin, R.",of  available,15,25,Yes: 0 student,In Person,,,,,AH 302,,Wednesday,Humanities,Distribution Requirement:,https://map.utoronto.ca/?id=1809#!m/494578,,,,,,,—,11:00,12:00,https://map.utoronto.ca/?id=1809#!m/494578
SMC,The History of the Book: Elements of Bibliography and Print Culture,BMS331H1-F,,,,"An exploration of the history of the book from ancient inscriptions to e-books. This course develops an awareness of the interplay between material object and conceptual categories in book history by focusing on significant episodes in the evolution of the book as a medium, such as the rise of the context and the introduction of print. This course also delves in the practices of bibliography, the features of typography, and the material details of the printing process, while also highlighting the interdisciplinary nature of book history from a global perspective. Typically, this course will involve in-person workshops and visits to print studios and rare books collections on campus.","(BMS100H1, BMS200Y1, BMS201H1) or SMC219Y1",Prerequisite:,SMC228H1,Exclusion:,Humanities,Distribution Requirement:,Room,LEC0101,Friday,—,10:00,12:00,AH 107,"Granata, P.",of  available,58,68,Yes: 0 student,In Person,,,,,,,,Society and its Institutions (3),Breadth Requirement:,https://map.utoronto.ca/?id=1809#!m/494578,,Priority (P),Enrolment Controls:,"Priority enrolment is given to the groups of students listed below until July 28. There is no course enrolment on July 29. Beginning July 30, all other Arts & Science students can enrol in this section. UTM/UTSC students can enrol in this section starting August 6. The following groups of students are given priority access until July 28:",ASMAJ1300 MA BOOK & MEDIA STUDIES,ASMIN1300 MI BOOK & MEDIA STUDIES,,,,
SMC,"The History of Reading: Readers, Readerships, Reception",BMS332H1-S,,,,"This course explores the history of reading in western culture in a global context. Attention is given to the pivotal episodes in this history with a focus on its changing modes and shifting cultural significance. By surveying the habits, institutions, and aims of reading, students in this course will gain a greater understanding of its rich history and its complex evolution, and will enable them to reflect on the critical place of reading in their daily lives.","(BMS100H1, BMS200Y1, BMS201H1) or SMC219Y1",Prerequisite:,SMC229H1,Exclusion:,Humanities,Distribution Requirement:,Room,LEC0101,Friday,—,11:00,13:00,CR 403,"Gildea, I.",of  available,44,50,Yes: 0 student,In Person,,,,,,,,Society and its Institutions (3),Breadth Requirement:,https://map.utoronto.ca/?id=1809#!m/494580,,Priority (P),Enrolment Controls:,"Priority enrolment is given to the groups of students listed below until July 28. There is no course enrolment on July 29. Beginning July 30, all other Arts & Science students can enrol in this section. UTM/UTSC students can enrol in this section starting August 6. The following groups of students are given priority access until July 28:",ASMAJ1300 MA BOOK & MEDIA STUDIES,ASMIN1300 MI BOOK & MEDIA STUDIES,,,,
SMC,Early Celtic History 450-1000,CLT337H1-S,,,,"The history of the insular Celtic nation groups from the post-Roman period to the end of the first millennium, the course will trace settlement history and social organization, the making of Celtic nations, the process of Christianization, the impact of the Vikings, and the rise of paramount kings.",SMC337H1,Exclusion:,Humanities,Distribution Requirement:,Society and its Institutions (3),Breadth Requirement:,Room,LEC0101,Tuesday,—,11:00,13:00,TF 201,"Miles, B.",of  available,0,40,Yes: 1 student,In Person,,,,,,,,,,https://map.utoronto.ca/?id=1809#!m/494581,,,,,,,,,,
SMC,Middle Ages by the Numbers,MST341H1-F,,,,"Numbers and their uses often appear to be absolute fact: a thousand dollars is exactly that, not more or less; and if you weigh fifty kilos, that’s what you weigh. But the use and meaning of numbers—for recording and counting dates, money, weights, distances, and myriad other functions—is not, in fact, devoid of cultural, historical, and political context. Mediaeval Europe provided a bewildering range of calendric systems, currencies, systems of measurement, and numerical symbolism was much used in art, music, religious thought, and literature. This course provides an introduction to the various uses of numbers in this period across different regions and cultural contexts.",Completion of 9.0 credits,Prerequisite:,"MST210H1, MST212H1",Recommended Preparation:,Humanities,Distribution Requirement:,Room,LEC0101,Wednesday,—,14:00,16:00,CR 404,"Menendez, K.",of  available,19,25,Yes: 0 student,In Person,,,,,,,,Society and its Institutions (3),Breadth Requirement:,https://map.utoronto.ca/?id=1809#!m/494580,,,,,,,,,,
SPA,History of Portuguese Language,PRT342H1-S,,,,This interdisciplinary course provides an overview of the evolution of Portuguese language from 15th century to the present. It discusses linguistic change by analyzing texts from a variety of genres in different historical periods and geographical contexts.,PRT219Y1 or PRT220Y1 or PRT120Y1 or Permission of the Department,Prerequisite:,PRT320Y1,Corequisite:,Humanities,Distribution Requirement:,Room,LEC0101,Tuesday,—,14:00,16:00,VC 304,"Alves dos Santos Rato, A.",of  available,13,20,Yes: 0 student,In Person,,,,,,,,"Thought, Belief and Behaviour (2)",Breadth Requirement:,https://map.utoronto.ca/?id=1809#!m/494602,,,,,,,,,,
SMC,Writing Ireland,CLT345H1-F,,,,"This course looks at some of the major literary figures of Ireland in the twentieth and twenty-first centuries, writing in both Irish and English. Authors examined may include W. B. Yeats, Patrick Pearse, Nuala Ní Dhomhnaill, Seán Ó Riordáin, Seamus Heaney and Claire Keegan. Through a close reading of poetry, prose and critical texts, students will examine how Ireland's past, present and future are variously figured in its greatest modern literature. All Irish-language works will be read in English translation.",8.0 credits or permission of the instructor.,Prerequisite:,SMC345H1,Exclusion:,CLT241H1,Recommended Preparation:,Room,LEC0101,Wednesday,—,16:00,18:00,CR 106,"SHEEHAN, P.",of  available,17,20,Yes: 0 student,In Person,,,,,,,,Humanities,Distribution Requirement:,https://map.utoronto.ca/?id=1809#!m/494580,,,,,,,,,,
SPA,Spanish Cinema,SPA345H1-S,,,,"Analysis of the development of Spanish Cinema within its social and political contexts. Directors studied include Buñuel, Bardem, Erice, Saura, Almodóvar and Bigas Luna. (Offered every three years).",SPA120Y1 or SPA220Y1 or SPA219Y1 or Permission of the Department,Prerequisite:,SPA258H1,Recommended Preparation:,Humanities,Distribution Requirement:,Room,LEC0101,Thursday,—,16:00,18:00,VC 304,"Davidson, B.",of  available,0,30,Yes: 11 students,In Person,,,,,,,,Creative and Cultural Representations (1),Breadth Requirement:,https://map.utoronto.ca/?id=1809#!m/494602,,,,,,,,,,
