GGR,"Indigenous Worlds, Worldviews and the Environment",JIG322H1-S,"Explores the diverse ways of understanding and responding to the world that emerge from indigenous cultures around the world. Examines how indigenous ways of being and relating to their natural environment can help us understand and address the current environmental crisis. Using examples of indigenous activism from Canada and around the world, examines how colonial histories shape dispossession and marginalization and inform visions for the future. Topics include traditional ecological knowledge, place-based social movements, environmental concerns of indigenous peoples, bio-cultural restoration and decolonization of nature-human relations.","8.0 credits including one of INS200H1, INS201Y1, INS250H1, GGR107H1, GGR124H1, GGR240H1, GGR246H1, GGR254H1",Prerequisite:,"JAG321H1, GGR321H1",Exclusion:,Social Science,Distribution Requirement:,Society and its Institutions (3),Breadth Requirement:,Room,LEC5101,Wednesday,—,18:00,20:00,SS 2125,https://map.utoronto.ca/?id=1809#!m/494510,22,60,Yes: 0 student,In Person,Priority (P),Enrolment Controls:,"Priority enrolment is given to the groups of students listed below until July 28. There is no course enrolment on July 29. Beginning July 30, all other Arts & Science students can enrol in this section. UTM/UTSC students can enrol in this section starting August 6. The following groups of students are given priority access until July 28:",Department of Geography and Planning   (Faculty of Arts and Science),Indigenous Studies   (Faculty of Arts and Science),"Department of Geography and Planning   (John H. Daniels Faculty of Architecture, Landscape, & Design)","Indigenous Studies   (John H. Daniels Faculty of Architecture, Landscape, & Design)",,,,,,,,,,,,,,,,,,,,,,,,,,,,,,,,,,,,,,,,,"Dorries, H.",,,,
HMB,Global Health Research,HMB323H1-S,Health is a responsibility shared worldwide. Globalization of health has impacted biomedical research. Students will explore current global health research advances and build skills in the design and conduct of global health research studies.,"9 FCE complete, HMB202H1/HMB203H1/HMB204H1, BIO230H1/ BIO255H1",Prerequisite:,Science,Distribution Requirement:,Living Things and Their Environment (4),Breadth Requirement:,,,Room,LEC0101,Monday,—,15:00,18:00,OI 2214,https://map.utoronto.ca/?id=1809#!m/494563,0,80,Yes: 12 students,In Person,Priority (P),Enrolment Controls:,"Priority enrolment is given to the groups of students listed below until July 28. NOTE: Spaces for each priority group in this course are not equal, and each priority group has its own waitlist until July 28. As of July 30, the waitlists for each priority group merge into one, and your rank on the waitlist may change; this is also when other Arts & Science students can begin to enrol. Beginning August 4, other downtown campus students can enrol in this section. There is no course enrolment on August 5. UTM/UTSC students can enrol in this section starting August 6. The following groups of students are given priority access until July 28:",ASFOC1540B FOC GLOBAL HEALTH,ASFOC1540C FOC HEALTH AND DISEASE,ASFOC2270C FOC HEALTH AND DISEASE,ASMAJ2013 MA HMB: HEALTH AND DISEASE  - Year 3,ASMAJ2013 MA HMB: HEALTH AND DISEASE  - Year 4,,,,ASMAJ2035 MA HUMAN BIOLOGY  - Year 3,Activity,Time,Room,Instructor(s),Space Availability,Wait List,Status / Notes,TUT5101,Monday,—,17:00,18:00,OI 2211,https://map.utoronto.ca/?id=1809#!m/494563,of  available,0,27,No,In Person,Activity,Time,Instructor(s),Space Availability,Wait List,Status / Notes,TUT5102,Monday,—,17:00,18:00,of  available,0,27,No,In Person,"Dimaras, H.",,,,
HMB,Cellular and Molecular Neurobiology of the Synapse,CJH332H1-S,"Examination of all aspects of the synapse in both the peripheral and central nervous systems of invertebrates and vertebrates. Topics include: neuroplasticity, synapse formation, synaptic transmission, synaptic modulation, and the molecular biological basis of neurodegenerative disorders.",BIO271H1/PSL300H1,Prerequisite:,CSB332H1,Exclusion:,Science,Distribution Requirement:,Living Things and Their Environment (4),Breadth Requirement:,Room,LEC9901,3.0 hours / week,,,,,,160,500,Yes: 0 student,Asynchronous,Priority (P),Enrolment Controls:,"Priority enrolment is given to the groups of students listed below until July 28. NOTE: Spaces for each priority group in this course are not equal, and each priority group has its own waitlist until July 28. As of July 30, the waitlists for each priority group merge into one, and your rank on the waitlist may change; this is also when other Arts & Science students can begin to enrol. Beginning August 4, other downtown campus students can enrol in this section. There is no course enrolment on August 5. UTM/UTSC students can enrol in this section starting August 6. The following groups of students are given priority access until July 28:",Year 3 CELL AND SYSTEMS BIOLOGY Department of Cell and Systems Biology    (Faculty of Arts and Science),Year 4 CELL AND SYSTEMS BIOLOGY     (Faculty of Arts and Science),Year 3 NEUROSCIENCE Human Biology Program   Program (Faculty of Arts and Science),Year 4 NEUROSCIENCE Human Biology Program   Program (Faculty of Arts and Science),,—,,,,,,,,,,,,,,,,,,,,,,,,,,,,,,,,,,,,,,,"Fraigne, J.",,,,
IMM,Fundamental Immunology,IMM340H1-F,"This course introduces the basic principles and key players of the immune system: differences and interplay between innate and adaptive immunity, how immune cells develop and function, how immune cells recognize threats and danger and mount an appropriate and measured response. This course is offered in the Fall term with in-class lectures and tutorials, as well as in the Summer term with hybrid delivery (online lectures and in-class tutorials).",BIO230H1,Prerequisite:,IMM334Y1/IMM335Y1/IMM341H1,Exclusion:,IMM250H1,Recommended Preparation:,Science,Distribution Requirement:,Room,LEC0101,Thursday,—,10:00,12:00,,,2,450,Yes: 0 student,Online - Synchronous (See Delivery Instructions.),Priority (P),Enrolment Controls:,"Priority enrolment is given to the groups of students listed below until July 28. There is no course enrolment on July 29. Beginning July 30, all other Arts & Science students can enrol in this section. UTM/UTSC students can enrol in this section starting August 6. The following groups of students are given priority access until July 28:",ASMAJ1002 MA IMMUNOLOGY,,,,,—,Delivery instructions,,,Activity,Time,Room,Instructor(s),Space Availability,Wait List,Status / Notes,TUT0101,Monday,—,16:00,17:00,MC 102,https://map.utoronto.ca/?id=1809#!m/494474,of  available,14,450,No,In Person (See Delivery Instructions.),,,,,,,,,,,,,,,,,"Clemenza, L.",Note:,"Lectures will be delivered  as per the meeting schedule (TH: 10:00-12:00) and recorded (permitting synchronous delivery, but also asynchronous attendance).","Tutorials will be offered in person as per the meeting schedule (MO: 16:00-17:00) with attendance in rotation; cap to be announced based on Public Health recommendations. Note: these tutorial arrangements are subject to change, depending on Public Health recommendations.",online synchronously
IMM,Fundamental Immunology (Advanced),IMM341H1-F,"This course introduces the fundamental principles and key players of the immune system: differences and interplay between innate and adaptive immunity, how immune cells develop and function, how immune cells recognize threats and danger and mount an appropriate and measured response. Intended for students specializing in Immunology and related programs.",BIO230H1,Prerequisite:,IMM334Y1/IMM335Y1/IMM340H1,Exclusion:,IMM250H1,Recommended Preparation:,Science,Distribution Requirement:,Room,LEC0101,Thursday,—,10:00,12:00,,,3,25,Yes: 0 student,Online - Synchronous (See Delivery Instructions.),Restricted (R1),Enrolment Controls:,This section is restricted at all times to the following students:,BIOCHEMISTRY    Specialist (Faculty of Arts and Science),"BIOCHEMISTRY    Specialist (John H. Daniels Faculty of Architecture, Landscape, & Design)",IMMUNOLOGY    Specialist (Faculty of Arts and Science),"IMMUNOLOGY    Specialist (John H. Daniels Faculty of Architecture, Landscape, & Design)",LAB MEDICINE & PATHOBIOLOGY    Specialist (Faculty of Arts and Science),—,Delivery instructions,,"LAB MEDICINE & PATHOBIOLOGY    Specialist (John H. Daniels Faculty of Architecture, Landscape, & Design)",Activity,Time,Room,Instructor(s),Space Availability,Wait List,Status / Notes,TUT0101,Friday,—,13:00,14:00,UC 65,https://map.utoronto.ca/?id=1809#!m/494517,of  available,4,25,No,In Person (See Delivery Instructions.),,,,,,,,,,,,,,,,,"Clemenza, L.",Note:,"Lectures will be delivered  as per the meeting schedule (TH: 10:00-12:00) and recorded (permitting synchronous delivery, but also asynchronous attendance).",Tutorials will be offered as per the meeting schedule (FR: 13:00-14:00). Term tests will be delivered during regular class time (TH: 10:00-12:00).,online synchronously
HMB,Epidemiology of Health & Disease,HMB342H1-S,"This course engages students in the fundamental science of epidemiology applied to health and disease. After an introduction to various measures of health and disease, the scientific methods used to investigate, analyze, prevent and control health problems will be illustrated using social, biomedical and public health examples","9.0 credits complete, (BIO120H1, BIO130H1)/HST209H1",Prerequisite:,HST373H1,Exclusion:,STA220H1/ STA288H1/ EEB225H1/ PSY201H1,Recommended Preparation:,Science,Distribution Requirement:,Room,LEC9901,Tuesday,—,10:00,12:00,,,0,210,Yes: 54 students,Online - Synchronous (See Delivery Instructions.),Priority (P),Enrolment Controls:,"Priority enrolment is given to the groups of students listed below until July 28. NOTE: Spaces for each priority group in this course are not equal, and each priority group has its own waitlist until July 28. As of July 30, the waitlists for each priority group merge into one, and your rank on the waitlist may change; this is also when other Arts & Science students can begin to enrol. Beginning August 4, other downtown campus students can enrol in this section. There is no course enrolment on August 5. UTM/UTSC students can enrol in this section starting August 6. The following groups of students are given priority access until July 28:",ASFOC1540A FOC HEALTH STUDIES,ASFOC1540B FOC GLOBAL HEALTH,ASFOC1540C FOC HEALTH AND DISEASE,ASFOC2270A FOC HEALTH STUDIES,ASFOC2270C FOC HEALTH AND DISEASE,—,Delivery instructions,,ASMAJ2013 MA HMB: HEALTH AND DISEASE  - Year 4,Activity,Time,Room,Instructor(s),Space Availability,Wait List,Status / Notes,TUT0101,Thursday,—,10:00,11:00,—,,of  available,1,35,No,Online - Synchronous (See Delivery Instructions.),Activity,Time,Instructor(s),Space Availability,Wait List,Status / Notes,TUT0102,Thursday,—,10:00,11:00,of  available,3,35,No,Online - Synchronous (See Delivery Instructions.),"De Souza, L.",Note:,Lectures are live streamed and recorded.,,
IMM,The Immune System in Action,IMM350H1-S,"This course illustrates how different elements of the immune system come together to mount efficient and measured responses. Topics include response to infectious microorganisms, allergy and autoimmunity, immune responses against cancer, and transplantation immunology.",IMM340H1/IMM341H1,Prerequisite:,IMM334Y1/IMM335Y1/IMM351H1,Exclusion:,Science,Distribution Requirement:,Living Things and Their Environment (4),Breadth Requirement:,Room,LEC0101,Thursday,—,10:00,12:00,,,0,400,Yes: 12 students,Online - Synchronous (See Delivery Instructions.),Priority (P),Enrolment Controls:,"Priority enrolment is given to the groups of students listed below until July 28. There is no course enrolment on July 29. Beginning July 30, all other Arts & Science students can enrol in this section. UTM/UTSC students can enrol in this section starting August 6. The following groups of students are given priority access until July 28:",ASMAJ1002 MA IMMUNOLOGY,,,,,—,Delivery instructions,,,Activity,Time,Room,Instructor(s),Space Availability,Wait List,Status / Notes,TUT0101,Monday,—,15:00,16:00,MS 2158,https://map.utoronto.ca/?id=1809#!m/494491,of  available,15,400,No,In Person (See Delivery Instructions.),,,,,,,,,,,,,,,,,"Clemenza, L.",Note:,"Lectures will be delivered  as per the meeting schedule (TH: 10:00-12:00) and recorded (permitting synchronous delivery, but also asynchronous attendance).","Tutorials will be offered in person as per the meeting schedule (MO: 15:00-16:00) with attendance in rotation; cap to be announced based on Public Health recommendations. Note: these tutorial arrangements are subject to change, depending on Public Health recommendations.",online synchronously
ASABS,Indigenous Health Systems,INS350H1-F,"An overview of Indigenous health systems, internationally, nationally, provincially and locally, with a focus on Ontario. Discussion of health models and strategies, policy, legislation, jurisdictional issues, Indigenous health initiatives.",8 FCE including INS201Y1 or INS200H1,Prerequisite:,ABS350H1,Exclusion:,Social Science,Distribution Requirement:,Society and its Institutions (3),Breadth Requirement:,Room,LEC0101,Thursday,—,13:00,15:00,TF 202,https://map.utoronto.ca/?id=1809#!m/494581,2,30,Yes: 0 student,In Person,,,,,,,,,,,,,,,,,,,,,,,,,,,,,,,,,,,,,,,,,,,,,,,,"Hamilton, M.",,,,
NEW,AIDS : Challenges and Successes,JNH350H1-F,Explores the pandemic of AIDS in Africa through a social science lens. (Given by Human Biology and New College),NEW350H1,Exclusion:,AFR150Y1,Recommended Preparation:,"Humanities, Science, Social Science",Distribution Requirement:,Society and its Institutions (3),Breadth Requirement:,Room,LEC0101,Tuesday,—,14:00,16:00,WI 1017,https://map.utoronto.ca/?id=1809#!m/494503,29,75,Yes: 0 student,In Person,Priority (P),Enrolment Controls:,"Priority enrolment is given to the groups of students listed below until July 28. NOTE: Spaces for each priority group in this course are not equal, and each priority group has its own waitlist until July 28. As of July 30, the waitlists for each priority group merge into one, and your rank on the waitlist may change; this is also when other Arts & Science students can begin to enrol. Beginning August 4, other downtown campus students can enrol in this section. There is no course enrolment on August 5. UTM/UTSC students can enrol in this section starting August 6. The following groups of students are given priority access until July 28:",Human Biology Program    (Faculty of Arts and Science),New College Program    (Faculty of Arts and Science),"Human Biology Program    (John H. Daniels Faculty of Architecture, Landscape, & Design)","New College Program    (John H. Daniels Faculty of Architecture, Landscape, & Design)",,,,,,,,,,,,,,,,,,,,,,,,,,,,,,,,,,,,,,,,,"Lee, R.",,,,
IMM,The Immune System in Action (Advanced),IMM351H1-S,"This course illustrates how different elements of the immune system come together to mount efficient and measured responses. Topics include response to infectious microorganisms, allergy and autoimmunity, immune responses against cancer, and transplantation immunology. Intended for students specializing in Immunology and related programs.",IMM341H1/IMM340H1,Prerequisite:,IMM334Y1/IMM335Y1/IMM350H1,Exclusion:,Science,Distribution Requirement:,Living Things and Their Environment (4),Breadth Requirement:,Room,LEC0101,Thursday,—,10:00,12:00,,,1,25,Yes: 0 student,Online - Synchronous (See Delivery Instructions.),Restricted (R1),Enrolment Controls:,This section is restricted at all times to the following students:,BIOCHEMISTRY    Specialist (Faculty of Arts and Science),"BIOCHEMISTRY    Specialist (John H. Daniels Faculty of Architecture, Landscape, & Design)",IMMUNOLOGY    Specialist (Faculty of Arts and Science),"IMMUNOLOGY    Specialist (John H. Daniels Faculty of Architecture, Landscape, & Design)",LAB MEDICINE & PATHOBIOLOGY    Specialist (Faculty of Arts and Science),—,Delivery instructions,,"LAB MEDICINE & PATHOBIOLOGY    Specialist (John H. Daniels Faculty of Architecture, Landscape, & Design)",Activity,Time,Room,Instructor(s),Space Availability,Wait List,Status / Notes,TUT0101,Friday,—,13:00,14:00,MS 3278,https://map.utoronto.ca/?id=1809#!m/494491,of  available,4,25,No,In Person (See Delivery Instructions.),,,,,,,,,,,,,,,,,"Clemenza, L.",Note:,"Lectures will be delivered  as per the meeting schedule (TH: 10:00-12:00) and recorded (permitting synchronous delivery, but also asynchronous attendance).",Tutorials will be offered as per the meeting schedule (FR: 13:00-14:00). Term tests will be delivered during regular class time (TH: 10:00-12:00).,online synchronously
ASABS,"Indigenous Leadership, Policy and Practices in Canada",INS352H1-S,"A historical and contemporary overview of leadership and politics in First Nation, Inuit and Metis communities in Canada. This course will focus on pre-contact governance structures, contemporary effects of colonization, and processes and strategies for decolonization. Various policy initiatives from Indigenous organizations will be examined.","5 FCE, including INS201Y1 and one additional INS designator full course equivalent.",Prerequisite:,ABS352H1,Exclusion:,"Humanities, Social Science",Distribution Requirement:,Society and its Institutions (3),Breadth Requirement:,Room,LEC0101,Wednesday,—,13:00,15:00,LM 157,https://map.utoronto.ca/?id=1809#!m/494502,17,30,Yes: 0 student,In Person,,,,,,,,,,,,,,,,,,,,,,,,,,,,,,,,,,,,,,,,,,,,,,,,"Wastasecoot, B.",,,,
HMB,Neurogenomics,HMB360H1-F,"Genetic basis of both the normal and abnormal development of the nervous system and its function. Topics include the regulation of neural gene expression, the role of epigenetics on neuron function, genome wide association studies and disorders of brain and behaviour, optogenetic and pharmacogenetic techniques to probe neural circuit function. Tutorials emphasize critical analysis of primary research.","9 FCE complete, HMB265H1/BIO260H1, HMB200H1/HMB201H1",Prerequisite:,Science,Distribution Requirement:,Living Things and Their Environment (4),Breadth Requirement:,,,Room,LEC0101,Monday,—,10:00,13:00,GB 119,https://map.utoronto.ca/?id=1809#!m/494473,30,95,Yes: 0 student,In Person (See Delivery Instructions.),Priority (P),Enrolment Controls:,"Priority enrolment is given to the groups of students listed below until July 28. NOTE: Spaces for each priority group in this course are not equal, and each priority group has its own waitlist until July 28. As of July 30, the waitlists for each priority group merge into one, and your rank on the waitlist may change; this is also when other Arts & Science students can begin to enrol. Beginning August 4, other downtown campus students can enrol in this section. There is no course enrolment on August 5. UTM/UTSC students can enrol in this section starting August 6. The following groups of students are given priority access until July 28:","ASFOC1540D FOC GENES,GENETICS&BIOTECHNOL",ASFOC1540E FOC NEUROSCIENCE,ASFOC2270E FOC NEUROSCIENCE,ASMAJ1050 MA FUNDMNTL GENETICS & ITS APP,ASMAJ1472 MA HMB: NEUROSCIENCE,,Delivery instructions,,ASSPE1050 SP FUNDMNTL GENETICS & ITS APP,Activity,Time,Room,Instructor(s),Space Availability,Wait List,Status / Notes,TUT0101,Monday,—,12:00,13:00,ES 4000,https://map.utoronto.ca/?id=1809#!m/494499,of  available,0,32,No,In Person (See Delivery Instructions.),Activity,Time,Instructor(s),Space Availability,Wait List,Status / Notes,TUT0102,Monday,—,12:00,13:00,of  available,5,32,No,In Person (See Delivery Instructions.),"Levy-Strumpf, N.",Note:,Lectures are in-person permitting synchronous delivery. Recordings of lecture will be available for students to view asynchronously.,"Tutorials will be in-person, some sessions may be online based on needs. Exams will be in-person during the meeting schedule, or during a final assessment period.",
IMM,Scientific Methods and Research in Immunology,IMM360H1-F,"This course will provide students with an opportunity to advance their understanding of research in Immunology in accordance with scientific methodology. Students will critically appraise scientific articles, design and analyze scientific experiments, and develop the core skills of data and statistical literacy. This course is well suited for anyone interested in discovering knowledge in Immunology, providing students with a methodology for the achievement of scientific research activities.","IMM250H1, BCH210H1/BCH242Y1, BIO230H1/BIO255H1, BIO260H1/HMB265H1, STA288H1/STA220H1",Prerequisite:,Science,Distribution Requirement:,Living Things and Their Environment (4),Breadth Requirement:,,,Room,LEC0101,Thursday,—,13:00,15:00,BA B024,https://map.utoronto.ca/?id=1809#!m/494470,28,40,Yes: 0 student,In Person (See Delivery Instructions.),Priority (P),Enrolment Controls:,"Priority enrolment is given to the groups of students listed below until July 28. There is no course enrolment on July 29. Beginning July 30, all other Arts & Science students can enrol in this section. UTM/UTSC students can enrol in this section starting August 6. The following groups of students are given priority access until July 28:",ASMAJ1002 MA IMMUNOLOGY,ASSPE1002 SP IMMUNOLOGY,,,,,Delivery instructions,,,,,,,,,,,,,,,,,,,,,,,,,,,,,,,,,,,,,,"Singh, J.",Note:,"Lectures will be pre-recorded, and delivered , learning is self-paced and not reliant on a meeting schedule. Tutorials will be delivered , as per the meeting schedule (TH: 13:00-15:00). Students will need access to R Studio/R Studio Cloud (free of charge; instructions will be provided at the start of the course) for completion of data analysis assignments.",,online asynchronously (2.0 hrs/week)
ASABS,Special Topics in Indigenous Language,INS372H1-F,This seminar provides an in-depth examination of Indigenous language revitalization efforts in Canada and internationally. Content in any given year depends on the instructor. See Indigenous Studies website for more information.,8.0 credits including INS201Y1 and INS210Y1/INS220Y1/(INS230H1 and INS231H1),Prerequisite:,ABS372H1,Exclusion:,"Humanities, Social Science",Distribution Requirement:,Creative and Cultural Representations (1),Breadth Requirement:,Room,LEC0101,Wednesday,—,10:00,13:00,UC 175,https://map.utoronto.ca/?id=1809#!m/494517,27,30,Yes: 0 student,In Person,,,,,,,,,,,,,,,,,,,,,,,,,,,,,,,,,,,,,,,,,,,,,,,,"Brant, T.",,,,
ASABS,Special Topics in Indigenous Studies,INS380H1-F,This seminar provides an in-depth examination of trends and topics within Indigenous Studies. Content in any given year depends on the instructor. See Indigenous Studies website for more detail.,"5.0 credits including INS201Y1, plus 1.0 additional INS credit",Prerequisite:,,,,,,,Room,LEC0101,Thursday,—,10:00,12:00,UC 175,https://map.utoronto.ca/?id=1809#!m/494517,18,25,Yes: 0 student,In Person,,,,,,,,,,,,,,,,,,,,,,,,,,,,,,,,,,,,,,,,,,,,,,,,"Pangowish, S.",,,,
IMM,Special Research Project in Immunology,IMM385Y1-Y,"This course provides an opportunity for students to conduct a research project under the supervision of a member of the Faculty. Students are expected to devote a minimum of seven hours per week to the course from the week the fall term lectures begin to the last week of the spring term. Research projects will involve experimental design and work, data analyses, literature reading etc.",IMM250H1,Prerequisite:,IMM340H1/IMM341H1,Corequisite:,Science,Distribution Requirement:,Living Things and Their Environment (4),Breadth Requirement:,,LEC0101,—,—,,,—,,9981,9999,No,In Person,Enrol at Department (E),Enrolment Controls:,Enrolment via ACORN is not available. Students must request permission to enrol in this course by contacting the sponsoring department. Please see Timetable Instructions tab for contact information.,,,,,,,Timetable instructions,,,,,,,,,,,,,,,,,,,,,,,,,,,,,,,,,,,,,,"Mortha, A.",Note:,For 'E' indicator courses: contact the department at undergraduate.immunology@utoronto.ca for an application. Check the departmental web page for more information: www.immunology.utoronto.ca,,
ASABS,Research and Ethics in Indigenous Studies,INS390H1-F,"This course examines research approaches, strategies, methods and techniques used in Indigenous studies. It explores a range of topical issues including research ethics and protocols, intellectual property rights, research agreements and community-based research. This course includes the study of quantitative, qualitative and Indigenous methodologies. Critically examines research theories, methodologies and practices used by academic disciplines to study Indigenous peoples. Decolonized research methodologies will form a focus of this course.","8 FCEs, including INS201Y1 and at least one additional INS designator full course equivalent",Prerequisite:,ABS390H1,Exclusion:,"Humanities, Social Science",Distribution Requirement:,Society and its Institutions (3),Breadth Requirement:,Room,LEC0101,Wednesday,—,10:00,12:00,UC 67,https://map.utoronto.ca/?id=1809#!m/494517,14,30,Yes: 0 student,In Person,,,,,,,,,,,,,,,,,,,,,,,,,,,,,,,,,,,,,,,,,,,,,,,,"Dorries, H.",,,,
