PSY,Laboratory in Social Psychological Field Methods,PSY349H1-F,Timetable instructions,Note:,"Enrolment priority for this course is given to Psychology Specialists and Research Specialists. After the priority period has ended, students must contact the Undergraduate Administrator to be enrolled directly into the course or added to the waitlist by emailing psy.undergrad@utoronto.ca.",Course Description:,"This laboratory class introduces students to field methods in social psychology used to study social processes as they unfold in daily life and public spaces. Students will get hands on experience to collecting, managing, storing, and communicating data collected through observational and longitudinal methods, including data collection in public spaces around Toronto and online. Course capacity is limited to 15 students and priority is given to PSY Specialists and Research Specialists during the first enrolment period.","PSY202H1/ECO220Y1/SOC252H1/STA221H1/PSY202H5/STA221H5/PSYC08H3/STAB27H3/STAC32H3, and PSY220H1/PSY220H5/PSYB10H3/SOC213H1",Prerequisite:,PSY203H1,Recommended Preparation:,Science,Distribution Requirement:,"Thought, Belief and Behaviour (2)",Breadth Requirement:,Room,LEC0101,Thursday,,"Sharples, A.",of  available,2,15,No,In Person,"Priority, then Enrol at Department (PE)",Enrolment Controls:,"Priority enrolment on ACORN is given to the groups of students listed below until July 28. There is no course enrolment on July 29. Beginning July 30, all students must request permission to enrol in this section by contacting the sponsoring department. Please see Timetable Instructions tab for contact information. The following groups of students are given priority access on ACORN until July 28:",ASSPE1160 SP PSYCHOLOGY,ASSPE1958 SP PSYCHOLOGY RESEARCH(THESIS),,,,,,,,,SS 560,—,14:00,17:00,https://map.utoronto.ca/?id=1809#!m/494510
POL,"Gender, Politics, and Public Policy in Comparative Perspective",POL351H1-F,Timetable instructions,Note:,Delivery Method:  IN PERSON,Course Description:,"An introduction to gender and politics that examines women as political actors and their activities in formal and grassroots politics. The course also explores the impact of gender in public policy and how public policies shape gender relations. Cases to be drawn on include Canada, other countries in North America and Europe, and the developing world.",1.0 POL credit,Prerequisite:,Social Science,Distribution Requirement:,Society and its Institutions (3),Breadth Requirement:,,,Room,LEC0101,,,,,,,,,,,,,,,,,Lectures will be delivered in person.,Delivery instructions,Note:,,—,,,,,
RLG,Post-Colonial Islam,RLG352H1-F,,,,Course Description:,"This course will study Islam in a post-colonial framework. It will introduce students to the work of post-colonial studies, and how critical scholarship has transformed our understanding of monolithic concepts such as modernity, the nation and Islam. It will focus on the particular case of Islam in South Asia and the Middle East by exposing students to the transformative impact of colonialism. It will equip students with the tools to challenge the hegemonic notion of a singular 'tradition' in Islam by tracing its lineages in the post-colony.",Completion of 4.0 credits,Prerequisite:,"NMC381Y1, RLG250H1",Exclusion:,Humanities,Distribution Requirement:,Society and its Institutions (3),Breadth Requirement:,Room,LEC0101,Wednesday,,"Moumtaz, N.",of  available,21,50,Yes: 0 student,In Person,,,,,,,,,,,,,,SS 1086,—,11:00,13:00,https://map.utoronto.ca/?id=1809#!m/494510
POL,Protest Counter-Movements in Europe and North America,POL353H1-S,Timetable instructions,Note:,Delivery Method:  IN PERSON,Course Description:,"A comparative examination of the development of a variety of protest counter-movements and their engagement with state institutions. Among the counter-movements being examined are those opposed to civil rights, women's rights, sexual orientation rights, environmental and Indigenous rights mobilization.",POL344Y1,Exclusion:,"1.0 credit on 20th century politics or history of Europe, U.S. or Canada/1.0 credit on gender or sexuality/POL344H1",Recommended Preparation:,Social Science,Distribution Requirement:,Society and its Institutions (3),Breadth Requirement:,Room,LEC0101,Monday,,"Gill-Alderson, E.",of  available,0,50,Yes: 32 students,In Person (See Delivery Instructions.),Priority (P),Enrolment Controls:,"Priority enrolment is given to the groups of students listed below until July 28. There is no course enrolment on July 29. Beginning July 30, all other Arts & Science students can enrol in this section. UTM/UTSC students can enrol in this section starting August 6. The following groups of students are given priority access until July 28:",POLITICAL SCIENCE     (Faculty of Arts and Science),,,,,Lectures will be delivered in person.,Delivery instructions,Note:,,,UC 244,—,10:00,12:00,https://map.utoronto.ca/?id=1809#!m/494517
RLG,The Politics of Charity,RLG353H1-S,,,,Course Description:,"The course examines religious charitable giving, philanthropic foundations, and humanitarian aid and asks: Is charitable giving altruistic or is it always partly self-interested? Could aid perpetuate poverty? What kinds of ""strings"" come with receiving aid and is there such thing like a free gift?",Completion of 4.0 credits,Prerequisite:,RLG250H1,Exclusion:,Social Science,Distribution Requirement:,"Thought, Belief and Behaviour (2)",Breadth Requirement:,Room,LEC0101,Wednesday,,"Moumtaz, N.",of  available,29,50,Yes: 0 student,In Person,,,,,,,,,,,,,,SS 1084,—,11:00,13:00,https://map.utoronto.ca/?id=1809#!m/494510
POL,Politics and Society in Russia,POL354H1-F,,,,Course Description:,Explores tensions between democracy and authoritarianism after communist rule. Topics include: legacy of Soviet Union; political leadership; presidential power and executive - legislative conflict; federalism; elections and parties; civil society; ethnonationalism; corruption and organized crime.,1.0 POL credit,Prerequisite:,POL354Y5,Exclusion:,Social Science,Distribution Requirement:,Society and its Institutions (3),Breadth Requirement:,Room,LEC0101,Wednesday,,"Kosals, L.",of  available,4,70,Yes: 0 student,In Person,Priority (P),Enrolment Controls:,"Priority enrolment is given to the groups of students listed below until July 28. There is no course enrolment on July 29. Beginning July 30, all other Arts & Science students can enrol in this section. UTM/UTSC students can enrol in this section starting August 6. The following groups of students are given priority access until July 28:",ASMAJ1625 MA EUROPEAN STUDIES,ASMAJ2015 MA POLITICAL SCIENCE,ASMIN1011 MI EUROPEAN UNION STUDIES,ASMIN2015 MI POLITICAL SCIENCE,"ASSPE1228 SP PEACE, CONFLICT & JUSTICE",,,,,,BL 313,—,12:00,14:00,https://map.utoronto.ca/?id=1809#!m/494536
RLG,Special Topics in Hinduism,RLG358H1-S,,,,Course Description:,Topics in Hinduism. Themes vary from year to year.,Completion of 4.0 credits,Prerequisite:,Humanities,Distribution Requirement:,Creative and Cultural Representations (1),Breadth Requirement:,,,Room,LEC0101,Tuesday,,"Raman, S.",of  available,32,40,Yes: 0 student,In Person,,,,,,,,,,,,Subtitle,,BL 114,—,10:00,12:00,https://map.utoronto.ca/?id=1809#!m/494536
POL,Enlarging Europe: The European Union and Its Applicants,POL359H1-S,Timetable instructions,Note:,Delivery Method:  IN PERSON,Course Description:,"European integration remains one of the most important and successful political experiments in recent history. This course looks at the historical impetus for European integration after the Second World War and to the recent trends in this process, as well as its future prospects as the Union’s borders enlarge and it confronts new challenges.",1.0 POL credit,Prerequisite:,POL359Y1,Exclusion:,Interest in European History and Politics.,Recommended Preparation:,Social Science,Distribution Requirement:,Room,LEC0101,Tuesday,,"Austin, R.",of  available,0,70,Yes: 9 students,In Person (See Delivery Instructions.),Priority (P),Enrolment Controls:,"Priority enrolment is given to the groups of students listed below until July 28. There is no course enrolment on July 29. Beginning July 30, all other Arts & Science students can enrol in this section. UTM/UTSC students can enrol in this section starting August 6. The following groups of students are given priority access until July 28:",EUROPEAN STUDIES     (Faculty of Arts and Science),POLITICAL SCIENCE     (Faculty of Arts and Science),,,,Lectures will be delivered in person.,Delivery instructions,Note:,,,VC 215,—,14:00,16:00,https://map.utoronto.ca/?id=1809#!m/494602
PSY,Human Neuroimaging Laboratory,PSY359H1-F,Timetable instructions,Note:,"Enrolment priority for this course is given to Psychology Specialists and Research Specialists. After the priority period has ended, students must contact the Undergraduate Administrator to be enrolled directly into the course or added to the waitlist by emailing psy.undergrad@utoronto.ca.",Course Description:,"Introduction to brain imaging methods used in cognitive, developmental, and social neuroscience. Course projects will cover experimental design, imaging techniques, and data analysis. Course capacity is limited to 15 students and priority is given to PSY Specialists and Research Specialists during the first enrolment period.","PSY202H1/ECO220Y1/SOC252H1/STA221H1/PSY202H5/STA221H5/PSYC08H3/STAB27H3/STAC32H3, and PSY210H1/PSY210H5/PSYB20H3 or PSY220H1/PSY220H5/PSYB10H3/SOC213H1 or PSY230H1/PSY230H5/PSYB30H3 or PSY240H1/PSY240H5/PSYB32H3, and PSY270H1/PSY270H5/PSYB57H3/COG250Y1 or PSY280H1/PSY280H5/PSYB51H3",Prerequisite:,HMB310H1/PSYD55H3,Exclusion:,PSY203H1,Recommended Preparation:,Science,Distribution Requirement:,Room,LEC0101,Thursday,,"Mack, M.",of  available,1,15,No,In Person,"Priority, then Enrol at Department (PE)",Enrolment Controls:,"Priority enrolment on ACORN is given to the groups of students listed below until July 28. There is no course enrolment on July 29. Beginning July 30, all students must request permission to enrol in this section by contacting the sponsoring department. Please see Timetable Instructions tab for contact information. The following groups of students are given priority access on ACORN until July 28:",ASSPE1160 SP PSYCHOLOGY,ASSPE1958 SP PSYCHOLOGY RESEARCH(THESIS),,,,,,,,,SS 560,—,10:00,13:00,https://map.utoronto.ca/?id=1809#!m/494510
POL,Topics in Latin American Politics,POL360H1-S,Timetable instructions,Note:,Delivery Method:  IN PERSON,Course Description:,Selected issues in Latin American politics. Content and instructor vary from year to year.,1.0 POL credit,Prerequisite:,Social Science,Distribution Requirement:,Society and its Institutions (3),Breadth Requirement:,,,Room,LEC0101,Wednesday,,"Kingsbury, D.",of  available,38,70,Yes: 0 student,In Person (See Delivery Instructions.),Priority (P),Enrolment Controls:,"Priority enrolment is given to the groups of students listed below until July 28. There is no course enrolment on July 29. Beginning July 30, all other Arts & Science students can enrol in this section. UTM/UTSC students can enrol in this section starting August 6. The following groups of students are given priority access until July 28:",POLITICAL SCIENCE     (Faculty of Arts and Science),,,,,Lectures will be delivered in person.,Delivery instructions,Note:,Subtitle,,BL 313,—,12:00,14:00,https://map.utoronto.ca/?id=1809#!m/494536
PSY,Associative Learning,PSY360H1-S,,,,Course Description:,"Learning allows our experiences to shape what we know, what we can do and how we interact with our environments. This course addresses the fundamental concepts and more important research findings related to contemporary theories of associative learning in animals and humans. It examines the application of such fundamental research to issues such as the neural substrates of behaviour, drug use, and anxiety disorders. It is designed to foster skills in critical thinking, experimental design and reading primary sources in this area.","PSY201H1/ECO220Y1/EEB225H1/GGR270H1/POL222H1/SOC202H1/STA220H1/STA238H1/STA248H1/STA288H1/PSY201H5/STA215H5/STA220H5/PSYB07H3/STAB22H3/STAB23H3/STAB57H3, and PSY260H1/PSYB38H3",Prerequisite:,Science,Distribution Requirement:,Living Things and Their Environment (4),Breadth Requirement:,,,Room,LEC0101,Friday,,"Corbit, L.",of  available,0,50,Yes: 11 students,In Person,Priority (P),Enrolment Controls:,"Priority enrolment is given to the groups of students listed below until July 28. There is no course enrolment on July 29. Beginning July 30, all other Arts & Science students can enrol in this section. UTM/UTSC students can enrol in this section starting August 6. The following groups of students are given priority access until July 28:",ASMAJ1160 MA PSYCHOLOGY,ASMIN1160 MI PSYCHOLOGY,ASSPE1160 SP PSYCHOLOGY,ASSPE1958 SP PSYCHOLOGY RESEARCH(THESIS),,,,,,,SS 1084,—,11:00,14:00,https://map.utoronto.ca/?id=1809#!m/494510
RLG,Literatures of Hinduism,RLG361H1-S,,,,Course Description:,"A study of the literatures of Hinduism in India and the diaspora, including issues of identity formation, nostalgic constructions of the ""homeland"", fictional representations, and the quest for authenticity.",Completion of 4.0 credits,Prerequisite:,Humanities,Distribution Requirement:,Creative and Cultural Representations (1),Breadth Requirement:,,,Room,LEC0101,Monday,,,of  available,30,30,Yes: 0 student,In Person,,,,,,,,,,,,,—,VC 304,—,12:00,14:00,https://map.utoronto.ca/?id=1809#!m/494602
POL,Global Political Economy: Policy and Analysis,POL362H1-S,Timetable instructions,Note:,Delivery Method:  IN PERSON,Course Description:,"This course focuses on key aspects of world economic order, like policies governing trade, capital flows, migration, development, and telecommunications. Methods for analyzing the background and implications of such policies are introduced.","1.0 POL credit; ECO100Y/(ECO101H1, ECO102H1)/ECO105Y1",Prerequisite:,POL361H1,Recommended Preparation:,Social Science,Distribution Requirement:,Society and its Institutions (3),Breadth Requirement:,Room,LEC0101,Wednesday,,"Nieman, M.",of  available,0,70,Yes: 5 students,In Person (See Delivery Instructions.),Priority (P),Enrolment Controls:,"Priority enrolment is given to the groups of students listed below until July 28. There is no course enrolment on July 29. Beginning July 30, all other Arts & Science students can enrol in this section. UTM/UTSC students can enrol in this section starting August 6. The following groups of students are given priority access until July 28:",POLITICAL SCIENCE     (Faculty of Arts and Science),"POLITICAL SCIENCE     (John H. Daniels Faculty of Architecture, Landscape, & Design)",ASMAJ1469 MA INTERNATIONAL RELATIONS,ASSPE1469 SP INTERNATIONAL RELATIONS,,Lectures will be delivered in person.,Delivery instructions,Note:,,,BL 313,—,10:00,12:00,https://map.utoronto.ca/?id=1809#!m/494536
POL,Religion and Politics in the Nation State,JPR364H1-F,Timetable instructions,Note:,Delivery Method:  IN PERSON,Course Description:,"This course will engage with contemporary debates on religion and politics in the context of the nation-state in our post-9/11 world, and will do so comparatively across a wide range of contexts.","The emphasis will be on understanding the evolving relationship between religion and politics in liberal democracies, and examining challenges facing democratic politics from the religious sphere, both in the West, where secular liberalism is the dominant framework for discussing these questions, and in Africa, India, and the Middle East, where such a framework is more likely to be contested. The themes explore will include secularization, religious pluralism and tolerance, human rights regimes, the idea of “civil religion,” the impact of religion on party politics, the formation of identity and political community, the legal regulation of sometimes-competing claims based on religious faith, gender, and sexuality, and the rise of extremist forms of religious politics, conspiracy thinking, new online communities that lead to dangerous political outcomes, such as ‘QAnon’ and ‘Plandemic’. Cases studies will include the USA, Canada, France, Turkey, Egypt, Nigeria.",Prerequisite:,0.5 POL 200-level credit/0.5 RLG 200-level credit/1.0 HIS 200-level credit/1.0 PHL 200-level credit/1.0 SOC 200-level credit,Exclusion:,JPR364Y1,Distribution Requirement:,Social Science,Breadth Requirement:,Room,LEC0101,Monday,,"Marshall, R.",of  available,0,70,Yes: 0 student,In Person (See Delivery Instructions.),Priority (P),Enrolment Controls:,"Priority enrolment is given to the groups of students listed below until July 28. There is no course enrolment on July 29. Beginning July 30, all other Arts & Science students can enrol in this section. UTM/UTSC students can enrol in this section starting August 6. The following groups of students are given priority access until July 28:",POLITICAL SCIENCE     (Faculty of Arts and Science),"POLITICAL SCIENCE     (John H. Daniels Faculty of Architecture, Landscape, & Design)",RELIGION     (Faculty of Arts and Science),"RELIGION     (John H. Daniels Faculty of Architecture, Landscape, & Design)","ASMAJ1228 MA PEACE, CONFLICT & JUSTICE",Lectures will be delivered in person.,Delivery instructions,Note:,,,SS 1070,—,12:00,14:00,https://map.utoronto.ca/?id=1809#!m/494510
POL,Global Religion and Politics,JPR365H1-S,Timetable instructions,Note:,Delivery Method:  IN PERSON,Course Description:,"This course will engage with contemporary debates on religion and politics in the international context in our post-9/11 world, and will do so comparatively across a wide range of contexts.","The emphasis will be on understanding the evolving role transnational religion has played in the past three decades, where new global networks have emerged as central global actors. We will focus empirically on the rise of radical reformist Islam and evangelical Christianity, the two most dramatically successful forms of religiosity around the world today. We will study the implications for the foreign policies of key nation-states, as well as the forces that have contributed to the prevalence of contestatory religious politics and networks as new and poorly understood global actors. International religious freedom, human rights, the role of media and mediation, the place of religious or theological doctrines or imaginaries in constructing and motivating a range of political goals, many involving the use of violence. We will focus as well on the global spread of extremist forms of religious politics, conspiracy thinking, new online communities that lead to dangerous political outcomes, such as ‘QAnon’ and ‘Plandemic’. Many of the cases will focus on the non-Western world, especially the Middle East and Africa.",Prerequisite:,0.5 POL 200-level credit/0.5 RLG 200-level credit/1.0 HIS 200-level credit/1.0 PHL 200-level credit/1.0 SOC 200-level credit,Exclusion:,JPR364Y1,Distribution Requirement:,Social Science,Breadth Requirement:,Room,LEC0101,Monday,,"Marshall, R.",of  available,0,70,Yes: 9 students,In Person (See Delivery Instructions.),Priority (P),Enrolment Controls:,"Priority enrolment is given to the groups of students listed below until July 28. There is no course enrolment on July 29. Beginning July 30, all other Arts & Science students can enrol in this section. UTM/UTSC students can enrol in this section starting August 6. The following groups of students are given priority access until July 28:",POLITICAL SCIENCE     (Faculty of Arts and Science),"POLITICAL SCIENCE     (John H. Daniels Faculty of Architecture, Landscape, & Design)",RELIGION     (Faculty of Arts and Science),"RELIGION     (John H. Daniels Faculty of Architecture, Landscape, & Design)","ASMAJ1228 MA PEACE, CONFLICT & JUSTICE",Lectures will be delivered in person.,Delivery instructions,Note:,,,SS 2127,—,12:00,14:00,https://map.utoronto.ca/?id=1809#!m/494510
PSY,Psychobiology Laboratory,PSY369H1-F,Timetable instructions,Note:,"Enrolment priority for this course is given to Psychology Specialists and Research Specialists. After the priority period has ended, students must contact the Undergraduate Administrator to be enrolled directly into the course or added to the waitlist by emailing psy.undergrad@utoronto.ca.",Course Description:,"This lab is an introduction to experimental methods in behavioural neuroscience, including neuroanatomical and psychopharmacological methods in rodents. Course projects will cover experimental design, laboratory techniques, data analysis, and scientific writing. Course capacity is limited to 12-15 students and priority is given to PSY Specialists and Research Specialists during the first enrolment period.","PSY202H1/ECO220Y1/SOC252H1/STA221H1/PSY202H5/STA221H5/PSYC08H3/STAB27H3/STAC32H3, and PSY290H1/PSY290H5/PSYB55H3/PSYB64H3/HMB200H1",Prerequisite:,HMB310H1/PSY369H5/PSYC06H3,Exclusion:,PSY203H1,Recommended Preparation:,Science,Distribution Requirement:,Room,LEC0101,Wednesday,,"Corbit, L.",of  available,0,10,No,In Person,"Priority, then Enrol at Department (PE)",Enrolment Controls:,"Priority enrolment on ACORN is given to the groups of students listed below until July 28. There is no course enrolment on July 29. Beginning July 30, all students must request permission to enrol in this section by contacting the sponsoring department. Please see Timetable Instructions tab for contact information. The following groups of students are given priority access on ACORN until July 28:",ASSPE1160 SP PSYCHOLOGY,ASSPE1958 SP PSYCHOLOGY RESEARCH(THESIS),,,,,,,,,RW 307,—,12:00,15:00,https://map.utoronto.ca/?id=1809#!m/494515
RLG,The Mahabharata,RLG369H1-F,,,,Course Description:,"A study of the great Sanskrit epic, the Mahabharata.",Completion of 4.0 credits,Prerequisite:,Humanities,Distribution Requirement:,Creative and Cultural Representations (1),Breadth Requirement:,,,Room,LEC0101,Wednesday,,"Maharaj, S.",of  available,18,30,Yes: 0 student,In Person,,,,,,,,,,,,,,NF 113,—,12:00,14:00,https://map.utoronto.ca/?id=1809#!m/494600
PSY,Thinking and Reasoning,PSY370H1-F,,,,Course Description:,"Problem-solving as a model of directed thinking; conceptual behaviour and mental representation; induction, deduction and learning; probabilistic reasoning; creative thinking and complex problem solving.","PSY201H1/ECO220Y1/EEB225H1/GGR270H1/POL222H1/SOC202H1/STA220H1/STA238H1/STA248H1/STA288H1/PSY201H5/STA215H5/STA220H5/PSYB07H3/STAB22H3/STAB23H3/STAB57H3, and PSY270H1/PSY270H5/PSYB57H3/COG250Y1",Prerequisite:,Science,Distribution Requirement:,"Thought, Belief and Behaviour (2)",Breadth Requirement:,,,Room,LEC0101,Thursday,,"Vervaeke, J.",of  available,4,50,Yes: 0 student,In Person,Priority (P),Enrolment Controls:,"Priority enrolment is given to the groups of students listed below until July 28. There is no course enrolment on July 29. Beginning July 30, all other Arts & Science students can enrol in this section. UTM/UTSC students can enrol in this section starting August 6. The following groups of students are given priority access until July 28:",ASMAJ1160 MA PSYCHOLOGY,ASMAJ1445 MA COGNITIVE SCIENCE(ARTS),ASMAJ1445A MA COG SCI: ARTS - PERC&ATTEN,ASMAJ1445B MA COG SCI: ARTS - LANG & COG,ASMAJ1445C MA COG SCI: ARTS - THINK&REAS,,,,,,RW 143,—,13:00,16:00,https://map.utoronto.ca/?id=1809#!m/494515
RLG,Intermediate Tibetan,RLG370Y1-Y,Timetable instructions,Note:,"This is an online synchronous course. Some or all lectures and class meetings will be livestreamed to enable real-time contact with the professor and classmates. Lectures will also normally be recorded and available asynchronously, so that registered students can access them on their own time. Students will have the opportunity for weekly online office hours to ask questions and clarifications about course content and assignments. Students need the ability to view PDFs or PowerPoint slides and to access online library resources and Quercus tools, including Bb Collaborate and Microsoft Teams.",Course Description:,Intermediate level language course focusing on both spoken and literary forms of Tibetan.,The equivalent of one year of Tibetan language training.,Prerequisite:,Humanities,Distribution Requirement:,Creative and Cultural Representations (1),Breadth Requirement:,,,,LEC9901,Tuesday,—,"Lindsay, R.",of  available,13,15,No,Online - Synchronous,,,,,,,,,,,,,,,—,13:00,15:00,
PSY,Higher Cognitive Processes,PSY371H1-S,,,,Course Description:,"This course covers selected topics pertaining to higher cognitive processes including rationality, consciousness, creativity, and human and artificial intelligence.","PSY201H1/ECO220Y1/EEB225H1/GGR270H1/POL222H1/SOC202H1/STA220H1/STA238H1/STA248H1/STA288H1/PSY201H5/STA215H5/STA220H5/PSYB07H3/STAB22H3/STAB23H3/STAB57H3, and PSY270H1/PSY270H5/PSYB57H3/PSY370H1/COG250Y1",Prerequisite:,PSY371H5,Exclusion:,Science,Distribution Requirement:,"Thought, Belief and Behaviour (2)",Breadth Requirement:,Room,LEC0101,Thursday,,"Vervaeke, J.",of  available,0,50,Yes: 29 students,In Person,Priority (P),Enrolment Controls:,"Priority enrolment is given to the groups of students listed below until July 28. There is no course enrolment on July 29. Beginning July 30, all other Arts & Science students can enrol in this section. UTM/UTSC students can enrol in this section starting August 6. The following groups of students are given priority access until July 28:",ASMAJ1160 MA PSYCHOLOGY,ASMAJ1445 MA COGNITIVE SCIENCE(ARTS),ASMAJ1445A MA COG SCI: ARTS - PERC&ATTEN,ASMAJ1445B MA COG SCI: ARTS - LANG & COG,ASMAJ1445C MA COG SCI: ARTS - THINK&REAS,,,,,,UC 87,—,13:00,16:00,https://map.utoronto.ca/?id=1809#!m/494517
