HMB,Biomedical Advances & Technologies,HMB401H1-S,"This course introduces life science students to biomedical advances and technologies in medicine, including drug patents, medical device implants, diagnostic and medical device software. Limitations of patent protection in commercializing medical products, and limitations to scalability may also be discussed. Specific topics vary from year to year and will be based on the course instructor's area(s) of expertise.","14 FCE complete, HMB301H1/HMB321H1/BCH311H1/CSB349H1/MGY311Y1/PSL350H1,  HMB201H1/HMB202H1/HMB203H1/HMB204H1",Prerequisite:,a statistics course,Recommended Preparation:,Science,Distribution Requirement:,Living Things and Their Environment (4),Breadth Requirement:,Room,LEC0101,Friday,—,10:00,12:00,RW 143,https://map.utoronto.ca/?id=1809#!m/494515,12,40,Yes: 0 student,In Person,Restricted (R1),Enrolment Controls:,"This section is restricted at all times to the students listed below. NOTE: Spaces for each priority group in this course are not equal, and each priority group has its own waitlist until July 28. As of July 30, the waitlists for each priority group merge into one, and your rank on the waitlist may change.",Year 3 HUMAN BIOLOGY     (Faculty of Arts and Science),Year 4 HUMAN BIOLOGY     (Faculty of Arts and Science),ASMAJ1050 MA FUNDMNTL GENETICS & ITS APP,ASSPE1050 SP FUNDMNTL GENETICS & ITS APP,,,Timetable instructions,,,,,,,,,,,,,,,,,,,,,,,,,,,,,,,,,,,,,,"Sachewsky, N.",Note:,"This course will be part of HMB pre-enrolment. Eligible program students will receive via email a ballot to rank eligible 400-level courses in order of preference between June 1 and June 20, 2021, with decisions confirmed by July 9, 2021. Students who are not pre-enrolled in the course but meet the enrolment controls will be able to waitlist for the course once course enrolment starts.",,
HMB,Topics in Translational Medicine,HMB402H1-F,"The bridge between basic scientific research and clinical practice integrates fundamental knowledge about molecular/cellular mechanisms and clinical disorders to increase the potential for new medical treatments, therapies and interventions as well as understanding of disease processes. Specific topics vary from year to year and will be based on the instructor's area(s) of expertise.","14 FCE complete, BCH210H1, BIO230H1/BIO255H1, HMB302H1/HMB321H1/HMB322H1/BCH311H1/CSB349H1/MGY311Y1/PSL350H1, and HMB202H1/HMB203H1/HMB204H1",Prerequisite:,BCH311H1/ CSB349H1/ PSL350H1,Recommended Preparation:,Science,Distribution Requirement:,Living Things and Their Environment (4),Breadth Requirement:,Room,LEC0101,Thursday,—,12:00,14:00,OI 5290,https://map.utoronto.ca/?id=1809#!m/494563,1,30,Yes: 0 student,In Person (See Delivery Instructions.),Restricted (R1),Enrolment Controls:,"This section is restricted at all times to the students listed below. NOTE: Spaces for each priority group in this course are not equal, and each priority group has its own waitlist until July 28. As of July 30, the waitlists for each priority group merge into one, and your rank on the waitlist may change.",Year 3 HUMAN BIOLOGY     (Faculty of Arts and Science),Year 4 HUMAN BIOLOGY     (Faculty of Arts and Science),ASMAJ2013 MA HMB: HEALTH AND DISEASE,ASMAJ2035 MA HUMAN BIOLOGY,ASSPE2013 SP HMB: HEALTH AND DISEASE,,Timetable instructions,Delivery instructions,,,,,,,,,,,,,,,,,,,,,,,,,,,,,,,,,,,,,"Papaconstantinou, M.",Note:,"This course will be part of HMB pre-enrolment. Eligible program students will receive via email a ballot to rank eligible 400-level courses in order of preference between June 1 and June 20, 2021, with decisions confirmed by July 9, 2021. Students who are not pre-enrolled in the course but meet the enrolment controls will be able to waitlist for the course once course enrolment starts.","Lectures, in-class assignments and exams will be held in person during the meeting schedule, or during a final assessment period. Lectures will be recorded, however in-person lecture attendance is mandatory for participation marks.",Note:
ASABS,Indigenous Peoples and the Urban Context,INS403H1-S,"Critically examines Indigenous peoples' experiences, encounters and interactions in urban areas in Canada. This course explores the historical and contemporary conditions of Indigenous peoples, including urban governance and the development of Indigenous organizations. This course will focus on youth perspectives and how traditions, cultures and knowledges are expressed in urban settings.","10 FCEs, INS201Y1 plus two additional full-course equivalents in INS",Prerequisite:,ABS403H1,Exclusion:,"Humanities, Social Science",Distribution Requirement:,Society and its Institutions (3),Breadth Requirement:,Room,LEC0101,Tuesday,—,10:00,12:00,BA B026,https://map.utoronto.ca/?id=1809#!m/494470,12,25,Yes: 0 student,In Person,,,,,,,,,,,,,,,,,,,,,,,,,,,,,,,,,,,,,,,,,,,,,,,,"Wastasecoot, B.",,,,
HMB,Health Care Ethics,HMB406H1-S,"Since research involving human subjects lays the foundation for innovation in modern health care, this course examines health care ethics along a continuum from bench to bedside. Ethical issues are discussed in the context of specific cases involving human research, as well as contemporary clinical practice.","14 FCE complete,  A HMB300-level course, HMB306H1/ PHL281H1/ other ethics course with prior approval from the unit",Prerequisite:,Science,Distribution Requirement:,Living Things and Their Environment (4),Breadth Requirement:,,,Room,LEC0101,Monday,—,10:00,12:00,UC 330,https://map.utoronto.ca/?id=1809#!m/494517,0,35,Yes: 2 students,In Person (See Delivery Instructions.),Restricted (R1),Enrolment Controls:,"This section is restricted at all times to the students listed below. NOTE: Spaces for each priority group in this course are not equal, and each priority group has its own waitlist until July 28. As of July 30, the waitlists for each priority group merge into one, and your rank on the waitlist may change.",Year 3 HUMAN BIOLOGY     (Faculty of Arts and Science),Year 4 HUMAN BIOLOGY     (Faculty of Arts and Science),NEUROSCIENCE     (Faculty of Arts and Science),,,,Timetable instructions,Delivery instructions,,,,,,,,,,,,,,,,,,,,,,,,,,,,,,,,,,,,,"Bowman, K.",Note:,"This course will be part of HMB pre-enrolment. Eligible program students will receive via email a ballot to rank eligible 400-level courses in order of preference between June 1 and June 20, 2021, with decisions confirmed by July 9, 2021. Students who are not pre-enrolled in the course but meet the enrolment controls will be able to waitlist for the course once course enrolment starts.","This course is in person with recordings available for asynchronous viewing, and all assessments can be completed online.",Note:
HMB,Clinical Neuroimaging,JHA410H1-S,"This course focuses on the use of neuroimaging techniques in understanding how trauma, disorders, and disease impact neural structure and function. Lectures will focus on introduction to techniques and clinical/research applications. Lab work will focus on the development of practical skills including image processing, analyses, and experimental design.","9 FCE complete, PSL300H1, BIO230H1, HMB200H1/PSY290H1/ANA300Y1",Prerequisite:,HMB320H1,Recommended Preparation:,Science,Distribution Requirement:,Living Things and Their Environment (4),Breadth Requirement:,Room,LEC0101,Thursday,—,10:00,12:00,RW 110,https://map.utoronto.ca/?id=1809#!m/494515,6,147,Yes: 0 student,In Person (See Delivery Instructions.),Priority (P),Enrolment Controls:,"Priority enrolment is given to the groups of students listed below until July 28. NOTE: Spaces for each priority group in this course are not equal, and each priority group has its own waitlist until July 28. As of July 30, the waitlists for each priority group merge into one, and your rank on the waitlist may change; this is also when other Arts & Science students can begin to enrol. Beginning August 4, other downtown campus students can enrol in this section. There is no course enrolment on August 5. UTM/UTSC students can enrol in this section starting August 6. The following groups of students are given priority access until July 28:",ASMAJ1472 MA HMB: NEUROSCIENCE  - Year 3,ASMAJ1472 MA HMB: NEUROSCIENCE  - Year 4,ASSPE1472 SP HMB: NEUROSCIENCE  - Year 3,ASSPE1472 SP HMB: NEUROSCIENCE  - Year 4,,,Timetable instructions,Delivery instructions,,Activity,Time,Room,Instructor(s),Space Availability,Wait List,Status / Notes,PRA0201,SS 561,—,11:00,13:00,Tuesday,https://map.utoronto.ca/?id=1809#!m/494510,of  available,3,49,No,In Person (See Delivery Instructions.),Activity,Time,Instructor(s),Space Availability,Wait List,Status / Notes,PRA0301,SS 561,—,13:00,15:00,of  available,2,49,No,In Person (See Delivery Instructions.),"Dockstader, C.",Note:,"This course will be part of HMB pre-enrolment. Eligible program students will receive via email a ballot to rank eligible 400-level courses in order of preference between June 1 and June 20, 2021, with decisions confirmed by July 9, 2021. Students who are not pre-enrolled in the course but meet the enrolment controls will be able to waitlist for the course once course enrolment starts.",Recordings of lectures will also be available for students to view asynchronously. Lab practicals will be available only as in person at their scheduled times.,Note:
HMB,Seminar in Neurobiology of Behaviour,HMB420H1-F,This seminar course focuses on recent research into the neurobiology underlying human behaviour. A variety of normal and abnormal human behaviours are studied which may include: voluntary action; moral cognition; hedonism; aggression; mental health; addiction; the impact of the gut microbiome on brain development and health.,"14 FCE complete, HMB200H1, HMB300H1, HMB320H1/ANA300Y1",Prerequisite:,Science,Distribution Requirement:,Living Things and Their Environment (4),Breadth Requirement:,,,Room,LEC0101,Monday,—,14:00,16:00,UC 85,https://map.utoronto.ca/?id=1809#!m/494517,14,30,Yes: 0 student,In Person,Restricted (R1),Enrolment Controls:,"This section is restricted at all times to the students listed below. NOTE: Spaces for each priority group in this course are not equal, and each priority group has its own waitlist until July 28. As of July 30, the waitlists for each priority group merge into one, and your rank on the waitlist may change.",NEUROSCIENCE     (Faculty of Arts and Science),,,,,,Timetable instructions,,,,,,,,,,,,,,,,,,,,,,,,,,,,,,,,,,,,,,"Fraigne, J.",Note:,"This course will be part of HMB pre-enrolment. Eligible program students will receive via email a ballot to rank eligible 400-level courses in order of preference between June 1 and June 20, 2021, with decisions confirmed by July 9, 2021. Students who are not pre-enrolled in the course but meet the enrolment controls will be able to waitlist for the course once course enrolment starts.",,
HMB,Seminar in Fundamental Genetics and its Applications,HMB421H1-F,Theme based lecture and seminar course underlining current medical research in relation to the areas of genes and genetics. Topics vary yearly.,"14 FCE complete, HMB265H1/BIO260H1, HMB201H1",Prerequisite:,HMB321H1/ BCH311H1/ CSB349H1/ MGY311Y1/ PSL350H1,Recommended Preparation:,Science,Distribution Requirement:,Living Things and Their Environment (4),Breadth Requirement:,Room,LEC0101,Monday,—,11:00,13:00,BL 114,https://map.utoronto.ca/?id=1809#!m/494536,4,30,Yes: 0 student,In Person (See Delivery Instructions.),Restricted (R1),Enrolment Controls:,"This section is restricted at all times to the students listed below. NOTE: Spaces for each priority group in this course are not equal, and each priority group has its own waitlist until July 28. As of July 30, the waitlists for each priority group merge into one, and your rank on the waitlist may change.",Year 3 HUMAN BIOLOGY     (Faculty of Arts and Science),Year 4 HUMAN BIOLOGY     (Faculty of Arts and Science),"ASFOC1540D FOC GENES,GENETICS&BIOTECHNOL",ASMAJ1050 MA FUNDMNTL GENETICS & ITS APP,ASSPE1050 SP FUNDMNTL GENETICS & ITS APP,,Timetable instructions,Delivery instructions,,,,,,,,,,,,,,,,,,,,,,,,,,,,,,,,,,,,,"Wilson Jr, R.",Note:,"This course will be part of HMB pre-enrolment. Eligible program students will receive via email a ballot to rank eligible 400-level courses in order of preference between June 1 and June 20, 2021, with decisions confirmed by July 9, 2021. Students who are not pre-enrolled in the course but meet the enrolment controls will be able to waitlist for the course once course enrolment starts.","This is an in person seminar course, lecture recordings may not always be available.",Note:
HMB,Seminar in Health & Disease,HMB422H1-F,This course focuses on various medical research related to human disease. Topics vary based on course instructor's area(s) of expertise.,"14 FCE complete, PSL300H1, PSL301H1, HMB302H1/HMB322H1, and HMB202H1/HMB203H1/HMB204H1",Prerequisite:,Science,Distribution Requirement:,Living Things and Their Environment (4),Breadth Requirement:,,,Room,LEC0101,Tuesday,—,10:00,12:00,WI 524,https://map.utoronto.ca/?id=1809#!m/494503,0,30,Yes: 0 student,In Person (See Delivery Instructions.),Restricted (R1),Enrolment Controls:,"This section is restricted at all times to the students listed below. NOTE: Spaces for each priority group in this course are not equal, and each priority group has its own waitlist until July 28. As of July 30, the waitlists for each priority group merge into one, and your rank on the waitlist may change.",Year 3 HUMAN BIOLOGY     (Faculty of Arts and Science),Year 4 HUMAN BIOLOGY     (Faculty of Arts and Science),ASFOC1540C FOC HEALTH AND DISEASE,ASFOC2270C FOC HEALTH AND DISEASE,ASMAJ2013 MA HMB: HEALTH AND DISEASE,,Timetable instructions,Delivery instructions,ASMAJ2035 MA HUMAN BIOLOGY,,,,,,,,,,,,,,,,,,,,,,,,,,,,,,,,,,,,"Ju, B.",Note:,"This course will be part of HMB pre-enrolment. Eligible program students will receive via email a ballot to rank eligible 400-level courses in order of preference between June 1 and June 20, 2021, with decisions confirmed by July 9, 2021. Students who are not pre-enrolled in the course but meet the enrolment controls will be able to waitlist for the course once course enrolment starts.","HMB422H1F will have synchronous, livestreams of in-person lectures, with recordings available for asynchronous viewing, and all assessments can be completed online.",Note:
HMB,Seminar in Health & Disease,HMB422H1-S,This course focuses on various medical research related to human disease. Topics vary based on course instructor's area(s) of expertise.,"14 FCE complete, PSL300H1, PSL301H1, HMB302H1/HMB322H1, and HMB202H1/HMB203H1/HMB204H1",Prerequisite:,Science,Distribution Requirement:,Living Things and Their Environment (4),Breadth Requirement:,,,Room,LEC0101,Tuesday,—,10:00,12:00,UC 261,https://map.utoronto.ca/?id=1809#!m/494517,0,30,Yes: 0 student,In Person (See Delivery Instructions.),Restricted (R1),Enrolment Controls:,"This section is restricted at all times to the students listed below. NOTE: Spaces for each priority group in this course are not equal, and each priority group has its own waitlist until July 28. As of July 30, the waitlists for each priority group merge into one, and your rank on the waitlist may change.",Year 3 HUMAN BIOLOGY     (Faculty of Arts and Science),Year 4 HUMAN BIOLOGY     (Faculty of Arts and Science),ASFOC1540C FOC HEALTH AND DISEASE,ASFOC2270C FOC HEALTH AND DISEASE,ASMAJ2013 MA HMB: HEALTH AND DISEASE,,Timetable instructions,Delivery instructions,ASMAJ2035 MA HUMAN BIOLOGY,,,,,,,,,,,,,,,,,,,,,,,,,,,,,,,,,,,,"Cortinois, A.",Note:,"This course will be part of HMB pre-enrolment. Eligible program students will receive via email a ballot to rank eligible 400-level courses in order of preference between June 1 and June 20, 2021, with decisions confirmed by July 9, 2021. Students who are not pre-enrolled in the course but meet the enrolment controls will be able to waitlist for the course once course enrolment starts.","The course will include both in person and online, asynchronous activities. Lectures will be recorded and made available online for students to view them asynchronously, prior to class meetings.",Note:
IMM,Molecular Immunology,IMM428H1-F,"This course will focus on the molecular and cellular biology of immune recognition. The course will emphasize historical and recent experimental evidence leading to our current understanding of immune recognition. Subtopics are subject to change and have recently included mechanisms of diversification of immunoglobulin receptors, T cell –MHC interactions, T cell activation and signaling mechanisms; receptors of the innate immune system, immune recognition by natural killer cells.","BCH210H1/BCH242Y1, BCH311H1/CSB349H1/MGY311Y1/PSL350H1, IMM350H1/IMM351H1/IMM334Y1/IMM335Y1",Prerequisite:,Science,Distribution Requirement:,Living Things and Their Environment (4),Breadth Requirement:,,,Room,LEC0101,Tuesday,—,10:00,11:00,MS 4171,https://map.utoronto.ca/?id=1809#!m/494491,4,60,Yes: 0 student,In Person (See Delivery Instructions.),Priority (P),Enrolment Controls:,"Priority enrolment is given to the groups of students listed below until July 28. There is no course enrolment on July 29. Beginning July 30, all other Arts & Science students can enrol in this section. UTM/UTSC students can enrol in this section starting August 6. The following groups of students are given priority access until July 28:",ASSPE1002 SP IMMUNOLOGY,,,,,MS 4171,Delivery instructions,,,,,,,,,,,,,,,,,,,,,,,,,,,,,,,,,,,,,,"Julien, J.",Note:,Lectures will be delivered in person as per the meeting schedule (TU & TH: 10:00-11:00).,,
IMM,Developmental Immunology,IMM429H1-F,"Hematopoiesis, myelopoiesis, lymphopoiesis, a study of the development of cells involved in the immune system including their ontogeny, physical, molecular, and biochemical characteristics, regulation of differentiation and maturation, positive and negative selection of lymphocytes.",IMM350H1/IMM351H1 (IMM334Y1/IMM335Y1),Prerequisite:,Science,Distribution Requirement:,Living Things and Their Environment (4),Breadth Requirement:,,,Room,LEC0101,Tuesday,—,15:00,17:00,MS 2172,https://map.utoronto.ca/?id=1809#!m/494491,2,80,Yes: 0 student,In Person (See Delivery Instructions.),Priority (P),Enrolment Controls:,"Priority enrolment is given to the groups of students listed below until July 28. There is no course enrolment on July 29. Beginning July 30, all other Arts & Science students can enrol in this section. UTM/UTSC students can enrol in this section starting August 6. The following groups of students are given priority access until July 28:",ASSPE1002 SP IMMUNOLOGY,,,,,,Delivery instructions,,,,,,,,,,,,,,,,,,,,,,,,,,,,,,,,,,,,,,"Anderson, M.",Note:,Lectures will be delivered in person as per the meeting schedule (TU: 15:00-17:00).,,
HMB,Trends in Neuroscience,HMB430H1-F,"Current research covering the breadth of neuroscience is showcased by members of the Collaborative Program in Neuroscience. Topics vary yearly, but cover the spectrum from molecular through genetic, cellular, developmental, systems, behavioural and modelling. As well, approaches to studying neurodegenerative diseases and clinical neurophysiology are introduced.","14 FCE complete, HMB200H1, CJH332H1, HMB320H1/JHA410H1/ANA300Y1",Prerequisite:,Science,Distribution Requirement:,Living Things and Their Environment (4),Breadth Requirement:,,,Room,LEC0101,Monday,—,14:00,16:00,SS 2105,https://map.utoronto.ca/?id=1809#!m/494510,0,50,Yes: 0 student,In Person (See Delivery Instructions.),Restricted (R1),Enrolment Controls:,"This section is restricted at all times to the students listed below. NOTE: Spaces for each priority group in this course are not equal, and each priority group has its own waitlist until July 28. As of July 30, the waitlists for each priority group merge into one, and your rank on the waitlist may change.",ASFOC1540E FOC NEUROSCIENCE,ASFOC2270E FOC NEUROSCIENCE,ASMAJ1472 MA HMB: NEUROSCIENCE,ASSPE1472 SP HMB: NEUROSCIENCE,,,Timetable instructions,Delivery instructions,,,,,,,,,,,,,,,,,,,,,,,,,,,,,,,,,,,,,"Dockstader, C.",Note:,"This course will be part of HMB pre-enrolment. Eligible program students will receive via email a ballot to rank eligible 400-level courses in order of preference between June 1 and June 20, 2021, with decisions confirmed by July 9, 2021. Students who are not pre-enrolled in the course but meet the enrolment controls will be able to waitlist for the course once course enrolment starts.",Recordings of lectures will also be available for students to view asynchronously.,Note:
IMM,Clinical Immunology,IMM430H1-S,"This course will address the underlying pathogenesis as well as highlight the challenges of treating immune-related conditions such as autoimmunity, cancer, HIV, and transplantation and graft rejection. Half of the lectures will address the genetics and cellular pathogenesis of autoimmune diseases such as multiple sclerosis, type I diabetes and lupus. Other lectures will overview a number of immunological challenges faced in the clinic, such as preventing graft rejection after transplantation or boosting the immune system to fight cancer and HIV.",IMM350H1/IMM351H1 (IMM334Y1/IMM335Y1),Prerequisite:,Science,Distribution Requirement:,Living Things and Their Environment (4),Breadth Requirement:,,,Room,LEC0101,Tuesday,—,15:00,17:00,MS 2172,https://map.utoronto.ca/?id=1809#!m/494491,0,90,Yes: 31 students,In Person (See Delivery Instructions.),Priority (P),Enrolment Controls:,"Priority enrolment is given to the groups of students listed below until July 28. There is no course enrolment on July 29. Beginning July 30, all other Arts & Science students can enrol in this section. UTM/UTSC students can enrol in this section starting August 6. The following groups of students are given priority access until July 28:",ASSPE1002 SP IMMUNOLOGY,,,,,,Delivery instructions,,,,,,,,,,,,,,,,,,,,,,,,,,,,,,,,,,,,,,"Berger, S.",Note:,Lectures will be delivered in person as per the meeting schedule (TU: 15:00-17:00).,,
HMB,Innovation in Applied Genetics,HMB431H1-S,"From bench to bedside, this seminar-based course explores innovation in research and technology and their application in the medical field. Special emphasis on innovative genetic engineering approaches used in combination with stem cell technologies to transform the field of personalized and regenerative medicine.","14.0 credits complete, HMB301H1/HMB360H1/HMB321H1, HMB201H1/HMB202H1/HMB203H1/HMB204H1",Prerequisite:,Science,Distribution Requirement:,Society and its Institutions (3),Breadth Requirement:,,,Room,LEC0101,Tuesday,—,10:00,12:00,BA 2165,https://map.utoronto.ca/?id=1809#!m/494470,2,30,Yes: 0 student,In Person (See Delivery Instructions.),Restricted (R1),Enrolment Controls:,"This section is restricted at all times to the students listed below. NOTE: Spaces for each priority group in this course are not equal, and each priority group has its own waitlist until July 28. As of July 30, the waitlists for each priority group merge into one, and your rank on the waitlist may change.",Year 3 HUMAN BIOLOGY     (Faculty of Arts and Science),Year 4 HUMAN BIOLOGY     (Faculty of Arts and Science),"ASFOC1540D FOC GENES,GENETICS&BIOTECHNOL",ASFOC2270D FOC GENES GENETICS&BIOTECHNOL,ASMAJ1050 MA FUNDMNTL GENETICS & ITS APP,,Timetable instructions,Delivery instructions,ASMAJ2035 MA HUMAN BIOLOGY,,,,,,,,,,,,,,,,,,,,,,,,,,,,,,,,,,,,"Levy-Strumpf, N.",Note:,"This course will be part of HMB pre-enrolment. Eligible program students will receive via email a ballot to rank eligible 400-level courses in order of preference between June 1 and June 20, 2021, with decisions confirmed by July 9, 2021. Students who are not pre-enrolled in the course but meet the enrolment controls will be able to waitlist for the course once course enrolment starts.","This is an in person seminar course, recordings may not always be available.",Note:
IMM,Immunotherapy,IMM431H1-S,"Therapies that enhance, or suppress, the body’s immune response have proven remarkably efficient for the treatment of human diseases such as cancer, autoimmunity and chronic inflammation. Some of these therapies, such as the so-called checkpoint inhibitors and CAR-T cell therapies have recently leaped from bench to bedside. This course will cover the fundamental immune principles at play, how they were discovered, as well as the existing and future immune therapies to treat these diseases.",IMM350H1/IMM351H1,Prerequisite:,IMM428H1,Recommended Preparation:,Science,Distribution Requirement:,Living Things and Their Environment (4),Breadth Requirement:,Room,LEC0101,Friday,—,13:00,16:00,MS 4279,https://map.utoronto.ca/?id=1809#!m/494491,0,67,Yes: 4 students,In Person (See Delivery Instructions.),Priority (P),Enrolment Controls:,"Priority enrolment is given to the groups of students listed below until July 28. There is no course enrolment on July 29. Beginning July 30, all other Arts & Science students can enrol in this section. UTM/UTSC students can enrol in this section starting August 6. The following groups of students are given priority access until July 28:",ASSPE1002 SP IMMUNOLOGY,,,,,,Delivery instructions,,,,,,,,,,,,,,,,,,,,,,,,,,,,,,,,,,,,,,"McGaha, T.",Note:,Lectures will be delivered in person as per the meeting schedule (FR: 13:00-16:00).,,
