resultDept,pbot15,hiCC,legendControl,extraTxt,extraTxt 2,extraTxt 3,extraTxt 4,extraTxt 5,extraTxt 6,extraTxt 7,extraTxt 8,extraTxt 9,extraTxt 10,extraTxt 11,extraTxt 12,headerSect 3,colCode,weekDay,weekDay 2,colInst,colAvail,numCurr,numTot,numWait,onlineMeeting,legendControl 3,legendControl 4,enConDesc,enConList,enConList 2,enConList 3,enConList 4,enConList 5,extraTxt 13,legendControl 7,extraTxt 16,headerSect 15,alignC,weekDay 55,dayInfo 94,dayInfo 95,dayInfo 96,weekDay href 22
PSY,Introductory Psychology,PSY100H1-F,Delivery instructions,Note:,"Lectures will be delivered online.  Learning is self-paced and not reliant on a meeting schedule.  Opportunities for synchronous activity with instructors and classmates (e.g., virtual office hours) will be made available, but will not be required.  All course assessments will be conducted online.",Course Description:,"A brief introductory survey of psychology as both a biological and social science. Topics will include physiological, learning, perceptual, motivational, cognitive, developmental, personality, abnormal, and social psychology.",None,Prerequisite:,PSY100Y5/PSYA01Y3/(PSYA01H3 + PSYA02H3),Exclusion:,Science,Distribution Requirement:,"Thought, Belief and Behaviour (2)",Breadth Requirement:,Room,LEC9901,3.0 hours / week,—,"Waggoner Denton, A.",of  available,2,1500,Yes: 0 student,Asynchronous (See Delivery Instructions.),Priority (P),Enrolment Controls:,"Priority enrolment is given to the groups of students listed below until July 28. There is no course enrolment on July 29. Beginning July 30, all other Arts & Science students can enrol in this section. UTM/UTSC students can enrol in this section starting August 6. The following groups of students are given priority access until July 28:",Year 1      (Faculty of Arts and Science),"Year 1      (John H. Daniels Faculty of Architecture, Landscape, & Design)",AS   HBSCT Science Tranfser Degree Program,ASCRSHBSCT Science Tranfser Degree Program,ASPRGHBSCT Science Tranfser Degree Program,,,,,,,,,,
PSY,Introductory Psychology,PSY100H1-S,Delivery instructions,Note:,"Lectures will be delivered online.  Learning is self-paced and not reliant on a meeting schedule.  Opportunities for synchronous activity with instructors and classmates (e.g., virtual office hours) will be made available, but will not be required.  All course assessments will be conducted online.",Course Description:,"A brief introductory survey of psychology as both a biological and social science. Topics will include physiological, learning, perceptual, motivational, cognitive, developmental, personality, abnormal, and social psychology.",None,Prerequisite:,PSY100Y5/PSYA01Y3/(PSYA01H3 + PSYA02H3),Exclusion:,Science,Distribution Requirement:,"Thought, Belief and Behaviour (2)",Breadth Requirement:,Room,LEC9901,3.0 hours / week,—,"Waggoner Denton, A.",of  available,0,1500,Yes: 246 students,Asynchronous (See Delivery Instructions.),Priority (P),Enrolment Controls:,"Priority enrolment is given to the groups of students listed below until July 28. There is no course enrolment on July 29. Beginning July 30, all other Arts & Science students can enrol in this section. UTM/UTSC students can enrol in this section starting August 6. The following groups of students are given priority access until July 28:",Year 1      (Faculty of Arts and Science),"Year 1      (John H. Daniels Faculty of Architecture, Landscape, & Design)",AS   HBSCT Science Tranfser Degree Program,ASCRSHBSCT Science Tranfser Degree Program,ASPRGHBSCT Science Tranfser Degree Program,,,,,,,,,,
POL,The Real World of Politics: An Introduction,POL101H1-F,Timetable instructions,Note:,Delivery Method:,Course Description:,"This course introduces students to compelling issues of contemporary politics through the lens of classic and important texts in political science. The course covers the politics of climate change, Indigenous rights, elections and electoral systems, terrorism, social movements and political activism, voting, democracy, and power.",POL101Y1,Exclusion:,Social Science,Distribution Requirement:,Society and its Institutions (3),Breadth Requirement:,,,Room,LEC0101,3.0 hours / week,—,"Jung, C.",of  available,10,1140,Yes: 0 student,Asynchronous (See Delivery Instructions.),,,,,,,,,LEC0101,Delivery instructions,Note:,Activity,—,Thursday,—,11:00,12:00,
POL,The Real World of Politics: An Introduction,POL101H1-S,Timetable instructions,Note:,Delivery Method:,Course Description:,"This course introduces students to compelling issues of contemporary politics through the lens of classic and important texts in political science. The course covers the politics of climate change, Indigenous rights, elections and electoral systems, terrorism, social movements and political activism, voting, democracy, and power.",POL101Y1,Exclusion:,Social Science,Distribution Requirement:,Society and its Institutions (3),Breadth Requirement:,,,Room,LEC0101,Monday,,"Jung, C.",of  available,0,150,Yes: 64 students,In Person (See Delivery Instructions.),,,,,,,,,LEC0101,Delivery instructions,Note:,Activity,—,SS 2118,—,10:00,12:00,https://map.utoronto.ca/?id=1809#!m/494510
RLG,Reason and Religion in the Modern Age,RLG101H1-F,,,,Course Description:,"An introduction to critical thinking about religion as it took shape in modern European thought. We examine major thinkers such as Baruch Spinoza, David Hume, Immanuel Kant, Friedrich Nietzsche, Hannah Arendt, and others. Issues covered include freedom of thought, the relationship between religion and politics, belief and truth, rational ethics in relation to religious ethics. We explore how issues addressed by these classical authors remain relevant in today's world.",Humanities,Distribution Requirement:,"Thought, Belief and Behaviour (2)",Breadth Requirement:,,,,,Room,LEC0101,Wednesday,,"Goldberg, S.",of  available,13,150,Yes: 0 student,In Person,,,,,,,,,,,,Activity,—,SS 2117,—,13:00,15:00,https://map.utoronto.ca/?id=1809#!m/494510
RLG,"Conspiracies, Social Media, and the Rise of New Religious Movements",RLG104H1-F,Delivery instructions,Note:,"This is an online synchronous course. Lectures and class meetings will be livestreamed to enable real-time contact with the professor and classmates. Lectures will also normally be recorded and available asynchronously, so that registered students can access them on their own time. Tutorials will be held online with synchronous meetings to enable real-time class discussion and contact with the teaching assistant or instructor. Asynchronous tutorial participation will be accessible to students on their own time. Students will have the opportunity for weekly online office hours to ask questions and clarifications about course content and assignments. Students need the ability to view PDFs or PowerPoint slides and to access online library resources and Quercus tools, including Bb Collaborate and Microsoft Teams.",Course Description:,"Conspiracy theories are nothing new, but in the past few years we have all witnessed the meteoric rise of conspiracies such as QAnon via social media, which have taken on the elements of New Religious Movements. This course examines recent examples of new religious movements that might be thought of as “conspiritualities,” that is, conspiracies with strong cult and religious overtones.",Humanities,Distribution Requirement:,"Thought, Belief and Behaviour (2)",Breadth Requirement:,,,,,Room,LEC9901,Tuesday,—,"Harris, J.",of  available,18,162,Yes: 0 student,Online - Synchronous (See Delivery Instructions.),,,,,,,,,,,,Activity,—,,—,10:00,12:00,
POL,Contemporary Challenges to Democracy: Democracy in the Social Media Age,POL106H1-S,Timetable instructions,Note:,Delivery Method:,Course Description:,"This course examines the latest evidence-based research on the effects of social media on democracy. We cover surveillance capitalism, privacy, disinformation, and the often-overlooked ecological implications of data consumption. We also examine targeted digital espionage against civil society, Citizen Lab research reports, and explore solutions and alternatives to social media.",Social Science,Distribution Requirement:,Society and its Institutions (3),Breadth Requirement:,,,,,Room,LEC0101,3.0 hours / week,—,"Deibert, R.",of  available,0,900,Yes: 26 students,Asynchronous (See Delivery Instructions.),,,,,,,,,LEC0101,Delivery instructions,Note:,Activity,—,Thursday,—,13:00,14:00,
RLG,Happiness,RLG106H1-S,,,,Course Description:,"Are you happy? Today happiness is a metric by which a growing number of people assess the quality of their lives, with a range of experts offering innumerable life hacks and opportunities to optimize life. But what does it mean to be happy? And how have people tried to achieve this ever-elusive state? Situated squarely within the study of religion, this course considers how different traditions from around the world and for thousands of years have raised similar questions about happiness—not simply for the sake of reflection but also to do something about it. And their answers have varied: fast, meditate, pray, go to the desert, come together, get high, suffer, renounce God, and/or make lots of money. Readings will include selections from social theory and religious texts as well as a few authors who seem to be (against all odds) kind of happy.",Humanities,Distribution Requirement:,"Thought, Belief and Behaviour (2)",Breadth Requirement:,,,,,Room,LEC0101,Tuesday,,"O'Neill, K.",of  available,79,350,Yes: 0 student,In Person,,,,,,,,,,,,Activity,—,MC 102,—,13:00,15:00,https://map.utoronto.ca/?id=1809#!m/494474
POL,"What Went Wrong? A Post Mortem of Political Disasters, Catastrophic Policy Failures, and Epic Marches of Folly",POL107H1-F,Timetable instructions,Note:,Delivery Method:,Course Description:,"Why do individuals, groups, and societies make repeated, and often easily predictable mistakes? Why do they persist in courses of action that produce disastrous results? Why is it that in the political world good intentions are insufficient to ensure good results? This course employs the political science analytical toolkit to answer these questions and examines an array avoidable disasters, from the local to the international.","POL486H1 (Topics in International Politics I: What Went Wrong? A Post Mortem of Political Disasters, Policy Failures and Marches of Folly); offered in Winter 2019 and Winter 2020; POL487H1 (Topics in International Politics II: What Went Wrong? A Post Mortem of Political Disasters, Catastrophic Policy Failures); offered in Winter 2018",Exclusion:,Social Science,Distribution Requirement:,Society and its Institutions (3),Breadth Requirement:,,,Room,LEC5101,3.0 hours / week,—,"Gilady, L.",of  available,2,575,Yes: 0 student,Asynchronous (See Delivery Instructions.),,,,,,,,,LEC5101,Delivery instructions,Note:,Activity,—,,,,,
RLG,"""It's the End of the World as We Know It""",RLG107H1-S,,,,Course Description:,"Throughout history, many religious movements have envisioned the end of the world. This course will explore the ways in which different religious movements have prepared for and expected an end time, from fears, symbols, and rituals to failed prophecies and social violence. By examining traditions such as Jewish and Christian apocalyptic texts through to fears of nuclear apocalypse and zombies, the course seeks to understand the ways in which ancient and modern claims of “the end” reflect the aspirations, anxieties, and religious concerns of communities.",Humanities,Distribution Requirement:,"Thought, Belief and Behaviour (2)",Breadth Requirement:,,,,,Room,LEC0101,Wednesday,,"Bugg, L.",of  available,0,150,Yes: 7 students,In Person,,,,,,,,,,,,Activity,—,OI 2212,—,13:00,15:00,https://map.utoronto.ca/?id=1809#!m/494563
RLG,Elementary Modern Hebrew I,MHB155H1-F,,,,Course Description:,Introduction to the fundamentals of Hebrew grammar and syntax. Emphasis on the development of oral and writing skills.,Grade 4 Hebrew (or Grade 2 in Israel)/NML155H1,Exclusion:,Humanities,Distribution Requirement:,Creative and Cultural Representations (1),Breadth Requirement:,,,Room,LEC0101,Tuesday,PB 255,"Nizri, Y.",of  available,0,22,Yes: 0 student,In Person,,,,,,,,,,,,,,PB 255,—,10:00,12:00,https://map.utoronto.ca/?id=1809#!m/494476
RLG,Elementary Modern Hebrew II,MHB156H1-S,,,,Course Description:,Continued introduction to the fundamentals of Hebrew grammar and syntax. Emphasis on the development of oral and writing skills.,MHB155H1/NML155H1 or permission of instructor,Prerequisite:,Grade 4 Hebrew (or Grade 2 in Israel)/NML156H1,Exclusion:,Humanities,Distribution Requirement:,Creative and Cultural Representations (1),Breadth Requirement:,Room,LEC0101,Tuesday,HS 614,"Nizri, Y.",of  available,7,15,Yes: 0 student,In Person,,,,,,,,,,,,,,HS 614,—,10:00,12:00,https://map.utoronto.ca/?id=1809#!m/494459
PSY,The Psychology of Student Success,PSY194H1-F,,,,Course Description:,"University life presents students with all sorts of challenges as well as amazing opportunities for learning and growth. While there are many different ways to define a “successful student”, the goal of this seminar is for everyone to develop the knowledge, skills, and mindset needed to make the most of out of the university experience. Students will discover what research in psychological science has to say about facing and overcoming common academic, intrapersonal, and interpersonal challenges, as we cover topics including deliberate practice, imposter syndrome, and belongingness. Students will also learn evidence-based strategies for better managing their attention, energy, and emotions so that they may thrive (rather than just survive) in university. In addition to learning about psychology, students will develop useful skills in scientific literacy, critical thinking, self-reflection, written and oral communication, and teamwork. Restricted to first-year students. Not eligible for CR/NCR option.",N/A,Prerequisite:,N/A,Corequisite:,N/A,Exclusion:,N/A,Recommended Preparation:,Room,LEC0101,Tuesday,,"Waggoner Denton, A.",of  available,1,25,Yes: 0 student,In Person,Restricted (R2),Enrolment Controls:,"This section is restricted to two groups of students. Group 1 is given priority access until July 28. There is no course enrolment on July 29. Beginning July 30, Group 2 can enrol in this section:",Group 1: Year 1    Innis College  (Faculty of Arts and Science),Group 2: Year 1      (Faculty of Arts and Science),,,,"Thought, Belief and Behaviour (2)",,,,,IN 312,—,13:00,15:00,https://map.utoronto.ca/?id=1809#!m/494541
RLG,Great Confrontations in Ancient Israel,RLG194H1-S,,,,Course Description:,"Great Confrontations in Ancient Israel deals with ten episodes recorded in the Hebrew Bible or ""Old Testament"" in which two parties confronted each other over a great moral issue. The ten confrontations are: (1) God and Humans; (2) Adam and Eve; (3) Cain and Abel; (4) Abraham and God; (5) Jacob and Esau; (6) Joseph and Mrs. Potiphar; (7) Moses and Pharaoh; (8) Moses and Israel; (9) David and Nathan; (10) Elijah and Ahab. Restricted to first-year students. Not eligible for CR/NCR option.",Humanities,Distribution Requirement:,"Thought, Belief and Behaviour (2)",Breadth Requirement:,,,,,Room,LEC0101,Monday,,"Novak, D.",of  available,3,25,Yes: 0 student,In Person,Restricted (R1),Enrolment Controls:,This section is restricted at all times to the following students:,Year 1      (Faculty of Arts and Science),,,,,,,,,,TF 103,—,10:00,12:00,https://map.utoronto.ca/?id=1809#!m/494581
POL,First-Year Foundation Seminar: Settler Colonialism and Enduring Indigeneity,POL195H1-F,Timetable instructions,Note:,Delivery Method:  IN PERSON,Course Description:,"What is settler colonialism and how does Indigeneity endure it? This course explores the many, diverse ways that Indigenous peoples resist settler colonization and persist beyond it. We will examine Indigenous activisms, legal orders, political philosophies, and cultural productions that demonstrate settler colonialism is indeed a failing project.",Restricted to first-year students.,Distribution Requirement:,Not eligible for CR/NCR option.,Breadth Requirement:,Social Science,,Society and its Institutions (3),,Room,LEC0101,Thursday,,"Maile, U.",of  available,1,25,Yes: 0 student,In Person (See Delivery Instructions.),Restricted (R1),Enrolment Controls:,This section is restricted at all times to the following students:,Year 1      (Faculty of Arts and Science),"Year 1      (John H. Daniels Faculty of Architecture, Landscape, & Design)",,,,Lectures will be delivered in person.,Delivery instructions,Note:,,,LM 123,—,10:00,12:00,https://map.utoronto.ca/?id=1809#!m/494502
PSY,The Science of Babies,PSY195H1-S,,,,Course Description:,"Up until roughly four decades ago, infants were seen as cute, clueless creatures. Yet, research from a range of fields has led to a radical consideration of this claim; infants may be cute but they are not clueless! In this class, we will consider and discuss the science of babies. In particular, we will take a second look at long-held beliefs about the nature of infants and their knowledge. We will learn that studying infants’ perception, cognition and behaviour can offer us critical insights into long-standing philosophical questions. This course provides an interdisciplinary introduction to infancy, that includes content from psychology, philosophy, neuroscience, as well as biology and anthropology. Upon completion of this class, students will (1) have overview knowledge of aspects of infancy as it relates to perception, cognition and behavior; (2) be able to use exploratory writing to develop arguments and develop their understanding of subject matter; and (3) begin to be able to read and summarize a scientific research paper in Developmental Psychology. Restricted to first-year students. Not eligible for CR/NCR option.",Science,Distribution Requirement:,"Thought, Belief and Behaviour (2)",Breadth Requirement:,,,,,Room,LEC0101,Monday,,"Sommerville, J.",of  available,0,25,Yes: 51 students,In Person,Restricted (R1),Enrolment Controls:,This section is restricted at all times to the following students:,Year 1      (Faculty of Arts and Science),,,,,,,,,,UC 85,—,15:00,17:00,https://map.utoronto.ca/?id=1809#!m/494517
RLG,Alt-Bible: What Could Have Been,RLG195H1-F,,,,Course Description:,"Why does our contemporary Bible not include any daughters for Adam and Eve or any stories of Jesus as a young boy? What if Enoch was more prominent than Moses or Thomas more prominent than Paul? ""The Bible"" that we have is not a single book or a simple collection, but something that has grown over time, been the object of contention and argument, and has sometimes been a common ground across traditions. We examine side-by-side writings that have become canonical and writings that once held authority but have not found widespread canonical status, and strive to understand the processes by which we ended up with ""the Bible"" we have today. Restricted to first-year students. Not eligible for CR/CNR option.",Humanities,Distribution Requirement:,Creative and Cultural Representations (1),Breadth Requirement:,,,,,Room,LEC0101,Monday,,"Marshall, J.",of  available,2,25,Yes: 0 student,In Person,Restricted (R1),Enrolment Controls:,This section is restricted at all times to the following students:,Year 1      (Faculty of Arts and Science),,,,,,,,,,UC D301,—,15:00,17:00,https://map.utoronto.ca/?id=1809#!m/494517
POL,First-Year Foundation Seminar: The China Challenge,POL196H1-F,Timetable instructions,Note:,Delivery Method:  IN PERSON,Course Description:,"China’s meteoric rise to great power status has triggered an intense international debate over its global implications. While many analysts see Beijing’s rise as posing a threat to global political and economic stability, Chinese leaders have argued forcefully that China’s efforts to regain its historic preeminence will result in a ‘win-win” outcome for all states. This course will assess the merits of these contending positions through an historical examination of China’s 20th century renaissance. The course will begin by tracing the long period of imperial decline in the 19th century, culminating in China’s revolutionary rebirth as a Marxist state in 1949. A major focus will be on the Mao-era legacy of revolutionary diplomacy and the foreign policy consequences of its later transformation into a market-authoritarian powerhouse.",Restricted to first-year students.,Distribution Requirement:,Not eligible for CR/NCR option.,Breadth Requirement:,Social Science,,Society and its Institutions (3),,Room,LEC0101,Tuesday,,"Falkenheim, V.",of  available,0,25,Yes: 0 student,In Person (See Delivery Instructions.),Restricted (R1),Enrolment Controls:,This section is restricted at all times to the following students:,Year 1      (Faculty of Arts and Science),"Year 1      (John H. Daniels Faculty of Architecture, Landscape, & Design)",,,,Lectures will be delivered in person.,Delivery instructions,Note:,,,TF 203,—,14:00,16:00,https://map.utoronto.ca/?id=1809#!m/494581
POL,First-Year Foundation Seminar: The China Challenge,POL196H1-S,Timetable instructions,Note:,Delivery Method:  IN PERSON,Course Description:,"China’s meteoric rise to great power status has triggered an intense international debate over its global implications. While many analysts see Beijing’s rise as posing a threat to global political and economic stability, Chinese leaders have argued forcefully that China’s efforts to regain its historic preeminence will result in a ‘win-win” outcome for all states. This course will assess the merits of these contending positions through an historical examination of China’s 20th century renaissance. The course will begin by tracing the long period of imperial decline in the 19th century, culminating in China’s revolutionary rebirth as a Marxist state in 1949. A major focus will be on the Mao-era legacy of revolutionary diplomacy and the foreign policy consequences of its later transformation into a market-authoritarian powerhouse.",Restricted to first-year students.,Distribution Requirement:,Not eligible for CR/NCR option.,Breadth Requirement:,Social Science,,Society and its Institutions (3),,Room,LEC0101,Tuesday,,"Falkenheim, V.",of  available,0,25,Yes: 33 students,In Person (See Delivery Instructions.),Restricted (R1),Enrolment Controls:,This section is restricted at all times to the following students:,Year 1      (Faculty of Arts and Science),"Year 1      (John H. Daniels Faculty of Architecture, Landscape, & Design)",,,,Lectures will be delivered in person.,Delivery instructions,Note:,,,UC 65,—,14:00,16:00,https://map.utoronto.ca/?id=1809#!m/494517
PSY,"Critical Periods, Brain Plasticity and Development",PSY196H1-F,,,,Course Description:,"This course will ask how changes in the developing brain can influence our understanding of how humans learn. To answer this question, we will learn about how the brain changes and about how learning changes. We will dig into brain plasticity and ask how this influences “critical” or “sensitive” periods for learning: a phenomenon whereby learning can only take place during a particular time in an organism’s life. We will explore learning in a number of different ways including learning in sensory and motor systems and the development of multiple aspects of learning and memory. In all cases, we will ask how changes in the developing brain impact learning outcomes. Restricted to first-year students. Not eligible for CR/NCR option.",Science,Distribution Requirement:,Living Things and Their Environment (4),Breadth Requirement:,,,,,Room,LEC0101,Monday,,"Finn, A.",of  available,1,25,Yes: 0 student,In Person,Restricted (R1),Enrolment Controls:,This section is restricted at all times to the following students:,Year 1      (Faculty of Arts and Science),,,,,,,,,,BL 113,—,12:00,14:00,https://map.utoronto.ca/?id=1809#!m/494536
RLG,"Enchantment, Disenchantment, Re-Enchantment",RLG197H1-F,,,,Course Description:,"Modernity is associated with disenchantment, secularisation and progress, and has traditionally been understood as the successor to the enchanted, spiritual, and transcendent worldviews of antiquity and the middle ages. Re-enchantment, a term increasingly encountered in popular and academic contexts alike, demonstrates nostalgia for an enchanted past, a discomfort with the modern narrative, and a desire to recover wonder. This course will examine the history of enchantment through a series of readings taken from literature, philosophy, theology, ranging from Plato to contemporary magical realism. Restricted to first-year students. Not available for CR/NCR option.",Humanities,Distribution Requirement:,Creative and Cultural Representations (1),Breadth Requirement:,,,,,Room,LEC0101,Tuesday,,"Hampton, A.",of  available,2,25,Yes: 0 student,In Person,Restricted (R1),Enrolment Controls:,This section is restricted at all times to the following students:,Year 1      (Faculty of Arts and Science),,,,,,,,,,OI 3312,—,16:00,18:00,https://map.utoronto.ca/?id=1809#!m/494563
