COMPG,Fixed Income Securities,RSM430H1-S,Describes important fixed income securities and markets. The course emphasizes traditional bond and term structure concepts crucial to understand the securities traded in these markets. Students are required to work in the Rotman Financial Research & Trading Lab to solve the assigned problems using real time data. Not eligible for CR/NCR option. Contact Rotman Commerce for details.,Rotman Commerce: RSM332H1; Actuarial Science: ACT349H1,Prerequisite:,Social Science,Distribution Requirement:,Society and its Institutions (3),Breadth Requirement:,Room,LEC0101,Monday,—,09:00,11:00,Tuesday,—,09:00,11:00,WO 30,https://map.utoronto.ca/?id=1809#!m/494558,WO 25,https://map.utoronto.ca/?id=1809#!m/494558,"Daroga, R.",of  available,0,55,Yes: 7 students,In Person,,Restricted (R2),Enrolment Controls:,"This section is restricted to two groups of students. Group 1 is given priority access until July 28. There is no course enrolment on July 29. Beginning July 30, Group 2 can enrol in this section:",Group 1: Year 3   Rotman Commerce   (Faculty of Arts and Science),Group 1: Year 4   Rotman Commerce   (Faculty of Arts and Science),Activity,Time,Room,Instructor(s),Space Availability,Wait List,Status / Notes,LEC0201,"Daroga, R.",of  available,0,52,Yes: 7 students,In Person,Restricted (R2),Enrolment Controls:,"This section is restricted to two groups of students. Group 1 is given priority access until July 28. There is no course enrolment on July 29. Beginning July 30, Group 2 can enrol in this section:",,,,,,,,,,,,,,,,,,,,,,Group 2: ASSPE0608 SP ACTUARIAL SCIENCE,,,,,,Group 1: Year 3   Rotman Commerce   (Faculty of Arts and Science)
COMPG,Risk Management for Financial Managers,RSM432H1-S,"This course examines the ways in which risks are quantified and managed by financial institutions. The principal risks considered include market risk, credit risk and operational risk. The course also covers the evolution of bank regulation and the regulatory limits on risk taking. Not eligible for CR/NCR option. Contact Rotman Commerce for details.",RSM333H1,Prerequisite:,Social Science,Distribution Requirement:,The Physical and Mathematical Universes (5),Breadth Requirement:,Room,LEC0101,Thursday,—,09:00,11:00,Thursday,—,14:00,16:00,WO 30,https://map.utoronto.ca/?id=1809#!m/494558,VC 101,https://map.utoronto.ca/?id=1809#!m/494602,"Inostroza Padilla, N.",of  available,4,55,Yes: 0 student,In Person,,Restricted (R1),Enrolment Controls:,This section is restricted at all times to the following students:,Year 3   Rotman Commerce   (Faculty of Arts and Science),Year 4   Rotman Commerce   (Faculty of Arts and Science),Activity,Time,Room,Instructor(s),Space Availability,Wait List,Status / Notes,LEC0201,"Inostroza Padilla, N.",of  available,0,60,Yes: 1 student,In Person,Restricted (R1),Enrolment Controls:,This section is restricted at all times to the following students:,Activity,Time,Room,Instructor(s),Space Availability,Wait List,Status / Notes,LEC0301,Thursday,—,16:00,18:00,"Inostroza Padilla, N.",of  available,4,50,Yes: 0 student,In Person,Restricted (R1),Enrolment Controls:,This section is restricted at all times to the following students:,Year 3   Rotman Commerce   (Faculty of Arts and Science),,VC 101,https://map.utoronto.ca/?id=1809#!m/494602,,,Year 4   Rotman Commerce   (Faculty of Arts and Science)
COMPG,Advanced Corporate Finance,RSM433H1-F,"Applying fundamental finance ideas developed in RSM332H1 and RSM333H1 to real-life problems. The course will focus on business valuation and financial decisions in practical situations, on the assumption that students are already familiar with basic concepts from previous finance courses. Not eligible for CR/NCR option. Contact Rotman Commerce for details.",Rotman Commerce: RSM333H1; Actuarial Science: ACT349H1,Prerequisite:,Social Science,Distribution Requirement:,Society and its Institutions (3),Breadth Requirement:,Room,LEC0101,Monday,—,11:00,13:00,Thursday,—,13:00,15:00,WO 30,https://map.utoronto.ca/?id=1809#!m/494558,WO 25,https://map.utoronto.ca/?id=1809#!m/494558,"Adlam, W.",of  available,1,58,Yes: 0 student,In Person,,Restricted (R2),Enrolment Controls:,"This section is restricted to two groups of students. Group 1 is given priority access until July 28. There is no course enrolment on July 29. Beginning July 30, Group 2 can enrol in this section:",Group 1: Year 3   Rotman Commerce   (Faculty of Arts and Science),Group 1: Year 4   Rotman Commerce   (Faculty of Arts and Science),Activity,Time,Room,Instructor(s),Space Availability,Wait List,Status / Notes,LEC0201,"Adlam, W.",of  available,1,55,Yes: 0 student,In Person,Restricted (R2),Enrolment Controls:,"This section is restricted to two groups of students. Group 1 is given priority access until July 28. There is no course enrolment on July 29. Beginning July 30, Group 2 can enrol in this section:",Activity,Time,Room,Instructor(s),Space Availability,Wait List,Status / Notes,LEC0301,Tuesday,—,15:00,17:00,"Adlam, W.",of  available,1,60,Yes: 0 student,In Person,Restricted (R2),Enrolment Controls:,"This section is restricted to two groups of students. Group 1 is given priority access until July 28. There is no course enrolment on July 29. Beginning July 30, Group 2 can enrol in this section:",Group 2: ASSPE0608 SP ACTUARIAL SCIENCE,,WW 126,https://map.utoronto.ca/?id=1809#!m/494547,,,Group 1: Year 3   Rotman Commerce   (Faculty of Arts and Science)
COMPG,Advanced Corporate Finance,RSM433H1-S,"Applying fundamental finance ideas developed in RSM332H1 and RSM333H1 to real-life problems. The course will focus on business valuation and financial decisions in practical situations, on the assumption that students are already familiar with basic concepts from previous finance courses. Not eligible for CR/NCR option. Contact Rotman Commerce for details.",Rotman Commerce: RSM333H1; Actuarial Science: ACT349H1,Prerequisite:,Social Science,Distribution Requirement:,Society and its Institutions (3),Breadth Requirement:,Room,LEC0101,Monday,—,11:00,13:00,Monday,—,14:00,16:00,WO 30,https://map.utoronto.ca/?id=1809#!m/494558,WO 20,https://map.utoronto.ca/?id=1809#!m/494558,"Celerier, C.",of  available,0,55,Yes: 5 students,In Person,,Restricted (R2),Enrolment Controls:,"This section is restricted to two groups of students. Group 1 is given priority access until July 28. There is no course enrolment on July 29. Beginning July 30, Group 2 can enrol in this section:",Group 1: Year 3   Rotman Commerce   (Faculty of Arts and Science),Group 1: Year 4   Rotman Commerce   (Faculty of Arts and Science),Activity,Time,Room,Instructor(s),Space Availability,Wait List,Status / Notes,LEC0201,"Celerier, C.",of  available,0,56,Yes: 4 students,In Person,Restricted (R2),Enrolment Controls:,"This section is restricted to two groups of students. Group 1 is given priority access until July 28. There is no course enrolment on July 29. Beginning July 30, Group 2 can enrol in this section:",Activity,Time,Room,Instructor(s),Space Availability,Wait List,Status / Notes,LEC0301,Monday,—,16:00,18:00,"Celerier, C.",of  available,0,56,Yes: 4 students,In Person,Restricted (R2),Enrolment Controls:,"This section is restricted to two groups of students. Group 1 is given priority access until July 28. There is no course enrolment on July 29. Beginning July 30, Group 2 can enrol in this section:",Group 2: ASSPE0608 SP ACTUARIAL SCIENCE,,WO 20,https://map.utoronto.ca/?id=1809#!m/494558,,,Group 1: Year 3   Rotman Commerce   (Faculty of Arts and Science)
COMPG,Financial Trading Strategies,RSM434H1-F,This course will use finance theory applied with Excel applications to understand potential returns and risks inherent in particular investment/trading strategies. Learning-by-doing will be facilitated by simulation-based cases focused on particular risks. This training will be analogous to using a flight simulator for learning to fly. Not eligible for CR/NCR option. Contact Rotman Commerce for details.,RSM332H1,Prerequisite:,RSM412H1 Financial Trading Strategies,Exclusion:,Social Science,Distribution Requirement:,Room,LEC0101,Monday,—,12:00,14:00,Monday,—,14:00,16:00,,,,,"Geoffrey, C.",of  available,0,60,Yes: 0 student,In Person,Contact DEPT,Restricted (R1),Enrolment Controls:,This section is restricted at all times to the following students:,Year 3   Rotman Commerce   (Faculty of Arts and Science),Year 4   Rotman Commerce   (Faculty of Arts and Science),Activity,Time,Room,Instructor(s),Space Availability,Wait List,Status / Notes,LEC0201,"Geoffrey, C.",of  available,4,60,Yes: 0 student,In Person,Restricted (R1),Enrolment Controls:,This section is restricted at all times to the following students:,,,,,,,,,,,,,,,,,,,,,,Year 3   Rotman Commerce   (Faculty of Arts and Science),The Physical and Mathematical Universes (5),,,Breadth Requirement:,,Year 4   Rotman Commerce   (Faculty of Arts and Science)
COMPG,Financial Trading Strategies,RSM434H1-S,This course will use finance theory applied with Excel applications to understand potential returns and risks inherent in particular investment/trading strategies. Learning-by-doing will be facilitated by simulation-based cases focused on particular risks. This training will be analogous to using a flight simulator for learning to fly. Not eligible for CR/NCR option. Contact Rotman Commerce for details.,RSM332H1,Prerequisite:,RSM412H1 Financial Trading Strategies,Exclusion:,Social Science,Distribution Requirement:,Room,LEC0101,Monday,—,12:00,14:00,Monday,—,14:00,16:00,,,,,"McCurdy, T.",of  available,1,57,Yes: 0 student,In Person,Contact DEPT,Restricted (R1),Enrolment Controls:,This section is restricted at all times to the following students:,Year 3   Rotman Commerce   (Faculty of Arts and Science),Year 4   Rotman Commerce   (Faculty of Arts and Science),Activity,Time,Room,Instructor(s),Space Availability,Wait List,Status / Notes,LEC0201,"Geoffrey, C.",of  available,0,41,Yes: 11 students,In Person,Restricted (R1),Enrolment Controls:,This section is restricted at all times to the following students:,Activity,Time,Room,Instructor(s),Space Availability,Wait List,Status / Notes,LEC2001,Monday,—,14:00,16:00,"Geoffrey, C.",of  available,1,16,Yes: 0 student,In Person,Restricted (R1),Enrolment Controls:,This section is restricted at all times to the following students:,Year 3   Rotman Commerce   (Faculty of Arts and Science),The Physical and Mathematical Universes (5),,,Breadth Requirement:,,Year 4   Rotman Commerce   (Faculty of Arts and Science)
COMPG,Futures and Options Markets,RSM435H1-F,"This course covers the analysis of derivative instruments such as forwards, futures, swaps and options. By the end of the course, students will have good knowledge of how these contracts work, how they are used and how they are priced. A fee of $35 will be charged to your student account for software purchase. Not eligible for CR/NCR option. Contact Rotman Commerce for details.","ECO204Y1/ECO206Y1, RSM332H1",Prerequisite:,ACT370H1,Exclusion:,Social Science,Distribution Requirement:,Room,LEC0101,Thursday,—,09:00,11:00,Thursday,—,11:00,13:00,RT 142,https://map.utoronto.ca/?id=1809#!m/494538,RT 142,https://map.utoronto.ca/?id=1809#!m/494538,"MacKay, A.",of  available,18,50,Yes: 0 student,In Person,,Restricted (R1),Enrolment Controls:,This section is restricted at all times to the following students:,Year 3   Rotman Commerce   (Faculty of Arts and Science),Year 4   Rotman Commerce   (Faculty of Arts and Science),Activity,Time,Room,Instructor(s),Space Availability,Wait List,Status / Notes,LEC0201,"MacKay, A.",of  available,12,50,Yes: 0 student,In Person,Restricted (R1),Enrolment Controls:,This section is restricted at all times to the following students:,Activity,Time,Room,Instructor(s),Space Availability,Wait List,Status / Notes,LEC0301,Thursday,—,15:00,17:00,"MacKay, A.",of  available,18,50,Yes: 0 student,In Person,Restricted (R1),Enrolment Controls:,This section is restricted at all times to the following students:,Year 3   Rotman Commerce   (Faculty of Arts and Science),The Physical and Mathematical Universes (5),RT 142,https://map.utoronto.ca/?id=1809#!m/494538,Breadth Requirement:,,Year 4   Rotman Commerce   (Faculty of Arts and Science)
COMPG,Futures and Options Markets,RSM435H1-S,"This course covers the analysis of derivative instruments such as forwards, futures, swaps and options. By the end of the course, students will have good knowledge of how these contracts work, how they are used and how they are priced. A fee of $35 will be charged to your student account for software purchase. Not eligible for CR/NCR option. Contact Rotman Commerce for details.","ECO204Y1/ECO206Y1, RSM332H1",Prerequisite:,ACT370H1,Exclusion:,Social Science,Distribution Requirement:,Room,LEC5101,Thursday,—,18:00,20:00,,,,,WO 30,https://map.utoronto.ca/?id=1809#!m/494558,,,"Wang, K.",of  available,0,55,Yes: 3 students,In Person,,Restricted (R1),Enrolment Controls:,This section is restricted at all times to the following students:,Year 3   Rotman Commerce   (Faculty of Arts and Science),Year 4   Rotman Commerce   (Faculty of Arts and Science),,,,,,,,,,,,,,,,,,,,,,,,,,,,,,,,,,,,,,,,The Physical and Mathematical Universes (5),,,Breadth Requirement:,,
COMPG,International Finance,RSM437H1-S,"International financial markets, exchange rates, forward markets, interest rate parity. International dimensions of investment, including both portfolio and foreign direct investment. International dimensions of corporate finance, including valuation and the cost of capital of foreign investments. Not eligible for CR/NCR option. Contact Rotman Commerce for details.",Rotman Commerce: RSM333H1; Actuarial Science: ACT349H1,Prerequisite:,Social Science,Distribution Requirement:,Society and its Institutions (3),Breadth Requirement:,Room,LEC0101,Monday,—,11:00,13:00,Monday,—,15:00,17:00,RT 142,https://map.utoronto.ca/?id=1809#!m/494538,RT 142,https://map.utoronto.ca/?id=1809#!m/494538,"Rotenberg, W.",of  available,0,50,Yes: 17 students,In Person,,Restricted (R2),Enrolment Controls:,"This section is restricted to two groups of students. Group 1 is given priority access until July 28. There is no course enrolment on July 29. Beginning July 30, Group 2 can enrol in this section:",Group 1: Year 3   Rotman Commerce   (Faculty of Arts and Science),Group 1: Year 4   Rotman Commerce   (Faculty of Arts and Science),Activity,Time,Room,Instructor(s),Space Availability,Wait List,Status / Notes,LEC0201,"Rotenberg, W.",of  available,0,50,Yes: 16 students,In Person,Restricted (R2),Enrolment Controls:,"This section is restricted to two groups of students. Group 1 is given priority access until July 28. There is no course enrolment on July 29. Beginning July 30, Group 2 can enrol in this section:",Activity,Time,Room,Instructor(s),Space Availability,Wait List,Status / Notes,LEC0301,Tuesday,—,09:00,11:00,"Rotenberg, W.",of  available,0,50,Yes: 12 students,In Person,Restricted (R2),Enrolment Controls:,"This section is restricted to two groups of students. Group 1 is given priority access until July 28. There is no course enrolment on July 29. Beginning July 30, Group 2 can enrol in this section:",Group 2: ASSPE0608 SP ACTUARIAL SCIENCE,,RT 142,https://map.utoronto.ca/?id=1809#!m/494538,,,Group 1: Year 3   Rotman Commerce   (Faculty of Arts and Science)
COMPG,Private Equity and Entrepreneurial Finance,RSM439H1-F,"The primary objective of the course is to improve students’ ability to understand the concepts and institutions involved in private equity. The course will provide students with skill sets so they can analyze and understand private equity from multiple perspectives: the perspective of the individual/firm seeking and receiving private equity finance; the perspective of the private equity fund; and, the perspective of the limited partners that provide finance for private equity funds. Students will also learn how to build Leverage Buyout (LBO) models. Not eligible for CR/NCR option. Contact Rotman Commerce for details.",Completion of 14.0 credits; RSM333H1,Prerequisite:,"RSM410H1 (Special Topics in Management: Private Equity and Entrepreneurial Finance); offered in Winter 2015, Winter 2018, and Fall 2018",Exclusion:,Social Science,Distribution Requirement:,Room,LEC0101,Tuesday,—,09:00,11:00,Tuesday,—,11:00,13:00,WO 20,https://map.utoronto.ca/?id=1809#!m/494558,WO 20,https://map.utoronto.ca/?id=1809#!m/494558,"Dyck, A.",of  available,0,54,Yes: 0 student,In Person,,Restricted (R1),Enrolment Controls:,This section is restricted at all times to the following students:,Rotman Commerce   (Faculty of Arts and Science),Rotman Commerce   (Faculty of Arts and Science),Activity,Time,Room,Instructor(s),Space Availability,Wait List,Status / Notes,LEC5101,"Dyck, A.",of  available,0,54,Yes: 0 student,In Person,Restricted (R1),Enrolment Controls:,This section is restricted at all times to the following students:,Activity,Time,Room,Instructor(s),Space Availability,Wait List,Status / Notes,LEC5201,Thursday,—,17:00,19:00,"Goldblum, W.",of  available,0,54,Yes: 0 student,In Person,Restricted (R1),Enrolment Controls:,This section is restricted at all times to the following students:,Rotman Commerce   (Faculty of Arts and Science),Society and its Institutions (3),WO 35,https://map.utoronto.ca/?id=1809#!m/494558,Breadth Requirement:,,
SLA,Russian Thinkers,SLA449H1-S,"Social and political change, national and spiritual destiny in philosophical, journalistic and critical writings. From Slavophiles and Westernizers to revolutionary and apocalyptic thought. Reflections on Russia's position between Europe and Asia and on the place of Russia's East Asian neighbors in its history and culture. Taught in English, readings in English.",Humanities,Distribution Requirement:,"Thought, Belief and Behaviour (2)",Breadth Requirement:,,,Room,LEC0101,Friday,—,12:00,15:00,,,,,AH 107,https://map.utoronto.ca/?id=1809#!m/494578,,,,of  available,14,25,Yes: 0 student,In Person,,,,,,,,,,,,,,,,,,,,,,,,,,,,,,,,,,,,,,,,,,,,,,,,,,—,
SDST,Sexuality & Disability,JNS450H1-S,"An interdisciplinary and intersectional approach to the study of disability and sexuality. Students will engage with historical, mainstream and critical discourses and explore complex issues and representations pertaining to disability, sexuality, sexual practices and desire. Draws from a range of writings and cultural texts in queer, crip and sexuality studies.",SDS255H1/SDS256H1 (UNI255H1/UNI256H1) or NEW240Y1/CSE241Y1 or permission of the Instructor,Prerequisite:,"SDS455H1 (Special Topics in Sexual Diversity Studies: Sexuality & Disability), offered in Fall 2015",Exclusion:,Social Science,Distribution Requirement:,Room,LEC0101,Thursday,—,15:00,17:00,,,,,WI 2006,https://map.utoronto.ca/?id=1809#!m/494503,,,"Anderson, D.",of  available,0,21,Yes: 5 students,In Person,,Priority (P),Enrolment Controls:,"Priority enrolment is given to the groups of students listed below until July 28. There is no course enrolment on July 29. Beginning July 30, all other Arts & Science students can enrol in this section. UTM/UTSC students can enrol in this section starting August 6. The following groups of students are given priority access until July 28:",ASMAJ1140 MA EQUITY STUDIES,ASMAJ1141 MA EQUITY & SOLIDARITY,,,,,,,,,,,,,,,,,,,,,,,,,,,,,,,,,,,,,,,ASMAJ1240 MA SEXUAL DIVERSITY STUDIES,Society and its Institutions (3),,,Breadth Requirement:,,ASMIN1140 MI EQUITY STUDIES
COMPG,Marketing and Behavioural Economics,RSM450H1-F,"What motivates consumers, investors, employees, and managers? In this highly interdisciplinary course, we will examine topics such as the role of emotions in decision-making, “irrational” patterns of how people think about products, money, or investments, and how expectations shape perceptions. Not eligible for CR/NCR option. Contact Rotman Commerce for details.",Completion of 9.0 credits,Prerequisite:,"RSM418H1 (Special Topics in Management: Integrative Thinking - Psychology and Markets), offered in Fall 2008/Fall 2009/Fall 2010",Exclusion:,Social Science,Distribution Requirement:,Room,LEC0101,Friday,—,09:00,11:00,,,,,WO 30,https://map.utoronto.ca/?id=1809#!m/494558,,,"Rondina, R.",of  available,23,50,Yes: 0 student,In Person,,Restricted (R1),Enrolment Controls:,This section is restricted at all times to the following students:,Year 3   Rotman Commerce   (Faculty of Arts and Science),Year 4   Rotman Commerce   (Faculty of Arts and Science),,,,,,,,,,,,,,,,,,,,,,,,,,,,,,,,,,,,,,,,"Thought, Belief and Behaviour (2)",,,Breadth Requirement:,,
COMPG,Marketing and Behavioural Economics,RSM450H1-S,"What motivates consumers, investors, employees, and managers? In this highly interdisciplinary course, we will examine topics such as the role of emotions in decision-making, “irrational” patterns of how people think about products, money, or investments, and how expectations shape perceptions. Not eligible for CR/NCR option. Contact Rotman Commerce for details.",Completion of 9.0 credits,Prerequisite:,"RSM418H1 (Special Topics in Management: Integrative Thinking - Psychology and Markets), offered in Fall 2008/Fall 2009/Fall 2010",Exclusion:,Social Science,Distribution Requirement:,Room,LEC0101,Wednesday,—,11:00,13:00,,,,,WO 20,https://map.utoronto.ca/?id=1809#!m/494558,,,,of  available,15,50,Yes: 0 student,In Person,,Restricted (R1),Enrolment Controls:,This section is restricted at all times to the following students:,Year 3   Rotman Commerce   (Faculty of Arts and Science),Year 4   Rotman Commerce   (Faculty of Arts and Science),,,,,,,,,,,,,,,,,,,,,,,,,,,,,,,,,,,,,,,,"Thought, Belief and Behaviour (2)",,,Breadth Requirement:,—,
COMPG,Creativity and Business Innovation,RSM452H1-F,"Creativity is identified as the most important skill business leaders need at all levels. As humans, we must first embrace and develop our creativity, and then use technology to creatively solve business problems. This course guides individuals to combine their thinking, knowledge and skills in imaginative ways, develop key creative behaviours and build personal and professional creative confidence. Through a combination of active lectures, immersive in-class and in-field activities along with online tutorials, you will engage in creative ways to see business problems and opportunities in new ways and develop solutions unseen and unimagined by others. Not eligible for CR/NCR.",RSM250H1; Completion of 14.0 FCEs,Prerequisite:,RSM414H1 (Special Topics in Management: Creativity for Business Innovation); offered in Fall 2018 and Fall 2019,Exclusion:,Social Science,Distribution Requirement:,Room,LEC0101,Monday,—,14:00,16:00,,,,,OI 4422,https://map.utoronto.ca/?id=1809#!m/494563,,,"Beausoleil, A.",of  available,0,35,Yes: 0 student,In Person,,Restricted (R1),Enrolment Controls:,This section is restricted at all times to the following students:,Rotman Commerce   (Faculty of Arts and Science),,,,,,,,,,,,,,,,,,,,,,,,,,,,,,,,,,,,,,,,,Creative and Cultural Representations (1),,,Breadth Requirement:,,
COMPG,Sales and Distribution Strategy,RSM454H1-S,"Once you have a great product or service to sell, you need the right channel partners and strategies to bring your offering to the end-user. This course discusses what and how many intermediaries to partner with, partner roles and responsibilities, and how to stimulate high performance from channel partners.",RSM250H1,Prerequisite:,Social Science,Distribution Requirement:,Society and its Institutions (3),Breadth Requirement:,Room,LEC0101,Tuesday,—,16:00,18:00,,,,,WO 25,https://map.utoronto.ca/?id=1809#!m/494558,,,"Strejcek, B.",of  available,32,50,Yes: 0 student,In Person,,Restricted (R1),Enrolment Controls:,This section is restricted at all times to the following students:,Year 4   Rotman Commerce   (Faculty of Arts and Science),,,,,,,,,,,,,,,,,,,,,,,,,,,,,,,,,,,,,,,,,,,,,,
COMPG,Pricing,RSM455H1-F,"Approaches pricing decision as an intersection of economics and psychology. Using product categories as diverse as financial services, healthcare, industrial products and consumer packaged goods, students study dynamic pricing, value pricing, price customization, price bundling and multi-part tariffs, menu costs and price stickiness, sales promotions, and pricing in two-sided markets. Not eligible for CR/NCR option. Contact Rotman Commerce for details.",Completion of 9.0 credits; RSM250H1,Prerequisite:,Social Science,Distribution Requirement:,Society and its Institutions (3),Breadth Requirement:,Room,LEC5101,,,,,,,,,,,,,,,,,,,,,,,,,,,,,,,,,,,,,,,,,,,,,,,,,,,,,,,,,,,,,,,,,,,,—,
COMPG,Pricing,RSM455H1-S,"Approaches pricing decision as an intersection of economics and psychology. Using product categories as diverse as financial services, healthcare, industrial products and consumer packaged goods, students study dynamic pricing, value pricing, price customization, price bundling and multi-part tariffs, menu costs and price stickiness, sales promotions, and pricing in two-sided markets. Not eligible for CR/NCR option. Contact Rotman Commerce for details.",Completion of 9.0 credits; RSM250H1,Prerequisite:,Social Science,Distribution Requirement:,Society and its Institutions (3),Breadth Requirement:,Room,LEC0101,Wednesday,—,15:00,17:00,,,,,WO 30,https://map.utoronto.ca/?id=1809#!m/494558,,,"Zhong, Z.",of  available,21,50,Yes: 0 student,In Person,,Restricted (R1),Enrolment Controls:,This section is restricted at all times to the following students:,Year 3   Rotman Commerce   (Faculty of Arts and Science),Year 4   Rotman Commerce   (Faculty of Arts and Science),,,,,,,,,,,,,,,,,,,,,,,,,,,,,,,,,,,,,,,,,,,,,
