COMPG,Principles of Marketing,RSM250H1-S,"Students receive an introduction to the basic concepts, theories, and methods of contemporary marketing. The course offers a comprehensive framework to develop successful marketing efforts and allows students to create a marketing plan. Specific topics examined: market research, consumer behaviour, segmentation, product policy, pricing, distribution, communications, sales, and direct marketing. Not eligible for CR/NCR option. Contact Rotman Commerce for details.",Note: This course is normally taken in first year.,Distribution Requirement:,Social Science,Breadth Requirement:,"Thought, Belief and Behaviour (2)",,Room,LEC0101,Monday,—,09:00,11:00,Tuesday,—,16:00,18:00,SS 1074,https://map.utoronto.ca/?id=1809#!m/494510,BL 325,https://map.utoronto.ca/?id=1809#!m/494536,"Richards, D.",of  available,10,65,Yes: 0 student,In Person,,Restricted (R1),Enrolment Controls:,This section is restricted at all times to the following students:,Year 1 COMMERCE     (Faculty of Arts and Science),Year 1 COMMERCE     (Faculty of Arts and Science),Activity,Time,Room,Instructor(s),Space Availability,Wait List,Status / Notes,LEC0201,"Akchurina, D.",of  available,0,65,Yes: 11 students,In Person,Restricted (R1),Enrolment Controls:,This section is restricted at all times to the following students:,Activity,Time,Room,Instructor(s),Space Availability,Wait List,Status / Notes,LEC0301,Wednesday,—,09:00,11:00,"Akchurina, D.",of  available,53,60,Yes: 0 student,In Person,Restricted (R1),Enrolment Controls:,This section is restricted at all times to the following students:,Year 1 COMMERCE     (Faculty of Arts and Science),,UC 52,https://map.utoronto.ca/?id=1809#!m/494517,,—,Year 1 COMMERCE     (Faculty of Arts and Science)
SDST,Histories of Sexuality,SDS255H1-F,"An interdisciplinary examination of sexuality across cultures and periods. How are sexualities represented? How are they suppressed or celebrated? How and why are they labeled as straight, gay, lesbian, bisexual, queer, or perverse? How do sexualities change with race/ethnicity, class, gender, and geographies?",UNI255H1,Exclusion:,"Humanities, Social Science",Distribution Requirement:,Society and its Institutions (3),Breadth Requirement:,Room,LEC0101,Tuesday,—,14:00,16:00,,,,,SS 1087,https://map.utoronto.ca/?id=1809#!m/494510,,,"Rayter, S.",of  available,2,80,Yes: 0 student,In Person,,,,,,,,,,,,,,,,,,,,,,,,,,,,,,,,,,,,,,,,,,,,,,,,,,—,
SDST,Methods in Sexual Diversity Studies,SDS256H1-S,"This course examines a variety of methodological approaches used in humanities and humanist social sciences concerning sexuality and gendered diversity. Students will explore some of the popular methods in sexuality studies including ethnography, archival research, visual cultural studies, oral history, and media and discourse analysis.",UNI256H1,Exclusion:,Social Science,Distribution Requirement:,Society and its Institutions (3),Breadth Requirement:,Room,LEC0101,Monday,—,15:00,18:00,,,,,SS 1085,https://map.utoronto.ca/?id=1809#!m/494510,,,"Nixon, K.",of  available,40,80,Yes: 0 student,In Person,,,,,,,,,,,,,,,,,,,,,,,,,,,,,,,,,,,,,,,,,,,,,,,,,,—,
SLA,"Intermediate Bosnian, Croatian, and Serbian I",SLA257H1-F,Systematic study of morphology and syntax. Intermediate composition and oral practice. Reading and translation of contemporary and more complex texts in BCS.,SLA107Y1 or permission of instructor,Prerequisite:,"SLA257Y1, SLA307Y1, SLA316Y1",Exclusion:,Humanities,Distribution Requirement:,Room,LEC0101,Monday,—,10:00,12:00,Wednesday,—,10:00,12:00,AH 105,https://map.utoronto.ca/?id=1809#!m/494578,AH 105,https://map.utoronto.ca/?id=1809#!m/494578,"Petrov, A.",of  available,21,25,Yes: 0 student,In Person,,,,,,,,,,,,,,,,,,,,,,,,,,,,,,,,,,,,,,,,,,,,,,Creative and Cultural Representations (1),,,Breadth Requirement:,,
COMPG,Organizational Behaviour,RSM260H1-F,"Theoretical ideas and practical applications concerning the behaviour of individuals and groups in organizations. We explore relevant topics for management: motivation, personality, perception, decision-making, groups, and negotiation. A fee of $10 will be charged to your student account for a simulation handbook. Not eligible for CR/NCR option. Contact Rotman Commerce for details.",Completion of the Rotman Commerce Guaranteed Admission requirements.,Prerequisite:,"IRE260H1, PSY332H1, WDW260H1",Exclusion:,Social Science,Distribution Requirement:,Room,LEC0101,Monday,—,09:00,11:00,Monday,—,11:00,13:00,WO 35,https://map.utoronto.ca/?id=1809#!m/494558,OI 5150,https://map.utoronto.ca/?id=1809#!m/494563,"Ruttan, R.",of  available,0,70,Yes: 0 student,Online - Synchronous,—,Restricted (R1),Enrolment Controls:,This section is restricted at all times to the following students:,Rotman Commerce   (Faculty of Arts and Science),Rotman Commerce   (Faculty of Arts and Science),Activity,Time,Room,Instructor(s),Space Availability,Wait List,Status / Notes,LEC0201,"Ruttan, R.",of  available,0,70,Yes: 0 student,Online - Synchronous,Restricted (R1),Enrolment Controls:,This section is restricted at all times to the following students:,Activity,Time,Room,Instructor(s),Space Availability,Wait List,Status / Notes,LEC0301,Tuesday,—,11:00,13:00,"Feinberg, M.",of  available,0,56,Yes: 0 student,In Person,Restricted (R1),Enrolment Controls:,This section is restricted at all times to the following students:,Rotman Commerce   (Faculty of Arts and Science),"Thought, Belief and Behaviour (2)",WO 25,https://map.utoronto.ca/?id=1809#!m/494558,Breadth Requirement:,,Rotman Commerce   (Faculty of Arts and Science)
COMPG,Organizational Behaviour,RSM260H1-S,"Theoretical ideas and practical applications concerning the behaviour of individuals and groups in organizations. We explore relevant topics for management: motivation, personality, perception, decision-making, groups, and negotiation. A fee of $10 will be charged to your student account for a simulation handbook. Not eligible for CR/NCR option. Contact Rotman Commerce for details.",Completion of the Rotman Commerce Guaranteed Admission requirements.,Prerequisite:,"IRE260H1, PSY332H1, WDW260H1",Exclusion:,Social Science,Distribution Requirement:,Room,LEC0101,Monday,—,09:00,11:00,Monday,—,11:00,13:00,WO 20,https://map.utoronto.ca/?id=1809#!m/494558,WO 20,https://map.utoronto.ca/?id=1809#!m/494558,"Christianson, M.",of  available,0,56,Yes: 7 students,In Person,,Restricted (R1),Enrolment Controls:,This section is restricted at all times to the following students:,Rotman Commerce   (Faculty of Arts and Science),Rotman Commerce   (Faculty of Arts and Science),Activity,Time,Room,Instructor(s),Space Availability,Wait List,Status / Notes,LEC0201,"Christianson, M.",of  available,0,56,Yes: 3 students,In Person,Restricted (R1),Enrolment Controls:,This section is restricted at all times to the following students:,Activity,Time,Room,Instructor(s),Space Availability,Wait List,Status / Notes,LEC0301,Tuesday,—,09:00,11:00,"Feinberg, M.",of  available,0,56,Yes: 4 students,In Person,Restricted (R1),Enrolment Controls:,This section is restricted at all times to the following students:,Rotman Commerce   (Faculty of Arts and Science),"Thought, Belief and Behaviour (2)",RW 143,https://map.utoronto.ca/?id=1809#!m/494515,Breadth Requirement:,,Rotman Commerce   (Faculty of Arts and Science)
SLA,Constructing Space: A History of Russian Art and Architecture,SLA260H1-F,"Chronologically organized and covering a period of ten centuries, from the eleventh to the twenty-first, the course has a special focus, the rendering of space and perspective. Beginning with the so-called “reverse perspective” of Russian Icons and the devotional world of churches and cathedrals, continuing with the geometrically organized, rational space of the 18th century and St. Petersburg, and moving on to the distorted reality of the Russian avant-garde and Socialist Realism’s attempt at reproducing reality “as it is,” the course concludes by asking where this oscillating acceptance and rejection of illusion leaves us in the 21st century. Consideration of paintings, buildings, sculptures, selected literary texts and films.",None,Prerequisite:,None,Corequisite:,None,Exclusion:,Room,LEC0101,Tuesday,—,15:00,17:00,,,,,TF 200,https://map.utoronto.ca/?id=1809#!m/494581,,,"Smolyarova, T.",of  available,24,40,Yes: 0 student,In Person,,,,,,,,,,,,,,,,,,,,,,,,,,,,,,,,,,,,,,,,,,,,,,FAH102H1,,,Recommended Preparation:,,
COMPG,Operations Management,RSM270H1-F,"Introduction to the management of business processes that convert inputs (labor, material, equipment) into outputs (goods and services) for internal and external markets. Topics include aggregate planning, inventory processes, supply chain management and service operations management. Presents modern quantitative and computing tools necessary for in-depth operational design and analysis. Not eligible for CR/NCR option. Contact Rotman Commerce for details.",Completion of the Rotman Commerce Guaranteed Admission requirements.,Prerequisite:,Social Science,Distribution Requirement:,The Physical and Mathematical Universes (5),Breadth Requirement:,Room,LEC0101,Monday,—,09:00,11:00,Tuesday,—,09:00,11:00,WO 25,https://map.utoronto.ca/?id=1809#!m/494558,RW 143,https://map.utoronto.ca/?id=1809#!m/494515,"Jan, P.",of  available,8,50,Yes: 0 student,In Person (See Delivery Instructions.),,Restricted (R1),Enrolment Controls:,This section is restricted at all times to the following students:,Rotman Commerce   (Faculty of Arts and Science),Rotman Commerce   (Faculty of Arts and Science),Activity,Time,Room,Instructor(s),Space Availability,Wait List,Status / Notes,LEC0201,"Roshanaei, V.",of  available,7,50,Yes: 0 student,In Person (See Delivery Instructions.),Restricted (R1),Enrolment Controls:,This section is restricted at all times to the following students:,Activity,Time,Room,Instructor(s),Space Availability,Wait List,Status / Notes,LEC0301,Tuesday,—,13:00,15:00,"Roshanaei, V.",of  available,4,50,Yes: 0 student,In Person (See Delivery Instructions.),Restricted (R1),Enrolment Controls:,This section is restricted at all times to the following students:,Rotman Commerce   (Faculty of Arts and Science),,WO 35,https://map.utoronto.ca/?id=1809#!m/494558,,—,Rotman Commerce   (Faculty of Arts and Science)
COMPG,Operations Management,RSM270H1-S,"Introduction to the management of business processes that convert inputs (labor, material, equipment) into outputs (goods and services) for internal and external markets. Topics include aggregate planning, inventory processes, supply chain management and service operations management. Presents modern quantitative and computing tools necessary for in-depth operational design and analysis. Not eligible for CR/NCR option. Contact Rotman Commerce for details.",Completion of the Rotman Commerce Guaranteed Admission requirements.,Prerequisite:,Social Science,Distribution Requirement:,The Physical and Mathematical Universes (5),Breadth Requirement:,Room,LEC0101,Monday,—,09:00,11:00,Wednesday,—,14:00,16:00,SS 1088,https://map.utoronto.ca/?id=1809#!m/494510,MP 137,https://map.utoronto.ca/?id=1809#!m/494490,"Malekian, A.",of  available,0,55,Yes: 8 students,In Person (See Delivery Instructions.),,Restricted (R1),Enrolment Controls:,This section is restricted at all times to the following students:,Rotman Commerce   (Faculty of Arts and Science),Rotman Commerce   (Faculty of Arts and Science),Activity,Time,Room,Instructor(s),Space Availability,Wait List,Status / Notes,LEC0201,"Malekian, A.",of  available,0,60,Yes: 11 students,In Person (See Delivery Instructions.),Restricted (R1),Enrolment Controls:,This section is restricted at all times to the following students:,Activity,Time,Room,Instructor(s),Space Availability,Wait List,Status / Notes,LEC0301,Wednesday,—,16:00,18:00,"Liu, S.",of  available,0,59,Yes: 7 students,In Person (See Delivery Instructions.),Restricted (R1),Enrolment Controls:,This section is restricted at all times to the following students:,Rotman Commerce   (Faculty of Arts and Science),,UC 244,https://map.utoronto.ca/?id=1809#!m/494517,,—,Rotman Commerce   (Faculty of Arts and Science)
SLA,"Intermediate Bosnian, Croatian, and Serbian II",SLA277H1-S,Continuation of SLA257H1. Systematic study of morphology and syntax. Intermediate composition and oral practice. Reading and translation of contemporary texts in BCS.,SLA257H1 or permission of instructor,Prerequisite:,SLA257Y1,Exclusion:,Humanities,Distribution Requirement:,Room,LEC0101,Monday,—,10:00,12:00,Wednesday,—,10:00,12:00,AH 105,https://map.utoronto.ca/?id=1809#!m/494578,AH 105,https://map.utoronto.ca/?id=1809#!m/494578,"Petrov, A.",of  available,19,25,Yes: 0 student,In Person,,,,,,,,,,,,,,,,,,,,,,,,,,,,,,,,,,,,,,,,,,,,,,Creative and Cultural Representations (1),,,Breadth Requirement:,,
SDST,Queer Popular Culture,SDS279H1-S,"This introductory course examines the critical relationship between popular culture and queer sexualities in historical and contemporary contexts. The course will draw upon literature from performance studies, media studies, and queer of colour cultural productions. Students will engage with a range of queer public cultures and arts, including drag performance, queer musics, social media networks, and popular media.","SDS379H1, UNI379H1",Exclusion:,"Introductory course in Sexual Diversity Studies, Women and Gender Studies, or Equity Studies",Recommended Preparation:,Humanities,Distribution Requirement:,Room,LEC0101,Monday,—,12:00,14:00,,,,,UC 179,https://map.utoronto.ca/?id=1809#!m/494517,,,"Minai, N.",of  available,0,80,Yes: 13 students,In Person,,,,,,,,,,,,,,,,,,,,,,,,,,,,,,,,,,,,,,,,,,,,,,Creative and Cultural Representations (1),,,Breadth Requirement:,,
SLA,Finnish Musical Culture from Sibelius to Heavy Metal,FIN280H1-F,"Analyzing the role of music in Finnish cultural identity, history, and society, this course explores both traditional and contemporary Finnish music, concentrating on what makes Finnish musical culture unique: Sibelius, kantele, folk music, heavy metal, rock and pop music. We will explore the themes of national and international music, the music industry, and the globalization of Finland's music.",None,Prerequisite:,None,Exclusion:,None,Recommended Preparation:,Room,LEC0101,Tuesday,—,15:00,17:00,,,,,WW 119,https://map.utoronto.ca/?id=1809#!m/494547,,,"Muhonen, A.",of  available,6,20,Yes: 0 student,In Person,,,,,,,,,,,,,,,,,,,,,,,,,,,,,,,,,,,,,,,,,,,,,,Humanities,,,Distribution Requirement:,,
SLA,Russian and East European Science Fiction,SLA286H1-F,"Science fiction from Russia and Eastern Europe combines radical aesthetics, thought experiments, and engagement with socio-political conditions, censorship, and technological innovation. This course will study Russian and East European science fiction's cultural, historical, and political contexts, examining how the genre comments upon the texts’ present historical moment and imagines new possibilities.",None,Prerequisite:,SLA486H1,Exclusion:,Humanities,Distribution Requirement:,Room,LEC0101,Thursday,—,12:00,14:00,,,,,TF 200,https://map.utoronto.ca/?id=1809#!m/494581,,,"Mandusic, Z.",of  available,16,30,Yes: 0 student,In Person,,,,,,,,,,,,,,,,,,,,,,,,,,,,,,,,,,,,,,,,,,,,,,Creative and Cultural Representations (1),,,Breadth Requirement:,,
SLA,Literature and History in Russia,JSH300H1-S,"History and Literature were always interconnected in Russia. Writers not only sought to reflect the society around them, but were themselves often social critics and political figures. The course examines key texts in Russian literary tradition both as works of art and as primary sources for the historian. All readings in English.",HIS250H1/HIS250Y1 or SLA240H1/SLA241H1,Recommended Preparation:,Humanities,Distribution Requirement:,Creative and Cultural Representations (1),Breadth Requirement:,Room,LEC0101,Monday,—,16:00,18:00,,,,,AH 302,https://map.utoronto.ca/?id=1809#!m/494578,,,,of  available,11,30,Yes: 0 student,In Person,,,,,,,,,,,,,,,,,,,,,,,,,,,,,,,,,,,,,,,,,,,,,,,,,,—,
SLA,Russian Literature in the Age of Empire,SLA300H1-F,"Survey of major movements and institutions, familiar and less studied writers and intellectuals of the first half of the nineteenth century. Imperial culture between and within Europe and Asia. Romanticism as literary movement, cultural ideology, and lifestyle. Emergence of literature as profession and public sphere. Literature and nationalism. Taught in English, all readings in English.",Humanities,Distribution Requirement:,Creative and Cultural Representations (1),Breadth Requirement:,,,Room,LEC0101,Thursday,—,14:00,16:00,,,,,TF 103,https://map.utoronto.ca/?id=1809#!m/494581,,,"Koznarsky, T.",of  available,3,20,Yes: 0 student,In Person,,,,,,,,,,,,,,,,,,,,,,,,,,,,,,,,,,,,,,,,,,,,,,,,,,,
COMPG,Independent Study,MGT303Y1-Y,Open when a faculty member is willing and able to supervise. Students must obtain the approval of the Director of Rotman Commerce and the supervising faculty member before enrolling. Enrolment is restricted to students not in a Rotman Commerce program. Consult the Rotman Commerce Office for details. Not eligible for CR/NCR option.,"9.0 credits, Cumulative GPA of at least 2.70",Prerequisite:,,,,,,LEC0101,3.0 hours / week,,,,,,,,,,,,"Lee, S.",of  available,0,1,No,Asynchronous,—,Enrol at Department (E),Enrolment Controls:,Enrolment via ACORN is not available. Students must request permission to enrol in this course by contacting the sponsoring department. Please see Timetable Instructions tab for contact information.,,,,,,,,,,,,,,,,,,,,,,,,,,,,—,,,,,,,,,,,,,,,,,,,
COMPG,Independent Study,RSM303Y1-Y,Open when a faculty member is willing and able to supervise. Students must obtain the approval of the Director of Rotman Commerce and the supervising faculty member before enrolling. Enrolment is restricted to Rotman Commerce students. Consult the Rotman Commerce Office for details. Not eligible for CR/NCR option.,"9.0 credits, Cumulative GPA of at least 2.70",Prerequisite:,,,,,,LEC0101,3.0 hours / week,,,,,,,,,,,,,of  available,1,1,No,Asynchronous,—,Enrol at Department (E),Enrolment Controls:,Enrolment via ACORN is not available. Students must request permission to enrol in this course by contacting the sponsoring department. Please see Timetable Instructions tab for contact information.,,,,,,,,,,,,,,,,,,,,,,,,,,,,—,,,,,,,,,,,,,,,,,,—,
SLA,Conversations-Inspirations: Everyday Polish,SLA306H1-F,"Through a series of thematic modules based on everyday communicative situations in contemporary Poland students develop Polish language skills in the four linguistic competencies: listening, reading, writing, and speaking. The course is based on a communicative-functional approach to language. It means that even though students are regularly exposed to new grammatical structures, their work focuses primarily on practical, diverse uses of language in real-life situations.",SLA206Y1 or SLA207H1 or permission of instructor,Prerequisite:,Humanities,Distribution Requirement:,Creative and Cultural Representations (1),Breadth Requirement:,Room,LEC0101,Tuesday,—,15:00,17:00,,,,,CR 107,https://map.utoronto.ca/?id=1809#!m/494580,,,"Jezyk, A.",of  available,22,25,Yes: 0 student,In Person (See Delivery Instructions.),,,,,,,,,,,,,,,,,,,,,,,,,,,,,,,,,,,,,,,,,,,,,,,,,,,
SLA,Advanced Ukrainian,SLA308Y1-Y,"Development of advanced speaking, reading, listening and writing skills on a wide variety of topics. Work on grammar and vocabulary building. Review of morphology and study of syntax. Short compositions. Expressing a written formal argument or opinion.",SLA208Y1 or permission of instructor,Prerequisite:,Fluent native speakers of Ukrainian,Exclusion:,Humanities,Distribution Requirement:,,LEC0101,,,,,,,,,,,,,,,,,,,,,,,,,,,,,,,,,,,,,,,,,,,,,,,,,,,,,,,,,,,,,,,,Creative and Cultural Representations (1),,,Breadth Requirement:,—,
SLA,Russian Literature Between Tradition and Modernity,SLA310H1-S,"Survey of major movements and institutions, genres, familiar and less studied writers and intellectuals of the second half of the nineteenth century. Imperial culture in the reform era. Realism as literary movement, professionalization of literature and criticism, the novel and serialization, the short story and drama. Taught in English, all readings in English.",Humanities,Distribution Requirement:,Creative and Cultural Representations (1),Breadth Requirement:,,,Room,LEC0101,Tuesday,—,13:00,15:00,,,,,TF 202,https://map.utoronto.ca/?id=1809#!m/494581,,,"Holland, K.",of  available,31,40,Yes: 0 student,In Person,,,,,,,,,,,,,,,,,,,,,,,,,,,,,,,,,,,,,,,,,,,,,,,,,,,
COMPG,Special Topics in Management,RSM311H1-F,"""",Topics and Issues in Management. Content in any given year will depend on the instructor. See the Rotman Commerce website () for a full course description.,Prerequisite:,Completion of 9.0 credits. Further prerequisites may vary from year to year. Consult the course description on the Rotman Commerce website for details.,Distribution Requirement:,Social Science,"""",Room,LEC0101,Monday,—,16:00,18:00,,,,,RT 142,https://map.utoronto.ca/?id=1809#!m/494538,,,"Soberman, D.",of  available,36,50,Yes: 0 student,In Person,,Restricted (R1),Enrolment Controls:,This section is restricted at all times to the following students:,Year 3   Rotman Commerce   (Faculty of Arts and Science),Year 4   Rotman Commerce   (Faculty of Arts and Science),Subtitle,,,,,,,,,,,,,,,,,,,,,,,,,,,,,,,,,,,,,,,,,,,,
COMPG,Special Topics in Management,RSM312H1-S,"""",Topics and Issues in Management. Content in any given year will depend on the instructor. See the Rotman Commerce website () for a full course description.,Prerequisite:,Completion of 9.0 credits. Further prerequisites may vary from year to year. Consult the course description on the Rotman Commerce website for details.,Distribution Requirement:,Social Science,"""",Room,LEC5101,Monday,—,18:00,20:00,,,,,,,,,,of  available,12,50,Yes: 0 student,In Person,Contact DEPT,Restricted (R1),Enrolment Controls:,This section is restricted at all times to the following students:,Year 3   Rotman Commerce   (Faculty of Arts and Science),Year 4   Rotman Commerce   (Faculty of Arts and Science),Subtitle,,,,,,,,,,,,,,,,,,,,,,,,,,,,,,,,,,,,,,,,,,,—,
SLA,Dostoevsky,SLA314H1-F,"Crime and Punishment, The Brothers Karamazov, and short works. Dostoevsky's political, psychological, and religious ideas as they shape and are shaped by his literary art. Readings in English. Taught in English, all readings in English.",Humanities,Distribution Requirement:,Creative and Cultural Representations (1),Breadth Requirement:,,,Room,LEC0101,Tuesday,—,13:00,15:00,,,,,CR 403,https://map.utoronto.ca/?id=1809#!m/494580,,,"Holland, K.",of  available,16,50,Yes: 0 student,In Person,,,,,,,,,,,,,,,,,,,,,,,,,,,,,,,,,,,,,,,,,,,,,,,,,,,
COMPG,Special Topics in Management,RSM315H1-F,"""",Topics and Issues in Management. Content in any given year will depend on the instructor. See the Rotman Commerce website () for a full course description.,Prerequisite:,Completion of 9.0 credits. Further prerequisites may vary from year to year. Consult the course description on the Rotman Commerce website for details.,Distribution Requirement:,Social Science,"""",Room,LEC0101,Monday,—,09:00,11:00,,,,,RT 142,https://map.utoronto.ca/?id=1809#!m/494538,,,"Edwards, A.",of  available,35,50,Yes: 0 student,In Person,,Restricted (R1),Enrolment Controls:,This section is restricted at all times to the following students:,Year 3   Rotman Commerce   (Faculty of Arts and Science),Year 4   Rotman Commerce   (Faculty of Arts and Science),Subtitle,,,,,,,,,,,,,,,,,,,,,,,,,,,,,,,,,,,,,,,,,,,,
COMPG,Special Topics in Management,RSM317H1-S,"""",Topics and Issues in Management. Content in any given year will depend on the instructor. See the Rotman Commerce website () for a full course description.,Prerequisite:,Completion of 9.0 credits. Further prerequisites may vary from year to year. Consult the course description on the Rotman Commerce website for details.,Distribution Requirement:,Social Science,"""",Room,LEC0101,Tuesday,—,13:00,15:00,,,,,WO 35,https://map.utoronto.ca/?id=1809#!m/494558,,,,of  available,46,50,Yes: 0 student,In Person,,Restricted (R1),Enrolment Controls:,This section is restricted at all times to the following students:,Year 3   Rotman Commerce   (Faculty of Arts and Science),Year 4   Rotman Commerce   (Faculty of Arts and Science),Subtitle,,,,,,,,,,,,,,,,,,,,,,,,,,,,,,,,,,,,,,,,,,,—,
SLA,City of Saints and Sinners: Kyiv through the Centuries,SLA318H1-S,"Captivating and elusive: the ""new Jerusalem,"" Yehupets, a ""Slavic Pompeii"" and frontier city. This course examines Kyiv through works of literature, visual arts, architecture, and popular culture that reveal Ukrainian, Russian, Jewish, and Polish versions of the city. Gogol, Sholem Aleichem, Bulgakov, Vynnychenko, and many others. Taught in English, all readings in English.",Humanities,Distribution Requirement:,Creative and Cultural Representations (1),Breadth Requirement:,,,Room,LEC0101,Tuesday,—,14:00,16:00,,,,,VC 101,https://map.utoronto.ca/?id=1809#!m/494602,,,"Koznarsky, T.",of  available,29,36,Yes: 0 student,In Person,,,,,,,,,,,,,,,,,,,,,,,,,,,,,,,,,,,,,,,,,,,,,,,,,,,
