PSY,Behavioural Neuroscience,PSY290H1-S,,,,Course Description:,"Provides students with a solid background in the biological basis of behaviour. Animal and human research topics will include functional neuroanatomy and neural signalling. Further topics may include sensory and motor control, motivational systems, hormones, and emotions, among other topics.",PSY100H1/PSY100Y5/PSYA01H3,Prerequisite:,HMB200H1/PSL300H1/PSY290H5/PSYB64H3,Exclusion:,Science,Distribution Requirement:,Living Things and Their Environment (4),Breadth Requirement:,Room,LEC0101,Tuesday,,"Kim, J.",of  available,0,188,Yes: 28 students,In Person,Priority (P),Enrolment Controls:,"Priority enrolment is given to the groups of students listed below until July 28. There is no course enrolment on July 29. Beginning July 30, all other Arts & Science students can enrol in this section. UTM/UTSC students can enrol in this section starting August 6. The following groups of students are given priority access until July 28:",ASMAJ1160 MA PSYCHOLOGY,ASMAJ1445 MA COGNITIVE SCIENCE(ARTS),ASMAJ1445A MA COG SCI: ARTS - PERC&ATTEN,ASMAJ1445B MA COG SCI: ARTS - LANG & COG,ASMAJ1445C MA COG SCI: ARTS - THINK&REAS,,,,,,SS 2135,—,13:00,16:00,https://map.utoronto.ca/?id=1809#!m/494510
PSY,Research Opportunity Program,PSY299Y1-Y,,,,Course Description:,Credit course for supervised participation in faculty research project. Details at . Not eligible for CR/NCR option.,Science,Distribution Requirement:,,,,https://www.artsci.utoronto.ca/current/academics/research-opportunities/research-opportunities-program,,,Activity,LEC0101,—,—,"Chasteen, A.",of  available,9997,9999,No,In Person,,,,,,,,,,,,Instructor(s),—,,—,,,
RLG,The History of Buddhist Meditation,JNR301H1-S,,,,Course Description:,"This course will survey historical, cultural, and textual contexts for Buddhist meditative and contemplative practices and techniques.",RLG206H1/NEW232Y1/BPM232H1,Prerequisite:,Humanities,Distribution Requirement:,"Thought, Belief and Behaviour (2)",Breadth Requirement:,,,Room,LEC9901,6.0 hours / week,—,,of  available,27,60,Yes: 0 student,Asynchronous,,,,,,,,,,,,,—,,,,,
POL,Colonial Legacies and Post-Independence African Politics,POL301H1-F,Timetable instructions,Note:,Delivery Method:  IN PERSON,Course Description:,"This course highlights the critical roles of pre-colonial and colonial histories in shaping contemporary political and economic developments in Africa. It covers the emergence of colonial states, the central legacies of colonial rule, and the impact of colonialism in shaping process of state and nation building from independence to the present.",1.0 POL credit,Prerequisite:,POL301Y1,Exclusion:,Social Science,Distribution Requirement:,Society and its Institutions (3),Breadth Requirement:,Room,LEC0101,Wednesday,,"Prichard, W.",of  available,9,70,Yes: 0 student,In Person (See Delivery Instructions.),Priority (P),Enrolment Controls:,"Priority enrolment is given to the groups of students listed below until July 28. There is no course enrolment on July 29. Beginning July 30, all other Arts & Science students can enrol in this section. UTM/UTSC students can enrol in this section starting August 6. The following groups of students are given priority access until July 28:",POLITICAL SCIENCE     (Faculty of Arts and Science),"POLITICAL SCIENCE     (John H. Daniels Faculty of Architecture, Landscape, & Design)","ASSPE1228 SP PEACE, CONFLICT & JUSTICE",,,Lectures will be delivered in person.,Delivery instructions,Note:,,,BL 313,—,14:00,16:00,https://map.utoronto.ca/?id=1809#!m/494536
POL,Women in Western Political Thought,POL303H1-S,Timetable instructions,Note:,Delivery Method:  IN PERSON,Course Description:,Examines contemporary feminist perspectives in political theory as responses to the limitations of western tradition of modern political theory.,PHL265H1/POL200Y1/POL200Y5/POLC70H3/POLC71H3,Prerequisite:,POLC76H3/POLC77H3,Exclusion:,"Humanities, Social Science",Distribution Requirement:,"Thought, Belief and Behaviour (2)",Breadth Requirement:,Room,LEC0101,Wednesday,,"Kingston, R.",of  available,0,70,Yes: 45 students,In Person (See Delivery Instructions.),Priority (P),Enrolment Controls:,"Priority enrolment is given to the groups of students listed below until July 28. There is no course enrolment on July 29. Beginning July 30, all other Arts & Science students can enrol in this section. UTM/UTSC students can enrol in this section starting August 6. The following groups of students are given priority access until July 28:",POLITICAL SCIENCE     (Faculty of Arts and Science),,,,,Lectures will be delivered in person.,Delivery instructions,Note:,,,BL 325,—,14:00,16:00,https://map.utoronto.ca/?id=1809#!m/494536
RLG,Evil and Suffering,RLG303H1-F,,,,Course Description:,The existence of evil poses a problem to theistic beliefs and raises the question as to whether a belief in a deity is incompatible with the existence of evil and human (or other) suffering. This course examines the variety of ways in which religions have dealt with the existence of evil.,Completion of 4.0 credits,Prerequisite:,Social Science,Distribution Requirement:,"Thought, Belief and Behaviour (2)",Breadth Requirement:,,,Room,LEC0101,Friday,,"Goldberg, S.",of  available,0,70,Yes: 0 student,In Person,,,,,,,,,,,,,,SS 1070,—,11:00,13:00,https://map.utoronto.ca/?id=1809#!m/494510
POL,Topics in Methods,POL304H1-F,Timetable instructions,Note:,Delivery Method:  IN PERSON,Course Description:,"Various topics are taken up each year, the content of which depends on the instructor.",POL232H1 or equivalent,Prerequisite:,Social Science,Distribution Requirement:,Society and its Institutions (3),Breadth Requirement:,,,Room,LEC5101,Monday,,"Chyzh, O.",of  available,16,49,Yes: 0 student,In Person (See Delivery Instructions.),Priority (P),Enrolment Controls:,"Priority enrolment is given to the groups of students listed below until July 28. There is no course enrolment on July 29. Beginning July 30, all other Arts & Science students can enrol in this section. UTM/UTSC students can enrol in this section starting August 6. The following groups of students are given priority access until July 28:",POLITICAL SCIENCE     (Faculty of Arts and Science),,,,,Lectures will be delivered in person.,Delivery instructions,Note:,Subtitle,,SS 561,—,18:00,20:00,https://map.utoronto.ca/?id=1809#!m/494510
RLG,"Language, Symbols, Self",RLG304H1-S,,,,Course Description:,"Theories of the self that involve the constitutive role of language in its various forms. Problems of socially-conditioned worldviews and sense of self as related to discourse. Myth, symbol, metaphor, and literary arts as vehicles for personality development and self-transformation along religious lines.",Completion of 4.0 credits,Prerequisite:,Social Science,Distribution Requirement:,"Thought, Belief and Behaviour (2)",Breadth Requirement:,,,Room,LEC0101,Tuesday,,"Mills, E.",of  available,13,40,Yes: 0 student,In Person,,,,,,,,,,,,,,OI 8170,—,16:00,18:00,https://map.utoronto.ca/?id=1809#!m/494563
POL,Introduction to Latin American Politics and Societies,POL305H1-F,Timetable instructions,Note:,Delivery Method:  IN PERSON,Course Description:,"This course introduces students to histories and concepts necessary to understand developments in Latin American politics. Substantive issues will include the changing face of state sovereignty; human rights and social movements; the legacies of (neo)colonialism and indigenous resistance; neoliberalism, 21st century socialism, and beyond.",1.0 POL credit,Prerequisite:,POL305Y1/POL360H5/POLC91H3/POLC99H3,Exclusion:,Social Science,Distribution Requirement:,Society and its Institutions (3),Breadth Requirement:,Room,LEC0101,Monday,,"Kingsbury, D.",of  available,1,70,Yes: 0 student,In Person (See Delivery Instructions.),Priority (P),Enrolment Controls:,"Priority enrolment is given to the groups of students listed below until July 28. There is no course enrolment on July 29. Beginning July 30, all other Arts & Science students can enrol in this section. UTM/UTSC students can enrol in this section starting August 6. The following groups of students are given priority access until July 28:",POLITICAL SCIENCE     (Faculty of Arts and Science),"POLITICAL SCIENCE     (John H. Daniels Faculty of Architecture, Landscape, & Design)","ASSPE1228 SP PEACE, CONFLICT & JUSTICE",,,Lectures will be delivered in person.,Delivery instructions,Note:,,,BL 325,—,16:00,18:00,https://map.utoronto.ca/?id=1809#!m/494536
PSY,The Treatment of Psychological Data,PSY305H1-S,,,,Course Description:,"This course provides a practical yet intensive introduction to the research pipeline, with a focus on research data management and advanced statistical analysis and inference. Students learn how to find, organize, and analyze data sets in a transparent and reproducible way. Students also learn more about statistical inference, focusing on how the design and analysis of data shape the interpretation of results.",PSY202H1/ECO220Y1/SOC252H1/STA221H1/PSY202H5/STA221H5/PSYC08H3/STAB27H3/STAC32H3,Prerequisite:,EEB313H1,Exclusion:,Science,Distribution Requirement:,The Physical and Mathematical Universes (5),Breadth Requirement:,Room,LEC0101,Wednesday,,,of  available,1,40,Yes: 0 student,In Person,Priority (P),Enrolment Controls:,"Priority enrolment is given to the groups of students listed below until July 28. There is no course enrolment on July 29. Beginning July 30, all other Arts & Science students can enrol in this section. UTM/UTSC students can enrol in this section starting August 6. The following groups of students are given priority access until July 28:",ASMAJ1160 MA PSYCHOLOGY,ASMAJ1446 MA COGNITIVE SCIENCE(SCIENCE),ASMAJ1446A MA COG SCI: SCI - COMPUT COG,ASMAJ1446B MA COG SCI: SCI - COGN & BRAIN,ASSPE1160 SP PSYCHOLOGY,,,,,—,SS 561,—,13:00,16:00,https://map.utoronto.ca/?id=1809#!m/494510
POL,Japanese Politics,POL307H1-S,Timetable instructions,Note:,Delivery Method:  IN PERSON,Course Description:,"The politics, political economy, and international relations of Japan. The role of political parties, the bureaucracy, and private actors; economic development and stagnation; relations with the USA and regional neighbors. Contemporary challenges facing Japan, including energy policy and climate change, contributions to the liberal order, and response to geopolitical challenges.",1.0 POL 200-level credit,Prerequisite:,POL380H1 (Topics in International Politics: Japanese Politics); offered in Winter 2020 and Winter 2021,Exclusion:,Social Science,Distribution Requirement:,Society and its Institutions (3),Breadth Requirement:,Room,LEC0101,Wednesday,,"Lipscy, P.",of  available,0,70,Yes: 2 students,In Person (See Delivery Instructions.),Priority (P),Enrolment Controls:,"Priority enrolment is given to the groups of students listed below until July 28. There is no course enrolment on July 29. Beginning July 30, all other Arts & Science students can enrol in this section. UTM/UTSC students can enrol in this section starting August 6. The following groups of students are given priority access until July 28:",POLITICAL SCIENCE     (Faculty of Arts and Science),"POLITICAL SCIENCE     (John H. Daniels Faculty of Architecture, Landscape, & Design)",ASMAJ1469 MA INTERNATIONAL RELATIONS,"ASSPE1228 SP PEACE, CONFLICT & JUSTICE",ASSPE1469 SP INTERNATIONAL RELATIONS,Lectures will be delivered in person.,Delivery instructions,Note:,,,BL 325,—,10:00,12:00,https://map.utoronto.ca/?id=1809#!m/494536
RLG,Museums and Material Religion,RLG307H1-S,,,,Course Description:,"Museums have long collected and curated religious objects for public audiences, with missionaries as a primary collections source. Multiple visits to the Royal Ontario Museum and other museums will enable students to think critically about how museums received and presented these objects, while engaging with the challenges of museum curation.",Completion of 4.0 credits,Prerequisite:,Humanities,Distribution Requirement:,Creative and Cultural Representations (1),Breadth Requirement:,,,Room,LEC0101,Wednesday,,"Vearncombe, E.",of  available,13,50,Yes: 0 student,In Person,,,,,,,,,,,,,,SS 2105,—,12:00,14:00,https://map.utoronto.ca/?id=1809#!m/494510
RLG,"Migration, Religion and City Spaces",RLG308H1-F,,,,Course Description:,"Immigrants have transformed cities through religious practices. Explore how transnational migration has affected religious diversity and vitality in metropolitan areas. Through discussion, site visits and analysis, students will examine the ways that immigrants use religion to make home, challenges around the establishment of new religious structures, and policy designed to accommodate new religious practices and communities.",4.0 FCE,Prerequisite:,Humanities,Distribution Requirement:,Society and its Institutions (3),Breadth Requirement:,,,Room,LEC0101,Thursday,,"Bugg, L.",of  available,21,60,Yes: 0 student,In Person,,,,,,,,,,,,,,SS 1072,—,10:00,12:00,https://map.utoronto.ca/?id=1809#!m/494510
POL,Contemporary Africa Politics: Dynamics and Challenges,POL309H1-S,Timetable instructions,Note:,Delivery Method:  IN PERSON,Course Description:,"This course explores main drivers of political organization and change in contemporary Africa, focusing on how national, regional, and international factors shape institutions, patterns of participation and political change. It considers major scholarly debates in the study of African politics and political economy and develops analytical skills for comparative study of this diverse continent.",1.0 POL credit,Prerequisite:,POL301Y1,Exclusion:,Social Science,Distribution Requirement:,Society and its Institutions (3),Breadth Requirement:,Room,LEC0101,Thursday,,"Gnamo, A.",of  available,28,70,Yes: 0 student,In Person (See Delivery Instructions.),Priority (P),Enrolment Controls:,"Priority enrolment is given to the groups of students listed below until July 28. There is no course enrolment on July 29. Beginning July 30, all other Arts & Science students can enrol in this section. UTM/UTSC students can enrol in this section starting August 6. The following groups of students are given priority access until July 28:",POLITICAL SCIENCE     (Faculty of Arts and Science),"POLITICAL SCIENCE     (John H. Daniels Faculty of Architecture, Landscape, & Design)","ASSPE1228 SP PEACE, CONFLICT & JUSTICE",,,Lectures will be delivered in person.,Delivery instructions,Note:,,,BL 313,—,14:00,16:00,https://map.utoronto.ca/?id=1809#!m/494536
PSY,Research Specialization: Practicum,PSY309H1-S,,,,Course Description:,"Research Specialists learn about the research opportunities within our department, and develop skills in the areas of critical thinking, writing, and oral presentation. Students also conduct a pre-thesis research project under the supervision of a faculty member. Students should complete a PSY lab course (PSY3*9H1) prior to taking this course; however, taking the lab course concurrently will be considered in consultation with the instructor. Enrolment is restricted to PSY Research Specialists.",PSY202H1/ECO220Y1/SOC252H1/STA221H1/PSY202H5/STA221H5/PSYC08H3/STAB27H3/STAC32H3,Prerequisite:,PSY319H1/PSY329H1/PSY339H1/PSY349H1/PSY359H1/PSY369H1/PSY379H1/PSY389H1,Corequisite:,PSY309H5,Exclusion:,Science,Distribution Requirement:,Room,LEC0101,Monday,,"Rule, N.",of  available,11,20,No,In Person,Restricted (R1),Enrolment Controls:,This section is restricted at all times to the following students:,ASSPE1958 SP PSYCHOLOGY RESEARCH(THESIS),,,,,,,,,,SS 560,—,11:00,14:00,https://map.utoronto.ca/?id=1809#!m/494510
RLG,Religion and Human Rights,RLG309H1-S,,,,Course Description:,"The relationship and interaction between religious and ethical norms, social and political ideals, and systems of law. The course concerns the ongoing dialectic between religious and other values, the application of religious ideas to social orders, and questions of religious and human rights.",Completion of 4.0 credits,Prerequisite:,"RLG309H5, RLG309Y1",Exclusion:,Humanities,Distribution Requirement:,"Thought, Belief and Behaviour (2)",Breadth Requirement:,Room,LEC0101,Monday,,"Pontoriero, E.",of  available,0,85,Yes: 0 student,In Person,,,,,,,,,,,,,,SS 1085,—,13:00,15:00,https://map.utoronto.ca/?id=1809#!m/494510
PSY,Social Development,PSY311H1-F,,,,Course Description:,"Theory and research in social attachment, aggression, morality, imitation and identification, altruism, and parental discipline, with discussion of methodological issues.","PSY201H1/ECO220Y1/EEB225H1/GGR270H1/POL222H1/SOC202H1/STA220H1/STA238H1/STA248H1/STA288H1/PSY201H5/STA215H5/STA220H5/PSYB07H3/STAB22H3/STAB23H3/STAB57H3, and PSY210H1/PSY210H5/PSYB20H3",Prerequisite:,PSY311H5/PSYC21H3/PSYC27H3/PSYD22H3,Exclusion:,Science,Distribution Requirement:,"Thought, Belief and Behaviour (2)",Breadth Requirement:,Room,LEC0101,Monday,,"Sommerville, J.",of  available,1,50,Yes: 0 student,In Person,Priority (P),Enrolment Controls:,"Priority enrolment is given to the groups of students listed below until July 28. There is no course enrolment on July 29. Beginning July 30, all other Arts & Science students can enrol in this section. UTM/UTSC students can enrol in this section starting August 6. The following groups of students are given priority access until July 28:",ASMAJ1160 MA PSYCHOLOGY,ASMIN1160 MI PSYCHOLOGY,ASSPE1160 SP PSYCHOLOGY,ASSPE1958 SP PSYCHOLOGY RESEARCH(THESIS),,,,,,,SS 2125,—,14:00,17:00,https://map.utoronto.ca/?id=1809#!m/494510
PSY,Social Development,PSY311H1-S,,,,Course Description:,"Theory and research in social attachment, aggression, morality, imitation and identification, altruism, and parental discipline, with discussion of methodological issues.","PSY201H1/ECO220Y1/EEB225H1/GGR270H1/POL222H1/SOC202H1/STA220H1/STA238H1/STA248H1/STA288H1/PSY201H5/STA215H5/STA220H5/PSYB07H3/STAB22H3/STAB23H3/STAB57H3, and PSY210H1/PSY210H5/PSYB20H3",Prerequisite:,PSY311H5/PSYC21H3/PSYC27H3/PSYD22H3,Exclusion:,Science,Distribution Requirement:,"Thought, Belief and Behaviour (2)",Breadth Requirement:,Room,LEC0101,Thursday,,"Babineau, M.",of  available,0,50,Yes: 20 students,In Person,Priority (P),Enrolment Controls:,"Priority enrolment is given to the groups of students listed below until July 28. There is no course enrolment on July 29. Beginning July 30, all other Arts & Science students can enrol in this section. UTM/UTSC students can enrol in this section starting August 6. The following groups of students are given priority access until July 28:",ASMAJ1160 MA PSYCHOLOGY,ASMIN1160 MI PSYCHOLOGY,ASSPE1160 SP PSYCHOLOGY,ASSPE1958 SP PSYCHOLOGY RESEARCH(THESIS),,,,,,,UC 52,—,14:00,17:00,https://map.utoronto.ca/?id=1809#!m/494517
POL,Canadian Foreign Policy Performance,POL312H1-F,Timetable instructions,Note:,Delivery Method:  IN PERSON,Course Description:,"The literature, competing theories, basic interests and values, and instruments of Canadian foreign policy, as they have developed and performed under successive Liberal, Progressive Conservative and Conservative party governments since 1945 and especially from 2015 to 2021.",POL208H1/POL208Y1/POL209H5/POLB80H3,Prerequisite:,POL312Y1,Exclusion:,Courses in International Relations and/or Canadian government would be useful.,Recommended Preparation:,Social Science,Distribution Requirement:,Room,LEC0101,Tuesday,,"Kirton, J.",of  available,3,70,Yes: 0 student,In Person (See Delivery Instructions.),Priority (P),Enrolment Controls:,"Priority enrolment is given to the groups of students listed below until July 28. There is no course enrolment on July 29. Beginning July 30, all other Arts & Science students can enrol in this section. UTM/UTSC students can enrol in this section starting August 6. The following groups of students are given priority access until July 28:",POLITICAL SCIENCE     (Faculty of Arts and Science),"POLITICAL SCIENCE     (John H. Daniels Faculty of Architecture, Landscape, & Design)",ASMAJ1469 MA INTERNATIONAL RELATIONS,"ASSPE1228 SP PEACE, CONFLICT & JUSTICE",ASSPE1469 SP INTERNATIONAL RELATIONS,Lectures will be delivered in person.,Delivery instructions,Note:,,,SS 2127,—,12:00,14:00,https://map.utoronto.ca/?id=1809#!m/494510
PSY,Cognitive Development,PSY312H1-F,,,,Course Description:,"Examines the developmental of knowledge in fundamental domains such as spatial perception, navigation, object perception, number, language, and theory of mind. Emphasis is on current experimental findings and how they address centuries-old debates surrounding the origin and nature of human knowledge.","PSY201H1/ECO220Y1/EEB225H1/GGR270H1/POL222H1/SOC202H1/STA220H1/STA238H1/STA248H1/STA288H1/PSY201H5/STA215H5/STA220H5/PSYB07H3/STAB22H3/STAB23H3/STAB57H3, and PSY210H1/PSY210H5/PSYB20H3, and PSY270H1/PSY270H5/PSYB57H3/COG250Y1",Prerequisite:,PSY312H5,Exclusion:,Science,Distribution Requirement:,"Thought, Belief and Behaviour (2)",Breadth Requirement:,Room,LEC0101,Tuesday,,"Vervaeke, J.",of  available,5,50,Yes: 0 student,In Person,Priority (P),Enrolment Controls:,"Priority enrolment is given to the groups of students listed below until July 28. There is no course enrolment on July 29. Beginning July 30, all other Arts & Science students can enrol in this section. UTM/UTSC students can enrol in this section starting August 6. The following groups of students are given priority access until July 28:",ASMAJ1160 MA PSYCHOLOGY,ASMAJ1445 MA COGNITIVE SCIENCE(ARTS),ASMAJ1445A MA COG SCI: ARTS - PERC&ATTEN,ASMAJ1445B MA COG SCI: ARTS - LANG & COG,ASMAJ1445C MA COG SCI: ARTS - THINK&REAS,,,,,,UC 244,—,13:00,16:00,https://map.utoronto.ca/?id=1809#!m/494517
PSY,Cognitive Development,PSY312H1-S,,,,Course Description:,"Examines the developmental of knowledge in fundamental domains such as spatial perception, navigation, object perception, number, language, and theory of mind. Emphasis is on current experimental findings and how they address centuries-old debates surrounding the origin and nature of human knowledge.","PSY201H1/ECO220Y1/EEB225H1/GGR270H1/POL222H1/SOC202H1/STA220H1/STA238H1/STA248H1/STA288H1/PSY201H5/STA215H5/STA220H5/PSYB07H3/STAB22H3/STAB23H3/STAB57H3, and PSY210H1/PSY210H5/PSYB20H3, and PSY270H1/PSY270H5/PSYB57H3/COG250Y1",Prerequisite:,PSY312H5,Exclusion:,Science,Distribution Requirement:,"Thought, Belief and Behaviour (2)",Breadth Requirement:,Room,LEC0101,Tuesday,,"Sommerville, J.",of  available,0,50,Yes: 15 students,In Person,Priority (P),Enrolment Controls:,"Priority enrolment is given to the groups of students listed below until July 28. There is no course enrolment on July 29. Beginning July 30, all other Arts & Science students can enrol in this section. UTM/UTSC students can enrol in this section starting August 6. The following groups of students are given priority access until July 28:",ASMAJ1160 MA PSYCHOLOGY,ASMAJ1445 MA COGNITIVE SCIENCE(ARTS),ASMAJ1445A MA COG SCI: ARTS - PERC&ATTEN,ASMAJ1445B MA COG SCI: ARTS - LANG & COG,ASMAJ1445C MA COG SCI: ARTS - THINK&REAS,,,,,,SS 1070,—,14:00,17:00,https://map.utoronto.ca/?id=1809#!m/494510
POL,Canadian Foreign Policy Process,POL313H1-S,Timetable instructions,Note:,Delivery Method:  IN PERSON,Course Description:,"The external, societal, governmental and individual influences determining Canadian foreign policy making toward all global regions in the developed, emerging and developing world and central security, ecological, health, societal and economic issues, including the use of force, climate change, infectious disease, gender equality, relations with Indigenous peoples and trade.",POL208H1/POL208Y1/POL209H5/POLB80H3,Prerequisite:,POL312Y1,Exclusion:,Courses in International Relations and/or Canadian government would be useful.,Recommended Preparation:,Social Science,Distribution Requirement:,Room,LEC0101,Tuesday,,"Kirton, J.",of  available,0,70,Yes: 19 students,In Person (See Delivery Instructions.),Priority (P),Enrolment Controls:,"Priority enrolment is given to the groups of students listed below until July 28. There is no course enrolment on July 29. Beginning July 30, all other Arts & Science students can enrol in this section. UTM/UTSC students can enrol in this section starting August 6. The following groups of students are given priority access until July 28:",POLITICAL SCIENCE     (Faculty of Arts and Science),"POLITICAL SCIENCE     (John H. Daniels Faculty of Architecture, Landscape, & Design)",ASMAJ1469 MA INTERNATIONAL RELATIONS,"ASSPE1228 SP PEACE, CONFLICT & JUSTICE",ASSPE1469 SP INTERNATIONAL RELATIONS,Lectures will be delivered in person.,Delivery instructions,Note:,,,BL 325,—,12:00,14:00,https://map.utoronto.ca/?id=1809#!m/494536
PSY,Psychology of Aging,PSY313H1-F,,,,Course Description:,"Age changes in sensory and perceptual processes, motor skill, learning, memory, and personality. Theory, methodological problems, social, cultural, and environmental influences that shape behaviour and attitudes towards and among the elderly.","PSY201H1/ECO220Y1/EEB225H1/GGR270H1/POL222H1/SOC202H1/STA220H1/STA238H1/STA248H1/STA288H1/PSY201H5/STA215H5/STA220H5/PSYB07H3/STAB22H3/STAB23H3/STAB57H3, and PSY210H1/PSY210H5/PSYB20H3",Prerequisite:,PSY313H5/PSYC21H3,Exclusion:,Science,Distribution Requirement:,"Thought, Belief and Behaviour (2)",Breadth Requirement:,Room,LEC5101,Wednesday,,"Burton, C.",of  available,2,50,Yes: 0 student,In Person,Priority (P),Enrolment Controls:,"Priority enrolment is given to the groups of students listed below until July 28. There is no course enrolment on July 29. Beginning July 30, all other Arts & Science students can enrol in this section. UTM/UTSC students can enrol in this section starting August 6. The following groups of students are given priority access until July 28:",ASMAJ1160 MA PSYCHOLOGY,ASMIN1160 MI PSYCHOLOGY,ASSPE1160 SP PSYCHOLOGY,ASSPE1958 SP PSYCHOLOGY RESEARCH(THESIS),,,,,,,RW 143,—,18:00,21:00,https://map.utoronto.ca/?id=1809#!m/494515
