COMPG,Capital Market Theory,RSM332H1-S,"An introduction to capital market theory explaining how financial securities are priced. Topics covered include the time and risk value of money, the use of discounted cash flow techniques, efficient set theory, asset pricing and market efficiency. Not eligible for CR/NCR option. Contact Rotman Commerce for details.",RSM230H1,Prerequisite:,"ECO204Y1/ECO206Y1, ECO220Y1/ECO227Y1/(STA220H1, STA255H1)/(STA237H1, STA238H1)/(STA257H1, STA261H1)",Corequisite:,"ACT349H1, ECO358H1",Exclusion:,Room,LEC0101,Wednesday,—,14:00,16:00,Monday,—,14:00,16:00,UC 144,https://map.utoronto.ca/?id=1809#!m/494517,WI 1017,https://map.utoronto.ca/?id=1809#!m/494503,"Wang, K.",of  available,0,56,Yes: 25 students,In Person,,Restricted (R2),Enrolment Controls:,"This section is restricted to two groups of students. Group 1 is given priority access until July 28. There is no course enrolment on July 29. Beginning July 30, Group 2 can enrol in this section:",Group 1: Year 3   Rotman Commerce   (Faculty of Arts and Science),Group 1: Year 4   Rotman Commerce   (Faculty of Arts and Science),Activity,Time,Room,Instructor(s),Space Availability,Wait List,Status / Notes,LEC0201,"Wang, K.",of  available,0,50,Yes: 15 students,In Person,Restricted (R2),Enrolment Controls:,"This section is restricted to two groups of students. Group 1 is given priority access until July 28. There is no course enrolment on July 29. Beginning July 30, Group 2 can enrol in this section:",Activity,Time,Room,Instructor(s),Space Availability,Wait List,Status / Notes,LEC5101,Wednesday,—,18:00,20:00,"Wang, K.",of  available,0,56,Yes: 4 students,In Person,Restricted (R2),Enrolment Controls:,"This section is restricted to two groups of students. Group 1 is given priority access until July 28. There is no course enrolment on July 29. Beginning July 30, Group 2 can enrol in this section:",Group 1: ASSPE2038 SP FINANCE & ECONOMICS  - Year 2,Social Science,WO 20,https://map.utoronto.ca/?id=1809#!m/494558,Distribution Requirement:,,Group 2:    Rotman Commerce   (Faculty of Arts and Science)
COMPG,Introduction to Corporate Finance,RSM333H1-F,"Application and development of the ideas in RSM332H1 to corporate finance problems such as determining the weighted average cost of capital, project evaluation, corporate financing decisions, working capital management and initial public offerings. Not eligible for CR/NCR option. Contact Rotman Commerce for details.","RSM219H1, RSM332H1",Prerequisite:,"ACT349H1, ECO359H1",Exclusion:,Social Science,Distribution Requirement:,Room,LEC0101,Tuesday,—,14:00,16:00,Tuesday,—,16:00,18:00,WO 30,https://map.utoronto.ca/?id=1809#!m/494558,WO 30,https://map.utoronto.ca/?id=1809#!m/494558,"Boyko, D.",of  available,1,58,Yes: 0 student,In Person,,Restricted (R1),Enrolment Controls:,This section is restricted at all times to the following students:,Rotman Commerce   (Faculty of Arts and Science),Rotman Commerce   (Faculty of Arts and Science),Activity,Time,Room,Instructor(s),Space Availability,Wait List,Status / Notes,LEC0201,"Boyko, D.",of  available,0,58,Yes: 0 student,In Person,Restricted (R1),Enrolment Controls:,This section is restricted at all times to the following students:,Activity,Time,Room,Instructor(s),Space Availability,Wait List,Status / Notes,LEC0301,Monday,—,14:00,16:00,"Benzacar, K.",of  available,0,50,Yes: 0 student,In Person,Restricted (R1),Enrolment Controls:,This section is restricted at all times to the following students:,Rotman Commerce   (Faculty of Arts and Science),Society and its Institutions (3),WW 126,https://map.utoronto.ca/?id=1809#!m/494547,Breadth Requirement:,,Rotman Commerce   (Faculty of Arts and Science)
COMPG,Introduction to Corporate Finance,RSM333H1-S,"Application and development of the ideas in RSM332H1 to corporate finance problems such as determining the weighted average cost of capital, project evaluation, corporate financing decisions, working capital management and initial public offerings. Not eligible for CR/NCR option. Contact Rotman Commerce for details.","RSM219H1, RSM332H1",Prerequisite:,"ACT349H1, ECO359H1",Exclusion:,Social Science,Distribution Requirement:,Room,LEC0101,Tuesday,—,09:00,11:00,Tuesday,—,10:00,12:00,WO 20,https://map.utoronto.ca/?id=1809#!m/494558,UC 87,https://map.utoronto.ca/?id=1809#!m/494517,"Boyko, D.",of  available,0,56,Yes: 1 student,In Person,,Restricted (R1),Enrolment Controls:,This section is restricted at all times to the following students:,Rotman Commerce   (Faculty of Arts and Science),Rotman Commerce   (Faculty of Arts and Science),Activity,Time,Room,Instructor(s),Space Availability,Wait List,Status / Notes,LEC0201,"Yi, I.",of  available,0,50,Yes: 4 students,In Person,Restricted (R1),Enrolment Controls:,This section is restricted at all times to the following students:,Activity,Time,Room,Instructor(s),Space Availability,Wait List,Status / Notes,LEC0301,Tuesday,—,11:00,13:00,"Boyko, D.",of  available,0,56,Yes: 4 students,In Person,Restricted (R1),Enrolment Controls:,This section is restricted at all times to the following students:,Rotman Commerce   (Faculty of Arts and Science),Society and its Institutions (3),WO 20,https://map.utoronto.ca/?id=1809#!m/494558,Breadth Requirement:,—,Rotman Commerce   (Faculty of Arts and Science)
COMPG,Investments,RSM336H1-F,"This course provides an introduction to financial theories and analytical tools for making investment decisions and for understanding how prices are determined for stocks and bonds. The course covers a broad range of topics including asset allocation, technical analysis, fundamental analysis, anomalies, and bond portfolio management. Not eligible for CR/NCR option. Contact Rotman Commerce for details.","RSM230H1, RSM332H1",Prerequisite:,"ECO220Y1/ECO227Y1/(STA220H1, STA255H1)/(STA237H1, STA238H1)/(STA257H1, STA261H1)",Corequisite:,"ACT349H1, RSM330H1",Exclusion:,Room,LEC0101,Friday,—,10:00,12:00,Friday,—,13:00,15:00,WO 20,https://map.utoronto.ca/?id=1809#!m/494558,WO 35,https://map.utoronto.ca/?id=1809#!m/494558,"Han, B.",of  available,0,59,Yes: 0 student,In Person,,Restricted (R1),Enrolment Controls:,This section is restricted at all times to the following students:,Rotman Commerce   (Faculty of Arts and Science),Rotman Commerce   (Faculty of Arts and Science),Activity,Time,Room,Instructor(s),Space Availability,Wait List,Status / Notes,LEC0201,"Han, B.",of  available,2,56,Yes: 0 student,In Person,Restricted (R1),Enrolment Controls:,This section is restricted at all times to the following students:,Activity,Time,Room,Instructor(s),Space Availability,Wait List,Status / Notes,LEC0301,Friday,—,15:00,17:00,"Han, B.",of  available,1,56,Yes: 0 student,In Person,Restricted (R1),Enrolment Controls:,This section is restricted at all times to the following students:,Rotman Commerce   (Faculty of Arts and Science),Social Science,WO 35,https://map.utoronto.ca/?id=1809#!m/494558,Distribution Requirement:,,
COMPG,Investments,RSM336H1-S,"This course provides an introduction to financial theories and analytical tools for making investment decisions and for understanding how prices are determined for stocks and bonds. The course covers a broad range of topics including asset allocation, technical analysis, fundamental analysis, anomalies, and bond portfolio management. Not eligible for CR/NCR option. Contact Rotman Commerce for details.","RSM230H1, RSM332H1",Prerequisite:,"ECO220Y1/ECO227Y1/(STA220H1, STA255H1)/(STA237H1, STA238H1)/(STA257H1, STA261H1)",Corequisite:,"ACT349H1, RSM330H1",Exclusion:,Room,LEC0101,Monday,—,11:00,13:00,Monday,—,14:00,16:00,UC 144,https://map.utoronto.ca/?id=1809#!m/494517,UC 144,https://map.utoronto.ca/?id=1809#!m/494517,"Stapleton, M.",of  available,0,56,Yes: 2 students,In Person,,Restricted (R1),Enrolment Controls:,This section is restricted at all times to the following students:,Rotman Commerce   (Faculty of Arts and Science),Rotman Commerce   (Faculty of Arts and Science),Activity,Time,Room,Instructor(s),Space Availability,Wait List,Status / Notes,LEC0201,"Stapleton, M.",of  available,0,56,Yes: 2 students,In Person,Restricted (R1),Enrolment Controls:,This section is restricted at all times to the following students:,Activity,Time,Room,Instructor(s),Space Availability,Wait List,Status / Notes,LEC0301,Wednesday,—,10:00,12:00,"Stapleton, M.",of  available,0,53,Yes: 2 students,In Person,Restricted (R1),Enrolment Controls:,This section is restricted at all times to the following students:,Rotman Commerce   (Faculty of Arts and Science),Social Science,WO 35,https://map.utoronto.ca/?id=1809#!m/494558,Distribution Requirement:,,Rotman Commerce   (Faculty of Arts and Science)
SLA,Let's Talk! Advanced Polish,SLA336H1-S,"Students expand their practical knowledge of Polish by engaging with online media and current issues in culture and society. They enrich their vocabulary, grammatical structures, and use of diverse stylistic registers while fine-tuning reading, writing, listening, and speaking skills.",SLA306H1 or permission of instructor,Prerequisite:,Humanities,Distribution Requirement:,Creative and Cultural Representations (1),Breadth Requirement:,Room,LEC0101,Tuesday,—,15:00,17:00,Thursday,—,15:00,17:00,AH 103,https://map.utoronto.ca/?id=1809#!m/494578,AH 103,https://map.utoronto.ca/?id=1809#!m/494578,,of  available,16,18,Yes: 0 student,In Person,,,,,,,,,,,,,,,,,,,,,,,,,,,,,,,,,,,,,,,,,,,,,,,,,,—,
COMPG,Applications of Machine Learning in Finance,RSM338H1-F,"This course provides an overview of the basic tools in data analysis and machine learning, with emphasis on their applications in finance. Data analysis and machine learning play an important role in FinTech. Individual investors and financial institutions who are able to leverage these new tools and technology will have a significant advantage. This course discusses these new opportunities and challenges. It seeks to equip students with these highly coveted skills in the market.","ECO220Y1/ECO227Y1/(STA220H1, STA255H1)/(STA237H1, STA238H1)/(STA257H1, STA261H1);  CSC108H1/CSC148H1",Prerequisite:,RSM358H1; RSM316H1 (Special Topics in Management: Machine Learning); offered in Winter 2020/Fall 2020/Winter 2021,Exclusion:,Social Science,Distribution Requirement:,Room,LEC5101,Tuesday,—,18:00,20:00,,,,,WO 20,https://map.utoronto.ca/?id=1809#!m/494558,,,"Yuan, J.",of  available,16,56,Yes: 0 student,In Person,,Restricted (R1),Enrolment Controls:,This section is restricted at all times to the following students:,Rotman Commerce   (Faculty of Arts and Science),,,,,,,,,,,,,,,,,,,,,,,,,,,,,,,,,,,,,,,,,The Physical and Mathematical Universes (5),,,Breadth Requirement:,,
COMPG,The Opposable Mind: Approaches to Integrative Thinking,RSM340H1-S,"Beginning with an exploration of integrative thinking and the tools associated with it, this course asks students to apply integrative thinking to complex problems that span traditional disciplines. Throughout the course, students will learn practical tools aimed at helping integrate between models, build new models and create new value. Not eligible for CR/NCR option. Contact Rotman Commerce for details.",Completion of 9.0 credits.,Prerequisite:,"RSM310H1 (Special Topics in Management: The Opposable Mind: Approaches to Integrative Thinking), offered in Winter 2011/Winter 2012/Winter 2013",Exclusion:,Social Science,Distribution Requirement:,Room,LEC0101,Monday,—,14:00,16:00,,,,,UC 87,https://map.utoronto.ca/?id=1809#!m/494517,,,,of  available,0,50,Yes: 24 students,In Person,,Restricted (R1),Enrolment Controls:,This section is restricted at all times to the following students:,Rotman Commerce   (Faculty of Arts and Science),,,,,,,,,,,,,,,,,,,,,,,,,,,,,,,,,,,,,,,,,"Thought, Belief and Behaviour (2)",,,Breadth Requirement:,—,
COMPG,Model-Based Decision Making,RSM341H1-S,"This course aims to introduce logically disciplined approaches to decision making under uncertainty. Managers are continually barraged with information that may be unreliable. They must choose courses of action in the face of many uncertainties. How can we define and assess the ""optimality"" of their decisions in a consistent manner? By building upon the answers to these questions, the course will consider the problem of rational choice when the outcome is determined by the actions of, and interactions between, multiple individuals. Not eligible for CR/NCR option. Contact Rotman Commerce for details.","Completion of 9.0 credits; ECO204Y1/ECO206Y1; ECO220Y1/ECO227Y1/(STA220H1, STA255H1)/(STA237H1, STA238H1)/(STA257H1, STA261H1)",Prerequisite:,"Thought, Belief and Behaviour (2)",Breadth Requirement:,,,Room,LEC0101,Friday,—,13:00,15:00,,,,,WO 20,https://map.utoronto.ca/?id=1809#!m/494558,,,"Lee, B.",of  available,6,50,Yes: 0 student,In Person,,Restricted (R1),Enrolment Controls:,This section is restricted at all times to the following students:,Year 3   Rotman Commerce   (Faculty of Arts and Science),Year 4   Rotman Commerce   (Faculty of Arts and Science),,,,,,,,,,,,,,,,,,,,,,,,,,,,,,,,,,,,,,,,,,,,,
SLA,Theatricality and Spectacle in the History of Russian Culture: From Jesters to Meyerhold,SLA342H1-S,"We will study Russian public spectacles from the eighteenth century imperial court festivities all the way through the Revolutionary festivals of the 1920s. We will also look at the 2003 celebration of the 300 year anniversary of St. Petersburg and the 2014 Sochi Olympics. Special emphasis on those figures who influenced twentieth century theatre and film in the West (such as Konstantin Stanislavsky, Vsevolod Meyerhold, Sergei Diagilev). All readings in English. No knowledge of Russian required.",Humanities,Distribution Requirement:,Creative and Cultural Representations (1),Breadth Requirement:,,,Room,LEC0101,Wednesday,—,14:00,16:00,,,,,AH 302,https://map.utoronto.ca/?id=1809#!m/494578,,,"Smolyarova, T.",of  available,24,30,Yes: 0 student,In Person,,,,,,,,,,,,,,,,,,,,,,,,,,,,,,,,,,,,,,,,,,,,,,,,,,,
SDST,"Sex and the Epidemic: Social Work, HIV, and Human Sexuality",SDS345H1-F,"HIV has forever changed the way human beings understand sexuality. Through a social justice lens, this course examines the nature of community norms, laws, popular media, and the academy to explore how the epidemic has impacted the provision of social services in relation to the diversity of human sexuality.",0.5 credit in SDS,Prerequisite:,UNI345H1,Exclusion:,JSU237H1,Recommended Preparation:,Room,LEC0101,Tuesday,—,14:00,17:00,,,,,EM 302,https://map.utoronto.ca/?id=1809#!m/494463,,,"Brennan, D.",of  available,28,45,Yes: 0 student,In Person,,Priority (P),Enrolment Controls:,"Priority enrolment is given to the groups of students listed below until July 28. There is no course enrolment on July 29. Beginning July 30, all other Arts & Science students can enrol in this section. UTM/UTSC students can enrol in this section starting August 6. The following groups of students are given priority access until July 28:",ASMAJ1240 MA SEXUAL DIVERSITY STUDIES,ASMIN1240 MI SEXUAL DIVERSITY STUDIES,,,,,,,,,,,,,,,,,,,,,,,,,,,,,,,,,,,,,,,ASSPE1240 SP SEXUAL DIVERSITY STUDIES,Social Science,,,Distribution Requirement:,,
SLA,Communism and Culture,SLA346H1-S,"Probes the paradoxes of politics, culture and everyday life by analyzing the complex coexistence of art and literature with changing cultural politics in a totalitarian and post-totalitarian system, with simplistic ideology and political dissent, and with prevailing myths about the West and the East. Readings in English (Polish for majors).",SLA216Y1,Recommended Preparation:,Humanities,Distribution Requirement:,Creative and Cultural Representations (1),Breadth Requirement:,Room,LEC0101,Wednesday,—,15:00,17:00,,,,,AH 107,https://map.utoronto.ca/?id=1809#!m/494578,,,"Jezyk, A.",of  available,26,35,Yes: 0 student,In Person,,,,,,,,,,,,,,,,,,,,,,,,,,,,,,,,,,,,,,,,,,,,,,,,,,,
SLA,The Balkan Geographic Imaginary,SLA347H1-S,"This course examines the symbolic definitions of space in South Eastern Europe and the aesthetic, social, and political implications of these practices. It will draw on theories and the social construction of space to study cultural mapping through cartography, architecture, monumental sculptures, memorials, cemeteries, literature, and film.",Completion of 4.0 credits,Prerequisite:,SLA227H1 or SLA217H1,Recommended Preparation:,Humanities,Distribution Requirement:,Room,LEC0101,Wednesday,—,14:00,16:00,,,,,AH 304,https://map.utoronto.ca/?id=1809#!m/494578,,,"Mandusic, Z.",of  available,25,25,Yes: 0 student,In Person,,,,,,,,,,,,,,,,,,,,,,,,,,,,,,,,,,,,,,,,,,,,,,Creative and Cultural Representations (1),,,Breadth Requirement:,,
SLA,The Finnish Short Story,FIN350H1-S,"Historical, structural, and thematic study of the short fiction of Finland from the Romanticism of the 19th century to contemporary post-structuralism and post-modernism. Works of Runeberg, Topelius, Kivi, Canth, Aho, Jotuni, Lehtonen, Schildt, Sillanpaa, Haanpaa, Meri, Hyry, Salama, Mukka, Liksom, and others. Readings in English. (Offered in alternate years)",Humanities,Distribution Requirement:,Creative and Cultural Representations (1),Breadth Requirement:,,,Room,LEC0101,Tuesday,—,13:00,15:00,,,,,WI 2006,https://map.utoronto.ca/?id=1809#!m/494503,,,"Muhonen, A.",of  available,12,20,Yes: 0 student,In Person,,,,,,,,,,,,,,,,,,,,,,,,,,,,,,,,,,,,,,,,,,,,,,,,,,,
COMPG,Marketing Management,RSM350H1-F,"This course employs the case method of instruction to develop the skills required of marketing managers. Students will learn to diagnose marketing problems and develop, present, and defend their recommendations. They will also gain experience analyzing marketing situations, identifying market opportunities, developing marketing strategies, and designing the marketing mix. Not eligible for CR/NCR option. Contact Rotman Commerce for details.",RSM250H1,Prerequisite:,RSM251H1,Exclusion:,Social Science,Distribution Requirement:,Room,LEC5101,Thursday,—,17:00,19:00,Thursday,—,19:00,21:00,WO 20,https://map.utoronto.ca/?id=1809#!m/494558,WO 20,https://map.utoronto.ca/?id=1809#!m/494558,"Volpe, L.",of  available,1,59,Yes: 0 student,In Person,,Restricted (R1),Enrolment Controls:,This section is restricted at all times to the following students:,Rotman Commerce   (Faculty of Arts and Science),Rotman Commerce   (Faculty of Arts and Science),Activity,Time,Room,Instructor(s),Space Availability,Wait List,Status / Notes,LEC5201,"Volpe, L.",of  available,3,59,Yes: 0 student,In Person,Restricted (R1),Enrolment Controls:,This section is restricted at all times to the following students:,,,,,,,,,,,,,,,,,,,,,,,"Thought, Belief and Behaviour (2)",,,Breadth Requirement:,,
COMPG,Marketing Management,RSM350H1-S,"This course employs the case method of instruction to develop the skills required of marketing managers. Students will learn to diagnose marketing problems and develop, present, and defend their recommendations. They will also gain experience analyzing marketing situations, identifying market opportunities, developing marketing strategies, and designing the marketing mix. Not eligible for CR/NCR option. Contact Rotman Commerce for details.",RSM250H1,Prerequisite:,RSM251H1,Exclusion:,Social Science,Distribution Requirement:,Room,LEC5101,Thursday,—,17:00,19:00,Thursday,—,19:00,21:00,WO 20,https://map.utoronto.ca/?id=1809#!m/494558,WO 20,https://map.utoronto.ca/?id=1809#!m/494558,"Volpe, L.",of  available,0,56,Yes: 4 students,In Person,,Restricted (R1),Enrolment Controls:,This section is restricted at all times to the following students:,Rotman Commerce   (Faculty of Arts and Science),Rotman Commerce   (Faculty of Arts and Science),Activity,Time,Room,Instructor(s),Space Availability,Wait List,Status / Notes,LEC5201,"Volpe, L.",of  available,26,50,Yes: 0 student,In Person,Restricted (R1),Enrolment Controls:,This section is restricted at all times to the following students:,,,,,,,,,,,,,,,,,,,,,,,"Thought, Belief and Behaviour (2)",,,Breadth Requirement:,,
COMPG,Marketing Research,RSM352H1-F,"Marketing research is studied from the perspective of the marketing manager. The course focuses on the initiation, design, and interpretation of research as an aid to marketing decision making. Case studies and projects are used to provide students with some practical research experiences. Not eligible for CR/NCR option. Contact Rotman Commerce for details.","ECO220Y1/ECO227Y1/(STA220H1, STA255H1)/(STA237H1, STA238H1)/(STA257H1, STA261H1)",Prerequisite:,RSM251H1/RSM350H1,Corequisite:,Social Science,Distribution Requirement:,Room,LEC0101,Tuesday,—,10:00,12:00,Tuesday,—,15:00,17:00,,,,,"Tsai, C.",of  available,0,59,Yes: 0 student,Online - Synchronous,—,Restricted (R1),Enrolment Controls:,This section is restricted at all times to the following students:,Rotman Commerce   (Faculty of Arts and Science),Rotman Commerce   (Faculty of Arts and Science),Activity,Time,Room,Instructor(s),Space Availability,Wait List,Status / Notes,LEC0201,"Tsai, C.",of  available,1,55,Yes: 0 student,Online - Synchronous,Restricted (R1),Enrolment Controls:,This section is restricted at all times to the following students:,,,,,,,,,,,,,,,,,,,,,,,Society and its Institutions (3),,,Breadth Requirement:,,
COMPG,Consumer Behaviour,RSM353H1-F,"Formulating successful marketing strategies requires an understanding of consumers’ cultures, motivations, cognitions, and emotions. Students will learn how to use theoretical perspectives from psychology, economics, anthropology, and other disciplines to generate predictions about consumers, interpret consumer reactions to marketing stimuli, and develop rigorous skills in marketing analysis. Not eligible for CR/NCR option. Contact Rotman Commerce for details.",RSM251H1/RSM350H1,Corequisite:,Social Science,Distribution Requirement:,"Thought, Belief and Behaviour (2)",Breadth Requirement:,Room,LEC0101,Thursday,—,13:00,15:00,Thursday,—,16:00,18:00,RT 142,https://map.utoronto.ca/?id=1809#!m/494538,WO 30,https://map.utoronto.ca/?id=1809#!m/494558,"Hawkins, S.",of  available,6,50,Yes: 0 student,In Person,,Restricted (R1),Enrolment Controls:,This section is restricted at all times to the following students:,Rotman Commerce   (Faculty of Arts and Science),Rotman Commerce   (Faculty of Arts and Science),Activity,Time,Room,Instructor(s),Space Availability,Wait List,Status / Notes,LEC0201,"Snetsinger, D.",of  available,17,50,Yes: 0 student,In Person,Restricted (R1),Enrolment Controls:,This section is restricted at all times to the following students:,,,,,,,,,,,,,,,,,,,,,,,,,,,,
COMPG,Consumer Behaviour,RSM353H1-S,"Formulating successful marketing strategies requires an understanding of consumers’ cultures, motivations, cognitions, and emotions. Students will learn how to use theoretical perspectives from psychology, economics, anthropology, and other disciplines to generate predictions about consumers, interpret consumer reactions to marketing stimuli, and develop rigorous skills in marketing analysis. Not eligible for CR/NCR option. Contact Rotman Commerce for details.",RSM251H1/RSM350H1,Corequisite:,Social Science,Distribution Requirement:,"Thought, Belief and Behaviour (2)",Breadth Requirement:,Room,LEC0101,Thursday,—,12:00,14:00,,,,,WO 25,https://map.utoronto.ca/?id=1809#!m/494558,,,,of  available,0,52,Yes: 29 students,In Person,,Restricted (R1),Enrolment Controls:,This section is restricted at all times to the following students:,Rotman Commerce   (Faculty of Arts and Science),,,,,,,,,,,,,,,,,,,,,,,,,,,,,,,,,,,,,,,,,,,,,—,
COMPG,Managing Customer Value,RSM355H1-S,"This course builds on the foundation developed in RSM250H1 (Principles of Marketing) in a competitive simulation environment. While RSM250H1 focuses on the fundamental marketing elements for operationalizing this basic philosophy - segmentation, targeting, positions and 3 of the 4 Ps, this course is designed to advance a participant's understanding of designing and implementing marketing strategies and explore the management of the 4th P (promotion) in greater depth. In particular, participants will make decisions about all 4 Ps simultaneously and manage the interactions between them. Not eligible for CR/NCR.",RSM250H1; Completion of 9.0 FCEs,Prerequisite:,RSM310H1 (Special Topics in Management: Managing Customer Value); offered in Winter 2019 and Winter 2020,Exclusion:,Social Science,Distribution Requirement:,Room,LEC0101,Tuesday,—,16:00,18:00,,,,,RT 142,https://map.utoronto.ca/?id=1809#!m/494538,,,"Soberman, D.",of  available,24,40,Yes: 0 student,In Person,,Restricted (R1),Enrolment Controls:,This section is restricted at all times to the following students:,Rotman Commerce   (Faculty of Arts and Science),,,,,,,,,,,,,,,,,,,,,,,,,,,,,,,,,,,,,,,,,Society and its Institutions (3),,,Breadth Requirement:,,
SDST,Theories of Sexuality,SDS355H1-S,"This course introduces students to key theories of sexuality and sexual diversity. The main goal is to create a framework for understanding sexuality at its intersections with race, gender, class, disability, citizenship status, and geography among other social relations and processes at an advanced level. Closely tracing sexuality’s intersections, course readings will draw upon critical race theory, postcolonial critique and decolonizing movements, women of colour feminisms, trans studies, and transnational sexuality and gender studies.",4.0 credits,Prerequisite:,UNI355H1,Exclusion:,Some coursework in intersectionality of gender or sexuality,Recommended Preparation:,Room,LEC0101,Wednesday,—,12:00,14:00,,,,,UC 261,https://map.utoronto.ca/?id=1809#!m/494517,,,"Basile, E.",of  available,0,45,Yes: 0 student,In Person,,,,,,,,,,,,,,,,,,,,,,,,,,,,,,,,,,,,,,,,,,,,,,"Humanities, Social Science",,,Distribution Requirement:,,
