SMC,Advanced Topics in Book & Media Cultures,BMS401H1-S,Timetable instructions,Note:,"From playgrounds, arenas, and tabletops to computers, mobile devices, and video game consoles, games and play are a vibrant and diverse cultural form and a fundamental part of human society. Why do we make and play games? How do games produce experiences, make meaning, and reflect or refract ideology, and what impact do they have on players? Who gets to make, play, and find representation in games and who is left out? What role do games play in the contemporary media ecosystem? This seminar-style class will explore issues around games both analog and digital from a variety of critical perspectives, including history, industry, technology, culture, politics, and aesthetics. This course was offered in 20211 and in previous years as SMC430H1 Games and Culture and cannot be repeated.",This course is an advanced seminar on the cultural aspects of book and media studies. Students can expect to take an active role in leading course discussions and developing their own research projects. The exact topic will change depending on the instructor.,"Any BMS 0.5 credit at the 300-level and SMC219Y1/(BMS100H1, BMS200Y1, BMS201H1). Further prerequisites may vary from year to year, consult the current Timetable for more information.",Prerequisite:,Humanities,Distribution Requirement:,,,Room,LEC0101,Thursday,—,13:00,15:00,AH 302,"Parker, F.",of  available,0,30,Yes: 19 students,In Person,Subtitle,,,,,,,,,https://map.utoronto.ca/?id=1809#!m/494578,,Priority (P),Enrolment Controls:,"Priority enrolment is given to the groups of students listed below until July 28. There is no course enrolment on July 29. Beginning July 30, all other Arts & Science students can enrol in this section. UTM/UTSC students can enrol in this section starting August 6. The following groups of students are given priority access until July 28:",ASMAJ1300 MA BOOK & MEDIA STUDIES  - Year 4,ASMAJ1300 MA BOOK & MEDIA STUDIES  - Year 3,,,,
SMC,Mediaeval Seminar II,MST406H1-S,Timetable instructions,Note:,"From the early thirteenth century onwards, groups of women who were unable or unwilling to pursue a traditional religious vocation chose to dedicate themselves to active charity. These women sought an apostolate beyond monastic cloisters. The liminal status of these women – between the secular and religious spheres – became increasingly controversial from the beginning of the fourteenth century. This course traces the evolution and changing social role of women (lay, religious, and those in between). Through a rigorous examination of primary sources, it addresses issues such as the relationship between the religious and secular, popular religion, heresy, the supernatural, mysticism, and the changing ideals of female holiness. This course was previously run in 2019 as SMC406H1: Women on the Margins: Orthodoxy, Controversy and Female Religious Identity and cannot be repeated for credit.","""",A fourth-year seminar on a topic to be determined annually. Refer to the  for more information.,Prerequisite:,1.0 credit in MST courses,Recommended Preparation:,MST210H1/MST212H1 or other mediaeval courses,Distribution Requirement:,Room,LEC0101,Wednesday,—,11:00,13:00,AH 402,"More, A.",of  available,7,15,Yes: 0 student,In Person,Subtitle,,,,,,,Humanities,"""",https://map.utoronto.ca/?id=1809#!m/494578,St. Michael's College website,,,,,,,,,
STAT,Statistical Computation,STA410H1-S,Delivery instructions,Note:,"Some of the scheduled in-person lectures may be offered online depending on current public health and institutional guidelines. Details about the course meeting schedule, as well as other course activities and assessments, will be communicated in the course syllabus and/or on Quercus.","Programming in an interactive statistical environment. Generating random variates and evaluating statistical methods by simulation. Algorithms for linear models, maximum likelihood estimation, and Bayesian inference. Statistical algorithms such as the Kalman filter and the EM algorithm. Graphical display of data.",STA302H1/STAC67H3/STA302H5; CSC108H1/CSC110Y1/CSC120H1/CSC148H1/CSCA08H3/CSCA48H3/CSCA20H3/CSC108H5/CSC148H5; MAT223H1/MAT240H1/MATA22H3/MATA23H3/MAT223H5/MAT240H5,Prerequisite:,Science,Distribution Requirement:,The Physical and Mathematical Universes (5),Breadth Requirement:,Room,LEC0101,Tuesday,—,15:00,18:00,MP 202,,of  available,49,130,No,In Person (See Delivery Instructions.),,BA 1130,,—,BA 1130,—,Wednesday,,,https://map.utoronto.ca/?id=1809#!m/494490,,Priority (P),Enrolment Controls:,"Priority enrolment is given to the groups of students listed below until July 28. There is no course enrolment on July 29. Beginning July 30, all other Arts & Science students can enrol in this section. UTM/UTSC students can enrol in this section starting August 6. The following groups of students are given priority access until July 28:",ASSPE1540 SP APPLIED STATISTICS,ASSPE2270 SP STATISTICAL SCI: METH & PRA,—,18:00,21:00,https://map.utoronto.ca/?id=1809#!m/494470
SMC,Advanced Open Topics in Book & Media Studies,BMS411H1-S,Timetable instructions,Note:,"This course explores a relationship between media and art in the context of contemporary movements for social and environmental justice-making. Arts-based pedagogy is used as a praxis from which to consider the social contexts of intersecting identities within which art and media are produced. An emphasis is placed on local and community art as activism. This course was offered in 20201 as SMC431H1 Media, Art and Justice and cannot be repeated.",This seminar is reserved for unique topics not already covered in other courses. The exact topic will change depending on the instructor.,Completion of 9.0 credits,Prerequisite:,Humanities,Distribution Requirement:,,,Room,LEC0101,Wednesday,—,14:00,16:00,TF 200,"Gildea, I.",of  available,0,30,Yes: 3 students,In Person,Subtitle,,,,,,,,,https://map.utoronto.ca/?id=1809#!m/494581,,Priority (P),Enrolment Controls:,"Priority enrolment is given to the groups of students listed below until July 28. There is no course enrolment on July 29. Beginning July 30, all other Arts & Science students can enrol in this section. UTM/UTSC students can enrol in this section starting August 6. The following groups of students are given priority access until July 28:",ASMAJ1300 MA BOOK & MEDIA STUDIES  - Year 4,ASMAJ1300 MA BOOK & MEDIA STUDIES  - Year 3,,,,
SMC,The Irish in Canada,CLT413H1-S,,,,"This course explores the history of Irish migration and settlement in Canada with a special emphasis on political, social, economic and religious themes.",SMC413H1,Exclusion:,Humanities,Distribution Requirement:,Society and its Institutions (3),Breadth Requirement:,Room,LEC0101,Thursday,—,14:00,16:00,TF 103,,of  available,17,25,Yes: 0 student,In Person,,,,,,—,,,,https://map.utoronto.ca/?id=1809#!m/494581,,,,,,,,,,
STAT,Statistical Methods for Machine Learning II,STA414H1-S,Delivery instructions,Note:,"Some of the scheduled in-person lectures may be offered online depending on current public health and institutional guidelines. Details about the course meeting schedule, as well as other course activities and assessments, will be communicated in the course syllabus and/or on Quercus.","Probabilistic foundations of supervised and unsupervised learning methods such as naive Bayes, mixture models, and logistic regression. Gradient-based fitting of composite models including neural nets. Exact inference, stochastic variational inference, and Marko chain Monte Carlo. Variational autoencoders and generative adversarial networks.","STA314H1/CSC411H1/CSC311H1/(STA314H5, STA315H5)/CSCC11H3/CSC411H5; STA302H1/STAC67H3/STA302H5; CSC108H1/CSC110Y1/CSC120H1/CSC148H1/CSCA08H3/CSCA48H3/CSCA20H3/CSC108H5/CSC148H5; MAT235Y1/MAT237Y1/MAT257Y1/(MATB41H3, MATB42H3)/(MAT232H5, MAT236H5)/(MAT233H5, MAT236H5); MAT223H1/MAT240H1/MATA22H3/MATA23H3/MAT223H5/MAT240H5",Prerequisite:,CSC412H1; STAD68H3,Exclusion:,STA303H1,Recommended Preparation:,Room,LEC0101,Monday,—,14:00,17:00,KP 108,"Duvenaud, D.",of  available,0,120,Yes: 19 students,In Person (See Delivery Instructions.),,,,,BA 1130,,Tuesday,Science,Distribution Requirement:,https://map.utoronto.ca/?id=1809#!m/494488,,Priority (P),Enrolment Controls:,"Priority enrolment is given to the groups of students listed below until July 28. There is no course enrolment on July 29. Beginning July 30, all other Arts & Science students can enrol in this section. UTM/UTSC students can enrol in this section starting August 6. The following groups of students are given priority access until July 28:",ASSPE0608 SP ACTUARIAL SCIENCE,ASSPE1687 SP DATA SCI,—,18:00,21:00,https://map.utoronto.ca/?id=1809#!m/494470
SMC,Irish Nationalism in Canada,CLT416H1-F,,,,"An in-depth examination of the Fenian underground in Canada during the 1860s, using primary sources to examine such issues as ethno-religious conflict, the relationship between Catholicism and Irish nationalism, and the efforts of the secret police force to infiltrate and undermine the Fenian Brotherhood. Special attention is paid to the ways in which the state responded to the threat posed by Irish revolutionaries who supported an Irish-American invasion of Canada as a means to hit back at the British Empire and pave the way for Irish independence.",Completion of 9.0 credits,Prerequisite:,SMC416H1,Exclusion:,Humanities,Distribution Requirement:,Room,LEC0101,Thursday,—,14:00,16:00,TF 200,"Wilson, D.",of  available,2,6,Yes: 0 student,In Person,,,,,,,,Society and its Institutions (3),Breadth Requirement:,https://map.utoronto.ca/?id=1809#!m/494581,,,,,,,,,,
SPA,Advanced Academic Portuguese,PRT420H1-S,,,,"A study of advanced aspects of formal Portuguese through reading and extensive writing practice, with an aim at developing skills necessary for academic and professional writing and oral presentations.",PRT320Y1 or PRT219Y1 or Placement test,Prerequisite:,PRT420Y1,Exclusion:,Humanities,Distribution Requirement:,Room,LEC0101,Wednesday,—,10:00,12:00,NF 235,"Alves dos Santos Rato, A.",of  available,13,20,Yes: 0 student,In Person,,,,,,,,Creative and Cultural Representations (1),Breadth Requirement:,https://map.utoronto.ca/?id=1809#!m/494600,,,,,,,,,,
SPA,Advanced Grammar,SPA420H1-S,,,,"Linguistic analysis with the objective of improving students' command of Spanish grammar. Advanced review of traditional grammatical topics, including the verbal and pronominal systems, and Spanish copulas and embedded clauses. This course assumes familiarity with the grammatical terminology introduced in SPA320Y1.","SPA219Y1 or SPA320Y1, or placement test.",Prerequisite:,Humanities,Distribution Requirement:,Creative and Cultural Representations (1),Breadth Requirement:,Room,LEC0101,Monday,—,14:00,17:00,VC 215,"Perez-Leroux, A.",of  available,0,25,Yes: 3 students,In Person,,,,,,,,,,https://map.utoronto.ca/?id=1809#!m/494602,,,,,,,,,,
SPA,Experimental Approaches to Hispanic and Lusophone Linguistics,SPA424H1-F,,,,"This course introduces students to theoretically grounded experimental approaches in the field of linguistics, with a particular focus on Hispanic and Lusophone linguistics. Students will receive training in the use of different experimental and corpus analysis techniques and will discuss paradigmatic examples of research papers in the areas of phonetics-phonology and morpho-syntax. Throughout the course, they will conduct their own research project under the supervision of a specialist in the field. The course can be taught in English, Spanish and Portuguese.",SPA322H1/ PRT322H1,Prerequisite:,300-level SPA/PRT linguistic courses,Recommended Preparation:,"Thought, Belief and Behaviour (2)",Breadth Requirement:,Room,LEC0101,Tuesday,—,14:00,17:00,NF 007,"Colantoni, L.",of  available,16,20,Yes: 0 student,In Person,,,,,,,,,,https://map.utoronto.ca/?id=1809#!m/494600,,,,,,,,,,
SMC,Independent Studies in Christianity and Culture,CHC433Y1-Y,Timetable instructions,Note:,"For ""E"" indicator courses, please contact the SMC Program Administrator, Stephanie Taylor at sm.taylor@utoronto.ca or 416-926-7256 (50 St. Joseph Street, Odette Hall, Room 020, St. Michael's College).",An independent research project to be proposed by the student and supervised by a Christianity and Culture faculty member. Application forms are available from the SMC Principal's Office. Not eligible for CR/NCR option.,Completion of 8.0 credits and written approval of the Program Coordinator and Director,Prerequisite:,Humanities,Distribution Requirement:,,,,LEC0101,,—,,,—,,of  available,9998,9999,No,In Person,,,—,,,—,,,,,,Enrol at Department (E),Enrolment Controls:,Enrolment via ACORN is not available. Students must request permission to enrol in this course by contacting the sponsoring department. Please see Timetable Instructions tab for contact information.,,,,,,
SMC,Independent Studies in Christianity and Culture,CHC434H1-F,Timetable instructions,Note:,"For ""E"" indicator courses, please contact the SMC Program Administrator, Stephanie Taylor at sm.taylor@utoronto.ca or 416-926-7256 (50 St. Joseph Street, Odette Hall, Room 020, St. Michael's College).",An independent research project to be proposed by the student and supervised by a Christianity and Culture faculty member. Application forms are available from the SMC Principal's Office. Not eligible for CR/NCR option.,Completion of 8.0 credits and permission of Program Coordinator and Director,Prerequisite:,Humanities,Distribution Requirement:,,,Room,LEC0101,,—,,,—,,of  available,9999,9999,No,In Person,,,,,,—,,,,,,Enrol at Department (E),Enrolment Controls:,Enrolment via ACORN is not available. Students must request permission to enrol in this course by contacting the sponsoring department. Please see Timetable Instructions tab for contact information.,,,,,,
SMC,Independent Studies in Christianity and Culture,CHC434H1-S,Timetable instructions,Note:,"For ""E"" indicator courses, please contact the SMC Program Administrator, Stephanie Taylor at sm.taylor@utoronto.ca or 416-926-7256 (50 St. Joseph Street, Odette Hall, Room 020, St. Michael's College).",An independent research project to be proposed by the student and supervised by a Christianity and Culture faculty member. Application forms are available from the SMC Principal's Office. Not eligible for CR/NCR option.,Completion of 8.0 credits and permission of Program Coordinator and Director,Prerequisite:,Humanities,Distribution Requirement:,,,Room,LEC0101,,—,,,—,,of  available,9999,9999,No,In Person,,,,,,—,,,,,,Enrol at Department (E),Enrolment Controls:,Enrolment via ACORN is not available. Students must request permission to enrol in this course by contacting the sponsoring department. Please see Timetable Instructions tab for contact information.,,,,,,
SMC,Independent Studies in Mediaeval Studies,MST435H1-F,Timetable instructions,Note:,"For ""E"" indicator courses, please contact the SMC Program Administrator, Stephanie Taylor at sm.taylor@utoronto.ca or 416-926-7256 (50 St. Joseph Street, Odette Hall, Room 020, St. Michael's College).",An independent research project to be proposed by the student and supervised by a member of faculty affiliated with the Mediaeval Studies Program. Application forms are available from the SMC Principal's Office. Not eligible for CR/NCR option.,Completion of 10.0 credits and written approval of the Program Coordinator and Program Director,Prerequisite:,Humanities,Distribution Requirement:,,,Room,LEC0101,,—,,,—,,of  available,9999,9999,No,In Person,,,,,,—,,,,,,Enrol at Department (E),Enrolment Controls:,Enrolment via ACORN is not available. Students must request permission to enrol in this course by contacting the sponsoring department. Please see Timetable Instructions tab for contact information.,,,,,,
SMC,Independent Studies in Mediaeval Studies,MST435H1-S,Timetable instructions,Note:,"For ""E"" indicator courses, please contact the SMC Program Administrator, Stephanie Taylor at sm.taylor@utoronto.ca or 416-926-7256 (50 St. Joseph Street, Odette Hall, Room 020, St. Michael's College).",An independent research project to be proposed by the student and supervised by a member of faculty affiliated with the Mediaeval Studies Program. Application forms are available from the SMC Principal's Office. Not eligible for CR/NCR option.,Completion of 10.0 credits and written approval of the Program Coordinator and Program Director,Prerequisite:,Humanities,Distribution Requirement:,,,Room,LEC0101,,—,,,—,,of  available,9999,9999,No,In Person,,,,,,—,,,,,,Enrol at Department (E),Enrolment Controls:,Enrolment via ACORN is not available. Students must request permission to enrol in this course by contacting the sponsoring department. Please see Timetable Instructions tab for contact information.,,,,,,
STAT,Methods for Multivariate Data,STA437H1-F,Delivery instructions,Note:,Some of the scheduled in-person lectures may be offered online depending on current public health and institutional guidelines.,"Practical techniques for the analysis of multivariate data; fundamental methods of data reduction with an introduction to underlying distribution theory; basic estimation and hypothesis testing for multivariate means and variances; regression coefficients; principal components and partial, multiple and canonical correlations; multivariate analysis of variance; profile analysis and curve fitting for repeated measurements; classification and the linear discriminant function.",STA302H1/STAC67H3/STA302H5,Prerequisite:,"STAD37H3, STA437H5",Exclusion:,MAT224H1/MAT247H1,Recommended Preparation:,Room,LEC5101,Wednesday,—,18:00,21:00,SF 1105,"Molkaraie, M.",of  available,1,200,Yes: 0 student,In Person (See Delivery Instructions.),,,,,,,,Science,Distribution Requirement:,https://map.utoronto.ca/?id=1809#!m/494481,"Details about the course meeting schedule, as well as other course activities and assessments, will be communicated in the course syllabus and/or on Quercus.",Priority (P),Enrolment Controls:,"Priority enrolment is given to the groups of students listed below until July 28. There is no course enrolment on July 29. Beginning July 30, all other Arts & Science students can enrol in this section. UTM/UTSC students can enrol in this section starting August 6. The following groups of students are given priority access until July 28:",ASSPE1540 SP APPLIED STATISTICS,ASSPE2270 SP STATISTICAL SCI: METH & PRA,,,,
STAT,Methods for Multivariate Data,STA437H1-S,Delivery instructions,Note:,Some of the scheduled in-person lectures may be offered online depending on current public health and institutional guidelines.,"Practical techniques for the analysis of multivariate data; fundamental methods of data reduction with an introduction to underlying distribution theory; basic estimation and hypothesis testing for multivariate means and variances; regression coefficients; principal components and partial, multiple and canonical correlations; multivariate analysis of variance; profile analysis and curve fitting for repeated measurements; classification and the linear discriminant function.",STA302H1/STAC67H3/STA302H5,Prerequisite:,"STAD37H3, STA437H5",Exclusion:,MAT224H1/MAT247H1,Recommended Preparation:,Room,LEC0101,Tuesday,—,14:00,17:00,BA 1160,"Zhou, Z.",of  available,99,200,Yes: 0 student,In Person (See Delivery Instructions.),,,,,HS 610,,Thursday,Science,Distribution Requirement:,https://map.utoronto.ca/?id=1809#!m/494470,"Details about the course meeting schedule, as well as other course activities and assessments, will be communicated in the course syllabus and/or on Quercus.",Priority (P),Enrolment Controls:,"Priority enrolment is given to the groups of students listed below until July 28. There is no course enrolment on July 29. Beginning July 30, all other Arts & Science students can enrol in this section. UTM/UTSC students can enrol in this section starting August 6. The following groups of students are given priority access until July 28:",ASSPE1540 SP APPLIED STATISTICS,ASSPE2270 SP STATISTICAL SCI: METH & PRA,—,15:00,18:00,https://map.utoronto.ca/?id=1809#!m/494459
SMC,Introduction to Old Irish,CLT441H1-S,,,,"This course will introduce students to Old Irish, the language of Western Europe’s earliest vernacular literature. The course will focus on bringing students to a reading knowledge of Classical Old Irish, drawing on the most recent teaching aids and incorporating translation exercises and prepared reading passages from the early literature. The course will also teach the linguistic vocabulary for describing a Celtic language. No prior knowledge of Irish is assumed.",Completion of 9.0 credits,Prerequisite:,SMC441Y1,Exclusion:,Humanities,Distribution Requirement:,Room,LEC0101,Thursday,—,11:00,13:00,Contact DEPT,"Miles, B.",of  available,0,6,Yes: 1 student,In Person,,,,,,,,Creative and Cultural Representations (1),Breadth Requirement:,,,,,,,,,,,
STAT,Methods of Applied Statistics,STA442H1-F,Delivery instructions,Note:,Some of the scheduled in-person lectures may be offered online depending on current public health and institutional guidelines.,"Advanced topics in statistics and data analysis with emphasis on applications. Diagnostics and residuals in linear models, introduction to generalized linear models, graphical methods, additional topics such as random effects models, designed experiments, model selection, analysis of censored data, introduced as needed in the context of case studies.","STA303H1/(STAC67H3, STAC51H3); CSC108H1/CSC110Y1/CSC120H1/CSC148H1/CSCA08H3/CSCA48H3/CSCA20H3/CSC108H5/CSC148H5",Prerequisite:,STA441H5,Exclusion:,At least an additional 1.0 FCE in STA courses at the 300 or 400 level,Recommended Preparation:,Room,LEC0101,Friday,—,09:00,12:00,NF 003,"Brown, P.",of  available,99,250,Yes: 0 student,In Person (See Delivery Instructions.),,,,,,,,Science,Distribution Requirement:,https://map.utoronto.ca/?id=1809#!m/494600,"Details about the course meeting schedule, as well as other course activities and assessments, will be communicated in the course syllabus and/or on Quercus.",Priority (P),Enrolment Controls:,"Priority enrolment is given to the groups of students listed below until July 28. There is no course enrolment on July 29. Beginning July 30, all other Arts & Science students can enrol in this section. UTM/UTSC students can enrol in this section starting August 6. The following groups of students are given priority access until July 28:",ASSPE1540 SP APPLIED STATISTICS,ASSPE2270 SP STATISTICAL SCI: METH & PRA,,,,
STAT,Methods of Applied Statistics,STA442H1-S,Delivery instructions,Note:,Lectures will be delivered online and tutorials will be offered in-person or online depending on the tutorial section in which you enrol.,"Advanced topics in statistics and data analysis with emphasis on applications. Diagnostics and residuals in linear models, introduction to generalized linear models, graphical methods, additional topics such as random effects models, designed experiments, model selection, analysis of censored data, introduced as needed in the context of case studies.","STA303H1/(STAC67H3, STAC51H3); CSC108H1/CSC110Y1/CSC120H1/CSC148H1/CSCA08H3/CSCA48H3/CSCA20H3/CSC108H5/CSC148H5",Prerequisite:,STA441H5,Exclusion:,At least an additional 1.0 FCE in STA courses at the 300 or 400 level,Recommended Preparation:,Room,LEC0101,Wednesday,—,15:00,17:00,—,"Nadarajah, T.",of  available,136,250,Yes: 0 student,Online - Synchronous (See Delivery Instructions.),Activity,Wednesday,—,—,,—,,Science,Distribution Requirement:,,All assessments will be completed online.,Priority (P),Enrolment Controls:,"Priority enrolment is given to the groups of students listed below until July 28. There is no course enrolment on July 29. Beginning July 30, all other Arts & Science students can enrol in this section. UTM/UTSC students can enrol in this section starting August 6. The following groups of students are given priority access until July 28:",ASSPE1540 SP APPLIED STATISTICS,ASSPE2270 SP STATISTICAL SCI: METH & PRA,,,,
STAT,Stochastic Processes,STA447H1-S,Delivery instructions,Note:,"Some of the scheduled in-person lectures may be offered online depending on current public health and institutional guidelines. Details about the course meeting schedule, as well as other course activities and assessments, will be communicated in the course syllabus and/or on Quercus.","Discrete and continuous time processes with an emphasis on Markov, Gaussian and renewal processes. Martingales and further limit theorems. A variety of applications taken from some of the following areas are discussed in the context of stochastic modeling: Information Theory, Quantum Mechanics, Statistical Analyses of Stochastic Processes, Population Growth Models, Reliability, Queuing Models, Stochastic Calculus, Simulation (Monte Carlo Methods).",STA347H1/MAT377H1/STAC62H3,Prerequisite:,"STA348H5, STAC63H5",Exclusion:,Science,Distribution Requirement:,Room,LEC2501,Thursday,—,18:00,21:00,SF 1105,"Park, J.",of  available,8,15,Yes: 0 student,In Person (See Delivery Instructions.),,,,,SF 1105,,Thursday,The Physical and Mathematical Universes (5),Breadth Requirement:,https://map.utoronto.ca/?id=1809#!m/494481,,Restricted (R1),Enrolment Controls:,This section is restricted at all times to the following students:,(Faculty of Applied Science & Engineering),,—,18:00,21:00,https://map.utoronto.ca/?id=1809#!m/494481
