GGR,Geomorphology and the Anthropocene,GGR406H1-S,,,,"In this seminar course, we will explore the nature of geomorphology and the Anthropocene (the proposed geological time interval during which human activities have greatly impacted the global environment) using a combination of lectures, readings, and discussions. We will consider the ways in which hillslope, fluvial, coastal, aeolian, and other domains have been altered or influenced by humans and consider the role of geomorphology as a science for understanding and examining the changes in landscape form and processes.",GGR201H1,Prerequisite:,GGR401H1 (Special Topics in Geography II: Geomorphology and the Anthropocene); offered in Winter 2020,Exclusion:,"10.0 credits, GGR272H1",Recommended Preparation:,Room,LEC0101,Thursday,—,14:00,16:00,BF 323,https://map.utoronto.ca/?id=1809#!m/494497,"Peirce, S.",7,30,Yes: 0 student,In Person,,,Priority (P),Enrolment Controls:,"Priority enrolment is given to the groups of students listed below until July 28. There is no course enrolment on July 29. Beginning July 30, all other Arts & Science students can enrol in this section. UTM/UTSC students can enrol in this section starting August 6. The following groups of students are given priority access until July 28:",,,,,Science,Distribution Requirement:
FRE,Advanced Topics in Quebec Literature:,FRE410H1-S,,,,"An advanced interdisciplinary research seminar devoted to specific issues of Québécois literature and culture. Focus on a literary genre, a particular subject matter, a literary movement, or based on a multidisciplinary approach to cinema, arts, and music. For more information, see","FRE240H1/FRE245H1, FRE241H1/FRE246H1, FRE345H1",Prerequisite:,Humanities,Distribution Requirement:,Creative and Cultural Representations (1),Breadth Requirement:,Room,LEC0101,Tuesday,—,10:00,12:00,UC B203,https://map.utoronto.ca/?id=1809#!m/494517,"Taban, C.",8,20,Yes: 0 student,In Person,,,,,,,,,,,
GGR,Advanced Remote Sensing,GGR414H1-F,,,,"Building on GGR337H1 Environmental Remote Sensing with advanced theories and techniques for land cover mapping, vegetation biophysical and biochemical parameter retrievals, optical and thermal remote sensing of urban environment, and application of satellite remote sensing to terrestrial water and carbon cycle estimation. Basic radiative transfer theories as applied to vegetation will be given in some detail as the basis for various remote sensing applications. Optical instruments for measuring vegetation structural parameters will be demonstrated in the field.",10 FCEs including GGR337H1,Prerequisite:,"GGR272H1, GGR273H1, GGR373H1",Recommended Preparation:,Science,Distribution Requirement:,Room,LEC0101,Thursday,—,10:00,12:00,WI 523,https://map.utoronto.ca/?id=1809#!m/494503,"Liu, J.",14,30,Yes: 0 student,In Person,SS 561,—,Priority (P),Enrolment Controls:,"Priority enrolment is given to the groups of students listed below until July 28. There is no course enrolment on July 29. Beginning July 30, all other Arts & Science students can enrol in this section. UTM/UTSC students can enrol in this section starting August 6. The following groups of students are given priority access until July 28:",GEOGRAPHY    Major (Faculty of Arts and Science),GEOGRAPHY    Specialist (Faculty of Arts and Science),"GEOGRAPHY    Major (John H. Daniels Faculty of Architecture, Landscape, & Design)","GEOGRAPHY    Specialist (John H. Daniels Faculty of Architecture, Landscape, & Design)",The Physical and Mathematical Universes (5),Breadth Requirement:
GGR,Environmental Impact Assessment,GGR416H1-F,,,,"Environmental impact assessment (EIA) as a mechanism for avoiding or mediating the potential costs of development. The course focuses on the theory and practice of EIA in Canada in general and Ontario in particular. Using a broad definition of environment, various components of EIA are addressed, with an emphasis on principles, legal and institutional frameworks, stages in the process, and specific analytical techniques.","10.0 FCE's, 2.0 FCE's in Geography including GGR270H1, GGR271H1",Prerequisite:,One of GGR222H1/GGR223H1 or ENV236H1/JGE236H1,Recommended Preparation:,Social Science,Distribution Requirement:,Room,LEC5101,Tuesday,—,17:00,20:00,MP 118,https://map.utoronto.ca/?id=1809#!m/494490,"Subramanyam, N.",7,30,Yes: 0 student,In Person,,,Priority (P),Enrolment Controls:,"Priority enrolment is given to the groups of students listed below until July 28. There is no course enrolment on July 29. Beginning July 30, all other Arts & Science students can enrol in this section. UTM/UTSC students can enrol in this section starting August 6. The following groups of students are given priority access until July 28:",GEOGRAPHY    Major (Faculty of Arts and Science),GEOGRAPHY    Specialist (Faculty of Arts and Science),"GEOGRAPHY    Major (John H. Daniels Faculty of Architecture, Landscape, & Design)","GEOGRAPHY    Specialist (John H. Daniels Faculty of Architecture, Landscape, & Design)",Society and its Institutions (3),Breadth Requirement:
GGR,Environmental Justice,GGR419H1-S,,,,"Examines how environmental problems affect people, communities and societies differentially and how marginalized communities and people often bear the brunt of environmental costs, while contributing little to their creation.  It uses readings and case studies from across the globe to address the production of environmental injustice and the struggle for environmental justice.",10.0 FCE's,Prerequisite:,1.0 FCE in Geography (SOC SCI/BR=3),Recommended Preparation:,Social Science,Distribution Requirement:,Room,LEC0101,Wednesday,—,15:00,17:00,BF 215,https://map.utoronto.ca/?id=1809#!m/494497,"Singh, N.",0,30,Yes: 24 students,In Person,,,Priority (P),Enrolment Controls:,"Priority enrolment is given to the groups of students listed below until July 28. There is no course enrolment on July 29. Beginning July 30, all other Arts & Science students can enrol in this section. UTM/UTSC students can enrol in this section starting August 6. The following groups of students are given priority access until July 28:",,,,,Society and its Institutions (3),Breadth Requirement:
FRE,French Language IV,FSL421Y1-Y,Delivery instructions,Note:,2 hrs in-class lecture + 1 hr online asynchronous,An advanced course in French including the reading and discussion of texts focussing on the francophone presence and influence in the international context. Emphasis is placed on mastery of complex linguistic skills via use of a variety of reference tools and self-correction.,"FSL321Y1 or, upon first FRE/FSL enrolment, equivalent as determined by the French Placement Test.",Prerequisite:,"FSL442H1, FSL443H1.",Exclusion:,Humanities,Distribution Requirement:,,LEC0101,Tuesday,—,12:00,14:00,CR 406,https://map.utoronto.ca/?id=1809#!m/494580,"Visoi, M.",7,45,Yes: 0 student,In Person (See Delivery Instructions.),CR 103,,Priority (P),Enrolment Controls:,"Priority enrolment is given to the groups of students listed below until July 28. There is no course enrolment on July 29. Beginning July 30, all other Arts & Science students can enrol in this section. UTM/UTSC students can enrol in this section starting August 6. The following groups of students are given priority access until July 28:",ASMAJ0120 MA FRENCH LANGUAGE LEARNING  - Year 3,ASMIN0120 MI FRENCH LANG  - Year 4,ASMAJ0120 MA FRENCH LANGUAGE LEARNING  - Year 3,ASMIN0120 MI FRENCH LANG  - Year 4,Creative and Cultural Representations (1),Breadth Requirement:
GGR,Transportation Geography and Planning,GGR424H1-S,,,,"Introductory overview of major issues in interurban and intraurban transportation at the local, national and international scale. Topics include urban transportation, land use patterns and the environment, causes of and cures for congestion, public transit, infrastructure finance, and transport planning and policy setting.",10.0 FCE's including one of GGR124H1/GGR220H1/GGR221H1,Prerequisite:,"GGR324H1, CITC18H3",Exclusion:,GGR270H1,Recommended Preparation:,Room,LEC0101,Monday,—,13:00,15:00,SS 2111,https://map.utoronto.ca/?id=1809#!m/494510,,0,30,Yes: 30 students,In Person,,—,Priority (P),Enrolment Controls:,"Priority enrolment is given to the groups of students listed below until July 28. There is no course enrolment on July 29. Beginning July 30, all other Arts & Science students can enrol in this section. UTM/UTSC students can enrol in this section starting August 6. The following groups of students are given priority access until July 28:",GEOGRAPHY    Major (Faculty of Arts and Science),GEOGRAPHY    Specialist (Faculty of Arts and Science),"GEOGRAPHY    Major (John H. Daniels Faculty of Architecture, Landscape, & Design)","GEOGRAPHY    Specialist (John H. Daniels Faculty of Architecture, Landscape, & Design)",Social Science,Distribution Requirement:
GGR,Innovation and Governance,GGR429H1-F,,,,"The course focuses on a broad range of topics related to innovation and governance, such as (i) technological change and its social and economic consequences, (ii) the spatial effects which result from this, and (iii) the necessities for economic policies at different territorial levels.  Since international competitiveness of industrialized economies cannot be based on cost advantages alone, future growth in the knowledge-based economy will be increasingly associated with capabilities related to creativity, knowledge generation and innovation.  As a consequence, questions regarding the performance in innovation and effectiveness of policy support become decisive at the firm level, regional level and national level.  The first part of the course deals with conceptual foundations of innovation processes, such as evolutionary and institutional views of innovation.  In the second part, national configurations of innovation processes are investigated.  The third part deals with innovation at the subnational level, focusing on regional clustering, institution building, multilevel governance, and regionalized innovation systems.",10.0 FCEs,Prerequisite:,POL408H1,Exclusion:,"One of GGR221H1, GGR251H1, GGR324H1, GGR326H1, GGR328H1, GGR374H1",Recommended Preparation:,Room,LEC0101,Tuesday,—,10:00,12:00,BA 2135,https://map.utoronto.ca/?id=1809#!m/494470,"Bathelt, H.",11,30,Yes: 0 student,In Person,,,Priority (P),Enrolment Controls:,"Priority enrolment is given to the groups of students listed below until July 28. There is no course enrolment on July 29. Beginning July 30, all other Arts & Science students can enrol in this section. UTM/UTSC students can enrol in this section starting August 6. The following groups of students are given priority access until July 28:",GEOGRAPHY  Department of Geography and Planning  Major (Faculty of Arts and Science),GEOGRAPHY  Department of Geography and Planning  Specialist (Faculty of Arts and Science),"GEOGRAPHY  Department of Geography and Planning  Major (John H. Daniels Faculty of Architecture, Landscape, & Design)","GEOGRAPHY  Department of Geography and Planning  Specialist (John H. Daniels Faculty of Architecture, Landscape, & Design)",Social Science,Distribution Requirement:
GGR,Geographies of Markets,GGR430H1-S,,,,"Focuses on actually-existing markets and their geographically-mediated formation and assemblage. Explores how markets are produced, stabilized, reshaped and fall apart at multiple geographic scales. We examine issues such as the debates on states versus markets, embeddedness of markets, neoliberalism and moral justification of markets, varieties of capitalism, regionally variegated capitalism, post-socialist market transitions, and the dynamic evolution of market institutions and economic landscapes.",10.0 FCE's including at least 1.0 FCE in 300+ Geography (SOC SCI/BR=3),Prerequisite:,GGR400H1(2013-14),Exclusion:,"GGR220H1/GGR221H1, GGR326H1",Recommended Preparation:,Room,LEC0101,Thursday,—,13:00,15:30,WI 523,https://map.utoronto.ca/?id=1809#!m/494503,"Zhang, J.",8,30,Yes: 0 student,In Person,,,Priority (P),Enrolment Controls:,"Priority enrolment is given to the groups of students listed below until July 28. There is no course enrolment on July 29. Beginning July 30, all other Arts & Science students can enrol in this section. UTM/UTSC students can enrol in this section starting August 6. The following groups of students are given priority access until July 28:",GEOGRAPHY    Major (Faculty of Arts and Science),GEOGRAPHY    Specialist (Faculty of Arts and Science),"GEOGRAPHY    Major (John H. Daniels Faculty of Architecture, Landscape, & Design)","GEOGRAPHY    Specialist (John H. Daniels Faculty of Architecture, Landscape, & Design)",Social Science,Distribution Requirement:
GGR,Built Environment and Health,GGR433H1-S,,,,"Linking across fields that include public health, geography and planning, this course examines the growing evidence and ways in which human health is affected by the design and development of the built environment in which we live, work and play. The course considers how various planning and development decisions impact population and individual health, particularly in relation to chronic diseases, injuries, and mental health. Potential field trip, transportation cost: $20.",10.0 credits,Prerequisite:,GGR400H1 (Special Topics in Geography I: Built Environments & Health); offered in Winter 2013,Exclusion:,1.0 credit in Geography (SOC SCI/BR=3),Recommended Preparation:,Room,LEC0101,Friday,—,09:00,12:00,OI 4410,https://map.utoronto.ca/?id=1809#!m/494563,"Gesink, D.",0,30,Yes: 12 students,In Person,,,Priority (P),Enrolment Controls:,"Priority enrolment is given to the groups of students listed below until July 28. There is no course enrolment on July 29. Beginning July 30, all other Arts & Science students can enrol in this section. UTM/UTSC students can enrol in this section starting August 6. The following groups of students are given priority access until July 28:",GEOGRAPHY    Major (Faculty of Arts and Science),GEOGRAPHY    Specialist (Faculty of Arts and Science),"GEOGRAPHY    Major (John H. Daniels Faculty of Architecture, Landscape, & Design)","GEOGRAPHY    Specialist (John H. Daniels Faculty of Architecture, Landscape, & Design)",Social Science,Distribution Requirement:
GGR,Building Community Resilience,GGR434H1-S,,,,"Examines concepts of resilience as a way of building the capacity of communities to (a) respond to predicted disruptions/shocks associated with climate change, global pandemics, anticipated disruptions in global food supply, energy insecurity, and environmental degradation; and (b) nurture the development of alternative spaces that support the emergence of more life-sustaining structures and practices. Includes explicit attention to equity and public health, and explores issues such as: participatory governance of social-ecological systems, the nature of social change, complexity science, the role of social movements, indigenous and political ecology perspectives.",10 FCEs,Prerequisite:,GGR400H1 (2011-12),Exclusion:,1.0 FCEs in Geography,Recommended Preparation:,Room,LEC0101,Wednesday,—,11:00,14:00,SK 218,https://map.utoronto.ca/?id=1809#!m/494564,"Poland, B.",0,30,Yes: 13 students,In Person,,,Priority (P),Enrolment Controls:,"Priority enrolment is given to the groups of students listed below until July 28. There is no course enrolment on July 29. Beginning July 30, all other Arts & Science students can enrol in this section. UTM/UTSC students can enrol in this section starting August 6. The following groups of students are given priority access until July 28:",GEOGRAPHY    Major (Faculty of Arts and Science),GEOGRAPHY    Specialist (Faculty of Arts and Science),"GEOGRAPHY    Major (John H. Daniels Faculty of Architecture, Landscape, & Design)","GEOGRAPHY    Specialist (John H. Daniels Faculty of Architecture, Landscape, & Design)",Social Science,Distribution Requirement:
GGR,Indigenous Geographies,JIG440H1-F,,,,"This course draws on theoretical texts of Indigeneity, with a primary focus on Indigenous spaces in the Americas. Course participants will examine how core geographic concepts such as place, territory, land, movement and the scale of the body are sites of colonial dispossession and violence, as well as sites for decolonial and liberatory thought and practice. We will primarily engage with Indigenous-led scholarship within Geography and Indigenous Studies, and creative forms of knowledge production generated across Indigenous communities.","10.0 credits including one of INS200H1, INS201Y1, INS250H1, GGR107H1, GGR124H1, GGR240H1, GGR246H1, GGR254H1",Prerequisite:,GGR400H1 (Special Topics in Geography I: Indigenous Geographies); offered in Fall 2019,Exclusion:,Social Science,Distribution Requirement:,Room,LEC0101,Thursday,—,14:00,17:00,LA 341,https://map.utoronto.ca/?id=1809#!m/494544,"Daigle, M.",9,30,Yes: 0 student,In Person,,,Priority (P),Enrolment Controls:,"Priority enrolment is given to the groups of students listed below until July 28. There is no course enrolment on July 29. Beginning July 30, all other Arts & Science students can enrol in this section. UTM/UTSC students can enrol in this section starting August 6. The following groups of students are given priority access until July 28:",Indigenous Studies   (Faculty of Arts and Science),"Indigenous Studies   (John H. Daniels Faculty of Architecture, Landscape, & Design)",GEOGRAPHY    Major (Faculty of Arts and Science),GEOGRAPHY    Specialist (Faculty of Arts and Science),Society and its Institutions (3),Breadth Requirement:
FRE,Advanced Topics in French Literature,FRE441H1-F,,,,"An advanced, research-oriented seminar devoted to specific issues of French literature and culture. Focus on a literary genre, a particular subject or literary movement, or based on a multidisciplinary approach involving cinema, arts, and music. For more information, see","FRE240H1/FRE245H1, FRE241H1/FRE246H1, FRE345H1",Prerequisite:,Humanities,Distribution Requirement:,Creative and Cultural Representations (1),Breadth Requirement:,Room,LEC5101,Wednesday,—,17:00,19:00,NF 205,https://map.utoronto.ca/?id=1809#!m/494600,"Motsch, A.",15,20,Yes: 0 student,In Person,,,,,,,,,,,
FRE,French Language V: Written French,FSL442H1-F,Timetable instructions,Note:,The placement test  is mandatory for students who do not have the prerequisites.,Designed for students who wish to consolidate and perfect their writing abilities. Skills developped include the mastery of register-based differences; use of rhetorical and stylistic techniques; systematic self-correction; and the advanced use of reference tools including on-line dictionaries.,"FSL421Y1 or, upon first FRE/FSL enrolment, equivalent as determined by the French Placement Test",Prerequisite:,Humanities,Distribution Requirement:,Creative and Cultural Representations (1),Breadth Requirement:,Room,LEC0101,Thursday,—,11:00,14:00,,,"Faulkner, M.",27,60,Yes: 0 student,In Person,—,,Priority (P),Enrolment Controls:,"Priority enrolment is given to the groups of students listed below until July 28. There is no course enrolment on July 29. Beginning July 30, all other Arts & Science students can enrol in this section. UTM/UTSC students can enrol in this section starting August 6. The following groups of students are given priority access until July 28:",ASMAJ0120 MA FRENCH LANGUAGE LEARNING  - Year 4,ASSPE1295 SP FRENCH LANGUAGE & LIT  - Year 4,,,,
FRE,Advanced Topics: Authors,FRE443H1-S,,,,"An advanced, research-oriented seminar devoted to questions concerning the authors practice, originality, and oeuvre. Production, performance and prominence, characteristic genres, religious and philosophical thought, theoretical reflection on literature, language, and belonging as aspects of the analysis of one single authors body of writing. For more information, see","FRE240H1/FRE245H1, FRE241H1/FRE246H1, FRE345H1",Prerequisite:,Humanities,Distribution Requirement:,Creative and Cultural Representations (1),Breadth Requirement:,Room,LEC0101,Thursday,—,14:00,16:00,NF 009,https://map.utoronto.ca/?id=1809#!m/494600,"Abd-elrazak, L.",11,20,Yes: 0 student,In Person,,,,,,,,,,,
FRE,French Language V: Oral French,FSL443H1-S,Timetable instructions,Note:,The placement test  is mandatory for students who do not have the prerequisites.,Designed for students who wish to consolidate and perfect their speaking abilities. This is accomplished through the preparation of longer oral productions involving a rich vocabulary and contextually-appropriate speech registers. Focus on overall pronunciation including fine phonetic detail and fluency.,"FSL421Y1 or, upon first FRE/FSL enrolment, equivalent as determined by the French Placement Test.",Prerequisite:,Not open to fluent or native speakers of French.,Exclusion:,Humanities,Distribution Requirement:,Room,LEC0101,Wednesday,—,12:00,15:00,CR 403,https://map.utoronto.ca/?id=1809#!m/494580,"Beeharry Paray, G.",0,35,Yes: 6 students,In Person,,,Priority (P),Enrolment Controls:,"Priority enrolment is given to the groups of students listed below until July 28. There is no course enrolment on July 29. Beginning July 30, all other Arts & Science students can enrol in this section. UTM/UTSC students can enrol in this section starting August 6. The following groups of students are given priority access until July 28:",ASMAJ0120 MA FRENCH LANGUAGE LEARNING  - Year 4,ASSPE1295 SP FRENCH LANGUAGE & LIT  - Year 4,,,Creative and Cultural Representations (1),Breadth Requirement:
GGR,"Entanglements of Power: Race, Sexuality and the City",GGR456H1-F,,,,"This course investigates the city as a space sculpted by particular configurations and relations of power, and productive of those forms. It considers shifting urban geographies of identity, economy and desire with a focus on race and racism, settler colonialism, empire, the laboring body, sexuality, and sexual identity. Course participants will engage a series of case studies of particular urban spaces and struggles, drawing on conceptual support from scholarship in urban geography, anti-colonial thought, political economy, black studies, feminist and queer theory, Indigenous and settler colonial studies, as well as literature and other artistic work.",10.0 FCEs,Prerequisite:,"GGR400H1 (Special Topics in Geography I: Entanglements of Power: Race, Sexuality and the City); offered in Fall 2018",Exclusion:,2.0 FCEs in GGR,Recommended Preparation:,Room,LEC5101,Wednesday,—,17:00,20:00,HS 100,https://map.utoronto.ca/?id=1809#!m/494459,"Cowen, D.",2,30,Yes: 0 student,In Person,,,Priority (P),Enrolment Controls:,"Priority enrolment is given to the groups of students listed below until July 28. There is no course enrolment on July 29. Beginning July 30, all other Arts & Science students can enrol in this section. UTM/UTSC students can enrol in this section starting August 6. The following groups of students are given priority access until July 28:",GEOGRAPHY  Department of Geography and Planning  Major (Faculty of Arts and Science),GEOGRAPHY  Department of Geography and Planning  Specialist (Faculty of Arts and Science),"GEOGRAPHY  Department of Geography and Planning  Major (John H. Daniels Faculty of Architecture, Landscape, & Design)","GEOGRAPHY  Department of Geography and Planning  Specialist (John H. Daniels Faculty of Architecture, Landscape, & Design)",Social Science,Distribution Requirement:
GGR,GIS Research Project,GGR462H1-S,,,,"Students work in groups to develop their own research project and then acquire, organize and analyze geographic data to complete it. Emphasis is placed on research design, project management and the application of GIS concepts and skills learned in previous courses to a practical problem.",GGR373H1,Prerequisite:,10.0 credits,Recommended Preparation:,"Science, Social Science",Distribution Requirement:,Room,LEC0101,Tuesday,—,12:00,14:00,OI 8201,https://map.utoronto.ca/?id=1809#!m/494563,,10,30,Yes: 0 student,In Person,,—,Priority (P),Enrolment Controls:,"Priority enrolment is given to the groups of students listed below until July 28. There is no course enrolment on July 29. Beginning July 30, all other Arts & Science students can enrol in this section. UTM/UTSC students can enrol in this section starting August 6. The following groups of students are given priority access until July 28:",GEOGRAPHY    Major (Faculty of Arts and Science),GEOGRAPHY    Specialist (Faculty of Arts and Science),"GEOGRAPHY    Major (John H. Daniels Faculty of Architecture, Landscape, & Design)","GEOGRAPHY    Specialist (John H. Daniels Faculty of Architecture, Landscape, & Design)",The Physical and Mathematical Universes (5),Breadth Requirement:
FRE,Medieval French Language,FRE471H1-F,,,,"This course aims to ensure an understanding of Old French, to read most of the medieval texts. From a selection of texts, it explores the form of the language in various centuries and regions and provide a basis for understanding the history of the French language. This course is also listed in the offerings of the Graduate department of French.",FRE272H1/FRE273H1,Prerequisite:,Humanities,Distribution Requirement:,Creative and Cultural Representations (1),Breadth Requirement:,Room,LEC0101,Monday,—,16:00,18:00,TF 202,https://map.utoronto.ca/?id=1809#!m/494581,"Kullmann, D.",25,30,Yes: 0 student,In Person,,,,,,,,,,,
