RLG,Ghosts to Ancestors: Racialized Hauntings and Reparative Promise in Psychoanalysis,RLG419H1-S,,,,Course Description:,"All forms of injustice disfigure both societies and psyches. Racist, sexist, and other unconscious fantasies of evil and persecuting ‘others’ generate social injustice. At the same time, social injustice distorts the mind. This “dual track” process can drive human beings and their societies mad. Justice depends upon transformations of social structures and moral codes as well as changes within human minds. In order for psychoanalysis to realize its own potential for facilitating justice, it must confront its own historical contribution to injustice. Through a close reading of selected texts from Sigmund Freud and the activist psychiatrist Franz Fanon, this course explores the inherent tensions between colonizing and emancipatory themes within psychoanalytic discourses. Both Freud and Fanon contribute to a psychoanalytic critical theory that have influenced several contemporary ethnographic writers who explore the intricate ways in which social and cultural realities are internalized as unconscious hauntings and tormenting spirits across generations.",RLG211H1/RLG301H1/RLG302H1,Recommended Preparation:,Humanities,Distribution Requirement:,"Thought, Belief and Behaviour (2)",Breadth Requirement:,,,Room,LEC0101,Tuesday,,"Hewitt, M.",of  available,4,10,Yes: 0 student,In Person,,,,,,,,,,,,,,IN 209,—,14:00,16:00,https://map.utoronto.ca/?id=1809#!m/494541
PSY,Social Psychology Seminar,PSY420H1-F,Timetable instructions,Note:,"Enrolment priority for this course is given to Psychology Specialists and Research Specialists. After the priority period has ended, students must contact the Undergraduate Administrator to be enrolled directly into the course or added to the waitlist by emailing psy.undergrad@utoronto.ca.",Course Description:,Examination in depth of a limited topic within social psychology. Content in any given year depends on instructor. Course capacity is limited to 20 students and enrolment priority is given to PSY Specialists and Research Specialists.,"PSY202H1/ECO220Y1/SOC252H1/STA221H1/PSY202H5/STA221H5/PSYC08H3/STAB27H3/STAC32H3, and PSY220H1/PSY220H5/PSYB10H3/SOC213H1",Prerequisite:,PSY420H5/PSYD12H3/PSYD15H3/PSYD16H3,Exclusion:,Science,Distribution Requirement:,"Thought, Belief and Behaviour (2)",Breadth Requirement:,Room,LEC0101,Tuesday,,"MacDonald, G.",of  available,0,20,No,In Person,"Priority, then Enrol at Department (PE)",Enrolment Controls:,"Priority enrolment on ACORN is given to the groups of students listed below until July 28. There is no course enrolment on July 29. Beginning July 30, all students must request permission to enrol in this section by contacting the sponsoring department. Please see Timetable Instructions tab for contact information. The following groups of students are given priority access on ACORN until July 28:",ASSPE1160 SP PSYCHOLOGY,ASSPE1958 SP PSYCHOLOGY RESEARCH(THESIS),,,,,,,Subtitle,,BL 312,—,13:00,15:00,https://map.utoronto.ca/?id=1809#!m/494536
PSY,Social Psychology Seminar,PSY420H1-S,Timetable instructions,Note:,"Enrolment priority for this course is given to Psychology Specialists and Research Specialists. After the priority period has ended, students must contact the Undergraduate Administrator to be enrolled directly into the course or added to the waitlist by emailing psy.undergrad@utoronto.ca.",Course Description:,Examination in depth of a limited topic within social psychology. Content in any given year depends on instructor. Course capacity is limited to 20 students and enrolment priority is given to PSY Specialists and Research Specialists.,"PSY202H1/ECO220Y1/SOC252H1/STA221H1/PSY202H5/STA221H5/PSYC08H3/STAB27H3/STAC32H3, and PSY220H1/PSY220H5/PSYB10H3/SOC213H1",Prerequisite:,PSY420H5/PSYD12H3/PSYD15H3/PSYD16H3,Exclusion:,Science,Distribution Requirement:,"Thought, Belief and Behaviour (2)",Breadth Requirement:,Room,LEC0101,Tuesday,BA 2179,"Neel, R.",of  available,0,20,No,In Person,"Priority, then Enrol at Department (PE)",Enrolment Controls:,"Priority enrolment on ACORN is given to the groups of students listed below until July 28. There is no course enrolment on July 29. Beginning July 30, all students must request permission to enrol in this section by contacting the sponsoring department. Please see Timetable Instructions tab for contact information. The following groups of students are given priority access on ACORN until July 28:",ASSPE1160 SP PSYCHOLOGY,ASSPE1958 SP PSYCHOLOGY RESEARCH(THESIS),ASSPE1160 SP PSYCHOLOGY,ASSPE1958 SP PSYCHOLOGY RESEARCH(THESIS),,,,,Subtitle,—,UC 44,—,10:00,12:00,https://map.utoronto.ca/?id=1809#!m/494517
RLG,Fragments of Redemption:  Sigmund Freud and Theodor Adorno,RLG421H1-S,,,,Course Description:,"This course will challenge the prevailing view that the thought of Sigmund Freud and Theodor Adorno are so deeply pessimistic as to be devoid of hope. Freud’s psychoanalytic theories are widely (mis)interpreted in the register of a crude pansexualism and biological determinism. Adorno’s critique of society and the individual is often (mis)interpreted as so ruthlessly pervasive that it forecloses on any possibility for emancipatory transformation. This is a distorted view of both thinkers, that misses the hopeful, utopian currents that motivate and shape psychoanalysis and critical theory. The course will explore the emancipatory currents in Freud and Adorno, and their implications for potentialities of individual, social and ecological transformation.",Permission of instructor,Prerequisite:,Humanities,Distribution Requirement:,"Thought, Belief and Behaviour (2)",Breadth Requirement:,,,Room,LEC0101,Monday,,"Hewitt, M.",of  available,8,10,Yes: 0 student,In Person,Enrol at Department (E),Enrolment Controls:,Enrolment via ACORN is not available. Students must request permission to enrol in this course by contacting the sponsoring department. Please see Timetable Instructions tab for contact information.,,,,,,,,,Subtitle,,TC 24,—,11:00,13:00,https://map.utoronto.ca/?id=1809#!m/494461
PSY,Social Psychology of Interpersonal Relationships,PSY424H1-F,,,,Course Description:,"This lecture course focuses on the social psychology of interpersonal relationships between individuals, especially romantic or close relationships and friendships. It surveys what social psychologists have learned about the development, maintenance, disruption or dissolution of personal relationships, as well as current social psychological theories of interpersonal relationships.","PSY201H1/ECO220Y1/EEB225H1/GGR270H1/POL222H1/SOC202H1/STA220H1/STA238H1/STA248H1/STA288H1/PSY201H5/STA215H5/STA220H5/PSYB07H3/STAB22H3/STAB23H3/STAB57H3, and PSY220H1/PSY220H5/PSYB10H3/SOC213H1",Prerequisite:,PSY327H5/PSYD11H3,Exclusion:,Science,Distribution Requirement:,"Thought, Belief and Behaviour (2)",Breadth Requirement:,Room,LEC0101,Tuesday,SS 1086,"Midgley, C.",of  available,0,50,Yes: 0 student,In Person,Priority (P),Enrolment Controls:,"Priority enrolment is given to the groups of students listed below until July 28. There is no course enrolment on July 29. Beginning July 30, all other Arts & Science students can enrol in this section. UTM/UTSC students can enrol in this section starting August 6. The following groups of students are given priority access until July 28:",ASFOC1540F FOC SOCIAL PSYCHOLOGY,ASFOC2270F FOC SOCIAL PSYCHOLOGY,ASMAJ1160 MA PSYCHOLOGY,ASMIN1160 MI PSYCHOLOGY,ASSPE1160 SP PSYCHOLOGY,,,,,,WI 1017,—,11:00,14:00,https://map.utoronto.ca/?id=1809#!m/494503
PSY,Social Psychology of Interpersonal Relationships,PSY424H1-S,,,,Course Description:,"This lecture course focuses on the social psychology of interpersonal relationships between individuals, especially romantic or close relationships and friendships. It surveys what social psychologists have learned about the development, maintenance, disruption or dissolution of personal relationships, as well as current social psychological theories of interpersonal relationships.","PSY201H1/ECO220Y1/EEB225H1/GGR270H1/POL222H1/SOC202H1/STA220H1/STA238H1/STA248H1/STA288H1/PSY201H5/STA215H5/STA220H5/PSYB07H3/STAB22H3/STAB23H3/STAB57H3, and PSY220H1/PSY220H5/PSYB10H3/SOC213H1",Prerequisite:,PSY327H5/PSYD11H3,Exclusion:,Science,Distribution Requirement:,"Thought, Belief and Behaviour (2)",Breadth Requirement:,Room,LEC0101,Tuesday,SS 1070,"MacDonald, G.",of  available,0,50,Yes: 9 students,In Person,Priority (P),Enrolment Controls:,"Priority enrolment is given to the groups of students listed below until July 28. There is no course enrolment on July 29. Beginning July 30, all other Arts & Science students can enrol in this section. UTM/UTSC students can enrol in this section starting August 6. The following groups of students are given priority access until July 28:",ASFOC1540F FOC SOCIAL PSYCHOLOGY,ASFOC2270F FOC SOCIAL PSYCHOLOGY,ASMAJ1160 MA PSYCHOLOGY,ASMIN1160 MI PSYCHOLOGY,ASSPE1160 SP PSYCHOLOGY,,,,,—,SS 2110,—,13:00,16:00,https://map.utoronto.ca/?id=1809#!m/494510
PSY,Motivational Theories in Social Psychology,PSY426H1-F,Delivery instructions,Note:,This discussion-based course will meet via BbCollaborate. Recordings of each session will be posted on the course Quercus page. All course materials and assignments will be managed via Quercus. It is recommended that students have a computer with a microphone and camera in order to participate in the discussions.,Course Description:,"With intensive reading and discussion of ‘classic’ and contemporary articles, this advanced lecture course in social psychology focuses on the central issues, methods, and findings in the study of motivation. Topics include self-regulation, achievement, and reward/punishment.","PSY201H1/ECO220Y1/EEB225H1/GGR270H1/POL222H1/SOC202H1/STA220H1/STA238H1/STA248H1/STA288H1/PSY201H5/STA215H5/STA220H5/PSYB07H3/STAB22H3/STAB23H3/STAB57H3, and PSY220H1/PSY220H5/PSYB10H3/SOC213H1",Prerequisite:,Science,Distribution Requirement:,"Thought, Belief and Behaviour (2)",Breadth Requirement:,,,Room,LEC9901,Friday,—,"Plaks, J.",of  available,12,50,Yes: 0 student,Online - Synchronous (See Delivery Instructions.),Priority (P),Enrolment Controls:,"Priority enrolment is given to the groups of students listed below until July 28. There is no course enrolment on July 29. Beginning July 30, all other Arts & Science students can enrol in this section. UTM/UTSC students can enrol in this section starting August 6. The following groups of students are given priority access until July 28:",ASFOC1540F FOC SOCIAL PSYCHOLOGY,ASFOC2270F FOC SOCIAL PSYCHOLOGY,ASMAJ1160 MA PSYCHOLOGY,ASMIN1160 MI PSYCHOLOGY,ASSPE1160 SP PSYCHOLOGY,,,,,,,—,10:00,13:00,
RLG,Religion in the Public Sphere: Community-Engaged Learning,RLG426H1-S,,,,Course Description:,"For upper-year students, from any discipline. In a 30-hour community service placement, discover first-hand religion’s significance in Toronto and examine how religion manifests in public spaces, institutions, and interactions, while critically reflecting on the experience of working in settings where religious diversity is at play. The Religion in the Public Sphere (RPS) coordinator's permission is required for admission to the course.",RPS coordinator's permission,Prerequisite:,Humanities,Distribution Requirement:,,,,,Room,LEC0101,Wednesday,,"Bugg, L.",of  available,14,15,Yes: 0 student,In Person,Enrol at Department (E),Enrolment Controls:,Enrolment via ACORN is not available. Students must request permission to enrol in this course by contacting the sponsoring department. Please see Timetable Instructions tab for contact information.,,,,,,,,,,,OI 11200,—,13:00,15:00,https://map.utoronto.ca/?id=1809#!m/494563
PSY,Media Psychology,PSY427H1-F,,critical media literacy,,Course Description:,"This course in  examines how we come to understand ourselves and our world, and learn to feel, evaluate, and act, through the simulative mediation of information and communication technologies. The aim is to provide students with a deeper understanding of the dynamic symbolic environment that surrounds them and in which they participate as both audience and producer. The approach is multidisciplinary, drawing not only from psychology but a broad range of influential perspectives in the social sciences and humanities. The topics explored reveal how developments in the world of media are central to understanding changing forms of public and private life in the 21st century.","PSY201H1/ECO220Y1/EEB225H1/GGR270H1/POL222H1/SOC202H1/STA220H1/STA238H1/STA248H1/STA288H1/PSY201H5/STA215H5/STA220H5/PSYB07H3/STAB22H3/STAB23H3/STAB57H3, and PSY220H1/PSY220H5/PSYB10H3/SOC213H1",Prerequisite:,Science,Distribution Requirement:,"Thought, Belief and Behaviour (2)",Breadth Requirement:,,,Room,LEC0101,Tuesday,,"Tafarodi, R.",of  available,9,50,Yes: 0 student,In Person,Priority (P),Enrolment Controls:,"Priority enrolment is given to the groups of students listed below until July 28. There is no course enrolment on July 29. Beginning July 30, all other Arts & Science students can enrol in this section. UTM/UTSC students can enrol in this section starting August 6. The following groups of students are given priority access until July 28:",ASMAJ1160 MA PSYCHOLOGY,ASMIN1160 MI PSYCHOLOGY,ASSPE1160 SP PSYCHOLOGY,ASSPE1958 SP PSYCHOLOGY RESEARCH(THESIS),,,,,,,SS 1084,—,12:00,15:00,https://map.utoronto.ca/?id=1809#!m/494510
PSY,Media Psychology,PSY427H1-S,,critical media literacy,,Course Description:,"This course in  examines how we come to understand ourselves and our world, and learn to feel, evaluate, and act, through the simulative mediation of information and communication technologies. The aim is to provide students with a deeper understanding of the dynamic symbolic environment that surrounds them and in which they participate as both audience and producer. The approach is multidisciplinary, drawing not only from psychology but a broad range of influential perspectives in the social sciences and humanities. The topics explored reveal how developments in the world of media are central to understanding changing forms of public and private life in the 21st century.","PSY201H1/ECO220Y1/EEB225H1/GGR270H1/POL222H1/SOC202H1/STA220H1/STA238H1/STA248H1/STA288H1/PSY201H5/STA215H5/STA220H5/PSYB07H3/STAB22H3/STAB23H3/STAB57H3, and PSY220H1/PSY220H5/PSYB10H3/SOC213H1",Prerequisite:,Science,Distribution Requirement:,"Thought, Belief and Behaviour (2)",Breadth Requirement:,,,Room,LEC0101,Tuesday,,"Tafarodi, R.",of  available,0,50,Yes: 2 students,In Person,Priority (P),Enrolment Controls:,"Priority enrolment is given to the groups of students listed below until July 28. There is no course enrolment on July 29. Beginning July 30, all other Arts & Science students can enrol in this section. UTM/UTSC students can enrol in this section starting August 6. The following groups of students are given priority access until July 28:",ASMAJ1160 MA PSYCHOLOGY,ASMIN1160 MI PSYCHOLOGY,ASSPE1160 SP PSYCHOLOGY,ASSPE1958 SP PSYCHOLOGY RESEARCH(THESIS),,,,,,,SS 1084,—,12:00,15:00,https://map.utoronto.ca/?id=1809#!m/494510
PSY,Critical Psychology,PSY428H1-S,,,,Course Description:,"This course examines the place of psychology in broader society and culture. What are the consequences of our research and professional practices for how we understand and govern ourselves and others? What is the basis and extent of our authority and power to describe, define, and explain human behaviour and experience? How do our values direct our activities and interpretations as psychologists? How can we critically evaluate the assumptions, commitments, and achievements of our discipline in relation to real or imagined alternatives?","PSY201H1/ECO220Y1/EEB225H1/GGR270H1/POL222H1/SOC202H1/STA220H1/STA238H1/STA248H1/STA288H1/PSY201H5/STA215H5/STA220H5/PSYB07H3/STAB22H3/STAB23H3/STAB57H3, and PSY220H1/PSY220H5/PSYB10H3/SOC213H1",Prerequisite:,Science,Distribution Requirement:,"Thought, Belief and Behaviour (2)",Breadth Requirement:,,,Room,LEC0101,Thursday,,"Tafarodi, R.",of  available,13,50,Yes: 0 student,In Person,Priority (P),Enrolment Controls:,"Priority enrolment is given to the groups of students listed below until July 28. There is no course enrolment on July 29. Beginning July 30, all other Arts & Science students can enrol in this section. UTM/UTSC students can enrol in this section starting August 6. The following groups of students are given priority access until July 28:",ASMAJ1160 MA PSYCHOLOGY,ASMIN1160 MI PSYCHOLOGY,ASSPE1160 SP PSYCHOLOGY,ASSPE1958 SP PSYCHOLOGY RESEARCH(THESIS),,,,,,,SS 2105,—,12:00,15:00,https://map.utoronto.ca/?id=1809#!m/494510
RLG,Advanced Topics in Judaism,RLG430H1-S,,,,Course Description:,Advanced Topics in Judaism,Permission of instructor,Prerequisite:,Humanities,Distribution Requirement:,,,,,Room,LEC0101,Thursday,,"Novak, D.",of  available,11,12,Yes: 0 student,In Person,,,,,,,,,,,,Subtitle,,TF 2,—,10:00,12:00,https://map.utoronto.ca/?id=1809#!m/494581
RLG,Advanced Topics in Judaism,RLG431H1-F,,,,Course Description:,"Some topic of central interest to students of religion, treated on a once-only basis. If the course is offered during the year, a detailed course description of the topic will be available under current courses in the undergraduate section of the Department’s website. As these courses are offered simultaneously as graduate level courses, students interested in taking them are encouraged to contact the instructor.",Completion of 9.0 credits,Prerequisite:,Humanities,Distribution Requirement:,,,,,Room,LEC0101,Monday,,"Fox, H.",of  available,12,12,Yes: 0 student,In Person,,,,,,,,,,,,Subtitle,,BF 214,—,15:00,17:00,https://map.utoronto.ca/?id=1809#!m/494497
PSY,Environmental Psychology,PSY435H1-S,,,,Course Description:,"This lecture course explores how psychologists can contribute to finding solutions to today's pressing environmental challenges. Topics include persuasion, community-based social marketing, social influence, social capital, and the many ways in which the physical environment affects psychological processes. The course takes a multi-scalar approach to the human-environment relationship, covering individual, community, cultural and global levels of scale, through the lens of complex dynamic systems theories.","PSY100H1/PSY100Y5/(PSYA01H3 + PSYA02H3); and PSY220H1/PSY220H5/PSYB10H3/SOC213H1, OR registered in an Environmental Studies/Science program",Prerequisite:,PSY201H1/ECO220Y1/EEB225H1/GGR270H1/POL222H1/SOC202H1/STA220H1/STA238H1/STA248H1/STA288H1/PSY201H5/STA215H5/STA220H5/PSYB07H3/STAB22H3/STAB23H3/STAB57H3,Recommended Preparation:,Science,Distribution Requirement:,"Thought, Belief and Behaviour (2)",Breadth Requirement:,Room,LEC0101,Tuesday,RW 143,,of  available,5,50,Yes: 0 student,In Person,Priority (P),Enrolment Controls:,"Priority enrolment is given to the groups of students listed below until July 28. There is no course enrolment on July 29. Beginning July 30, all other Arts & Science students can enrol in this section. UTM/UTSC students can enrol in this section starting August 6. The following groups of students are given priority access until July 28:",ASMAJ1160 MA PSYCHOLOGY,ASMIN1160 MI PSYCHOLOGY,ASSPE1160 SP PSYCHOLOGY,ASSPE1958 SP PSYCHOLOGY RESEARCH(THESIS),,,,,,—,RW 143,—,14:30,16:00,https://map.utoronto.ca/?id=1809#!m/494515
POL,Topics in Comparative Politics I,POL438H1-F,Timetable instructions,Note:,Delivery Method:,Course Description:,Selected issues in comparative politics. Vary from year to year.,2.0 POL credits,Prerequisite:,Social Science,Distribution Requirement:,Society and its Institutions (3),Breadth Requirement:,,,Room,LEC0101,Wednesday,,"Wu, N.",of  available,0,15,Yes: 0 student,In Person (See Delivery Instructions.),Priority (P),Enrolment Controls:,"Priority enrolment is given to the groups of students listed below until July 28. There is no course enrolment on July 29. Beginning July 30, all other Arts & Science students can enrol in this section. UTM/UTSC students can enrol in this section starting August 6. The following groups of students are given priority access until July 28:",ASMAJ2015 MA POLITICAL SCIENCE  - Year 4,ASSPE2015 SP POLITICAL SCIENCE  - Year 4,,,,LEC0101:  IN PERSON,Delivery instructions,Note:,Subtitle,,BL 113,—,14:00,16:00,https://map.utoronto.ca/?id=1809#!m/494536
POL,Topics in Latin American Politics,POL442H1-S,Timetable instructions,Note:,Delivery Method:  IN PERSON,Course Description:,"The seminar focuses on five countries in the Andean region of Latin America: Venezuela, Colombia, Ecuador, Peru and Bolivia. First part deals with the challenges to democracy in the region. Second part explores potential solutions - in particular the drafting of new constitutions by popularly elected constituent assemblies.",(POL201H1/POL201Y1/POLB90H3/POLB91H3); (POL305H1/POL305Y1),Prerequisite:,Social Science,Distribution Requirement:,Society and its Institutions (3),Breadth Requirement:,,,Room,LEC0101,Thursday,,"Balaguera Cuervo, M.",of  available,0,15,Yes: 1 student,In Person (See Delivery Instructions.),Priority (P),Enrolment Controls:,"Priority enrolment is given to the groups of students listed below until July 28. NOTE: Spaces for each priority group in this course are not equal, and each priority group has its own waitlist until July 28. As of July 30, the waitlists for each priority group merge into one, and your rank on the waitlist may change; this is also when other Arts & Science students can begin to enrol. Beginning August 4, other downtown campus students can enrol in this section. There is no course enrolment on August 5. UTM/UTSC students can enrol in this section starting August 6. The following groups of students are given priority access until July 28:",ASMAJ2015 MA POLITICAL SCIENCE  - Year 4,"ASSPE1228 SP PEACE, CONFLICT & JUSTICE  - Year 4",ASSPE1469 SP INTERNATIONAL RELATIONS  - Year 4,ASSPE2015 SP POLITICAL SCIENCE  - Year 4,ERSPE2015 SP POLITICAL SCIENCE  - Year 4,Seminar will be delivered in person.,Delivery instructions,Note:,Subtitle,,LA 340,—,14:00,16:00,https://map.utoronto.ca/?id=1809#!m/494544
POL,Topics in Comparative Politics II,POL443H1-F,Timetable instructions,Note:,Delivery Method:  IN PERSON,Course Description:,Selected issues in comparative politics. Vary from year to year.,2.0 POL credits,Prerequisite:,Social Science,Distribution Requirement:,Society and its Institutions (3),Breadth Requirement:,,,Room,LEC0101,,,,,,,,,,,,,,,,,Seminar will be delivered in person.,Delivery instructions,Note:,Subtitle,—,,,,,
POL,Topics in Comparative Politics II,POL443H1-S,Timetable instructions,Note:,Delivery Method:  IN PERSON,Course Description:,Selected issues in comparative politics. Vary from year to year.,2.0 POL credits,Prerequisite:,Social Science,Distribution Requirement:,Society and its Institutions (3),Breadth Requirement:,,,Room,LEC0101,Tuesday,,"Maile, U.",of  available,0,10,Yes: 6 students,In Person (See Delivery Instructions.),Priority (P),Enrolment Controls:,"Priority enrolment is given to the groups of students listed below until July 28. There is no course enrolment on July 29. Beginning July 30, all other Arts & Science students can enrol in this section. UTM/UTSC students can enrol in this section starting August 6. The following groups of students are given priority access until July 28:",ASMAJ2015 MA POLITICAL SCIENCE  - Year 4,ASSPE2015 SP POLITICAL SCIENCE  - Year 4,,,,Seminar will be delivered in person.,Delivery instructions,Note:,Subtitle,,OI 3312,—,14:00,16:00,https://map.utoronto.ca/?id=1809#!m/494563
POL,Political Economy of Development,POL447H1-S,Timetable instructions,Note:,Delivery Method:  IN PERSON,Course Description:,"The course explores the rise, evolution, and performance of the dominant neoliberal approach to development and poverty reduction. It also assesses the feasibility and efficacy of alternative development strategies. Case studies are drawn from Latin America, Asia, and Africa.",POL201H1/POL201Y1/POL218H1/POL301H1/POL301Y1/POL305H1/POL305Y1/POL309H1/POL325H1/POLB90H3/POLB91H3,Prerequisite:,Introductory economics is helpful,Recommended Preparation:,Social Science,Distribution Requirement:,Society and its Institutions (3),Breadth Requirement:,Room,LEC0101,Tuesday,,"Eyoh, D.",of  available,0,25,Yes: 0 student,In Person (See Delivery Instructions.),Priority (P),Enrolment Controls:,"Priority enrolment is given to the groups of students listed below until July 28. NOTE: Spaces for each priority group in this course are not equal, and each priority group has its own waitlist until July 28. As of July 30, the waitlists for each priority group merge into one, and your rank on the waitlist may change; this is also when other Arts & Science students can begin to enrol. Beginning August 4, other downtown campus students can enrol in this section. There is no course enrolment on August 5. UTM/UTSC students can enrol in this section starting August 6. The following groups of students are given priority access until July 28:",ASMAJ2015 MA POLITICAL SCIENCE  - Year 4,"ASSPE1228 SP PEACE, CONFLICT & JUSTICE  - Year 4",ASSPE2015 SP POLITICAL SCIENCE  - Year 4,,,Seminar will be delivered in person.,Delivery instructions,Note:,,,LA 340,—,10:00,12:00,https://map.utoronto.ca/?id=1809#!m/494544
